Title,FullText,Author,Url,Date
Komisi III DPR Dukung MoU Kejagung-Operator Seluler,"Anggota Komisi III DPR, Martin Tumbelaka mengaku mendukung nota kesepahaman atau MoU Kejaksaan Agung (Kejagung) dengan sejumlah operator telekomunikasi terkait penyadapan. Martin menyebut kerja sama itu harus dibarengi dengan mekanisme pengawasan yang ketat untuk mencegah penyalahgunaan wewenang. Terutama karena menyangkut privasi data warga negara. ADVERTISEMENT SCROLL TO CONTINUE WITH CONTENT ""Sebagai anggota Komisi III, kami mendukung MoU penyadapan dalam konteks penegakan hukum. Namun, kerja sama ini harus dibarengi dengan mekanisme pengawasan yang ketat untuk mencegah penyalahgunaan wewenang dan tuduhan berbagai pihak terkait privasi data warga negara,"" kata Martin dalam keterangannya, Sabtu (28/6). Martin menggarisbawahi beberapa poin krusial yang perlu diperhatikan, misalnya perlindungan hak privasi. Menurut dia, penyadapan harus benar-benar terbatas pada kasus-kasus pidana berat dan korupsi melalui proses perizinan yang jelas. ""Tetapi kita tahu kondisi kejahatan era sekarang itu terutama pencucian uang dan pelacakan buronan itu sangat dinamis, sementara penegak hukum kita berkejaran agar pelaku tidak membawa kabur uang negara,"" kata Martin. Martin turut mengingatkan agar Kejagung tetap menjaga akuntabilitas prosedur. MoU tersebut, kata dia, perlu menjelaskan secara rinci prosedur penyadapan, termasuk mekanisme pelaporan dan evaluasi. ""Kami mendorong sinergi dengan Komnas HAM dan Komisi Informasi untuk memastikan keseimbangan antara kebutuhan penegakan hukum dan perlindungan hak sipil,"" ujarnya. Politikus Partai Gerindra itu mengapresiasi inisiatif Kejagung memerangi kejahatan dalam memaksimalkan penegakan hukum, terutama pemberantasan tindak pidana korupsi. Namun, kata Martin, kekuasaan penyadapan adalah pisau bermata dua yang harus digunakan hati-hati. ""Komisi III DPR akan terus melakukan pengawasan terhadap implementasi MoU ini untuk memastikan tidak ada penyimpangan,"" ujarnya. Sebelumnya Kejagung meneken kerja sama atau nota kesepakatan dengan empat operator telekomunikasi terkait dengan dukungan penegakan hukum. Jaksa Agung Muda Intelijen Reda Manthovani menyebut kerja sama ini berfokus pada pertukaran dan pemanfaatan data atau informasi dalam rangka penegakan hukum. ""Termasuk pemasangan dan pengoperasian perangkat penyadapan informasi serta penyediaan rekaman informasi telekomunikasi,"" ujarnya dalam keterangan tertulis, dikutip Rabu (25/6). ",Penulis tidak ditemukan,https://www.cnnindonesia.com/nasional/20250628194312-32-1244739/komisi-iii-dpr-dukung-mou-kejagung-operator-seluler,2025/06/28 20:01:51
VIDEO: Trump Sesumbar Gencatan Senjata di Gaza Tercapai dalam Sepekan,"Presiden Amerika Serikat Donald Trump menyatakan bahwa kemungkinan gencatan senjata di Gaza dapat tercapai dalam waktu satu minggu. Pernyataan itu ia sampaikan dalam sebuah acara di Gedung Oval pada Jumat (27/6), saat merayakan kesepakatan antara Kongo dan Rwanda. Trump mengatakan telah berbicara dengan beberapa pihak yang terlibat dalam upaya menghentikan pertempuran antara Israel dan Hamas, dan meyakini bahwa kesepakatan sudah semakin dekat.",REUTERS,https://www.cnnindonesia.com/internasional/20250628123532-124-1244650/video-trump-sesumbar-gencatan-senjata-di-gaza-tercapai-dalam-sepekan,2025-06-28 14:31:37
VIDEO: Ratusan Ribu Warga Iran Hadiri Pemakaman Petinggi Militer,"Iran menggelar upacara pemakaman kenegaraan bagi sekitar 60 orang, termasuk sejumlah petinggi militer, yang tewas dalam perang melawan Israel pada Sabtu (28/6). Salah satu tokoh yang dimakamkan adalah Mayor Jenderal Mohammed Bagheri dari Korps Garda Revolusi Iran. Upacara pemakaman dimulai pukul 08.00 waktu setempat di Lapangan Enghelab, Teheran, lalu dilanjutkan dengan prosesi menuju Lapangan Azadi yang berjarak sekitar 11 kilometer. Dari 60 jenazah yang dimakamkan, empat di antaranya merupakan anak-anak.",REUTERS,https://www.cnnindonesia.com/internasional/20250628162033-124-1244708/video-ratusan-ribu-warga-iran-hadiri-pemakaman-petinggi-militer,2025-06-28 19:00:18
"Dafa Aziz, Anak Petani Cilacap yang Diterima 14 Kampus Luar Negeri","SMA UnggulanCT ArsaSukoharjo melahirkan lulusan terbaiknya, Dafa Aziz Firmansyah. Anak petani asalCilacap, Jawa Tengah itu diterima di 14 universitas ternama dari luar negeri. Dafa merupakan anak terakhir dari enam bersaudara. Dua orang tuanya berprofesi sebagai petani. Namun hal itu tidak membuyarkan mimpinya untuk meraih pendidikan setinggi mungkin. Ia adalah bungsu dari enam bersaudara. ""Saya satu-satunya anak dari enam bersaudara yang akan melanjutkan kuliah di keluarga saya,"" kata Dafa usai pelepasan Angkatan V SMA Unggulan CT Arsa Sukoharjo, Sabtu (28/6). ADVERTISEMENT SCROLL TO CONTINUE WITH CONTENT Dafa lulus dari SMP Negeri 1 Cipari, Cilacap, Jawa Tengah. Ia memutuskan untuk mendaftar ke SMA Unggulan CT Arsa Sukoharjo setelah mengikuti acara sosialisasi dari sekolah tersebut. Genap tiga bulan menjalani pendidikan di SMA Unggulan CT Arsa Sukoharjo, keluarga Dafa dilanda musibah. Ayahnya, terserang stroke. Dafa pun mengaku sempat ingin berhenti sekolah untuk membantu merawat ayahnya. Beruntung, ibunya, Suarti terus mendorong anak bungsunya itu untuk terus melanjutkan sekolah. ""Ibu bilang kalau Dafa ini anak terakhir dan Dafa harus kuliah. Ibu pun mau mengusahakan apapun untuk Dafa agar bisa kuliah,"" kata dia. Masa-masa pertama sekolah di SMA Unggulan CT Arsa Sukoharjo, Dafa sempat kaget. Ia merasa persaingan di sekolah tersebut jauh lebih ketat dibanding sekolah sebelumnya. Kondisi itu pun memicu jiwa kompetisi Dafa. Ia semakin rajin belajar agar bisa mengimbangi prestasi teman-temannya. ""Di SMA CT Arsa lingkungannya sangat mendukung untuk berkompetisi karena teman-temannya rajin belajar, sehingga membuat saya terdorong dan semangat belajar,"" kata dia. Kerja kerasnya pun membuahkan hasil. Sejak semester ketiga, Dafa menempati peringkat 1 paralel. Tak hanya berprestasi di sekolah, Dafa juga aktif berkompetisi di olimpiade matematika dan menjadi Ketua Organisasi Siswa Intra Sekolah (OSIS). Dafa pun terus menorehkan prestasinya hingga lulus dari SMA Unggulan CT Arsa. Ia mendaftar ke 17 universitas kenamaan di luar negeri dengan Beasiswa Indonesia Maju. Dafa diterima di 14 dari 17 universitas tersebut. Delapan di antaranya berada di Australia yaitu University of Sydney (Advanced Computing), UNSW Sydney (Electrical Engineering), Monash University (Applied Data Science), The University of Queensland (Bachelor Of Engineering), RMIT University (Civil and Infrastructure Engineering), University of Adelaide (Electrical & Electronic Engineering),Curtin University (Mining Engineering), dan University of Western Australia (Computer Science). Dua kampus asal Amerika Serikat, yakni Cleveland State University (Chemical Engineering), University of New Orleans (Computer Science), La Roche University (Bachelor of Science in Chemistry), dan Saint Louis University (Business Finance). Kampus asal Belanda, yakni Wageningen University & Research (Food technology, dan Environmental Sciences). Terakhir Dafa diterima di Kampus Singapura, yakni Nanyang Technological University (Data science & Artificial Intelligence). ""Saya memilih University of Sydney jurusan Advanced Computing,"" kata dia. Kondisi Dafa yang serba kekurangan ternyata tak menghalangi Dafa meraih kesuksesan. Menurut Dafa, kendala ekonomi tidak seharusnya menjadi penghalang untuk berprestasi. ""Memang banyak orang berpikir masalah finansial itu menjadi kendala utama untuk menjalani pendidikan. Tapi menurut saya itu bukan sesuatu yang harus dikhawatirkan,"" kata dia. Ketatnya kompetisi juga tidak menggentarkan Dafa untuk terus meraih prestasi gemilang. Menurutnya, kunci kesuksesan justru berada pada kemampuan mengalahkan diri sendiri. ""Kita tidak perlu takut akan banyaknya anak yang berprestasi. Kita tidak perlu melawan mereka semua, kita hanya perlu melawan diri kita sendiri,"" kata dia. Sebelumnya, SMA Unggulan CT Arsa Foundation menggelar acara pelepasan siswa yang sudah lulus menempuh tahun ajaran 2024/2025, Sabtu (28/6). Jumlahnya 101 siswa yang berasal dari keluarga kurang mampu di Jawa Tengah, Yogyakarta, dan Jawa Timur. Pelepasan ini dihadiri langsung oleh Chairman CT Corp Chairul Tanjung dan Ketua Yayasan CT Arsa Foundation Anita Ratnasari Tanjung. Gubernur Jawa Tengah Ahmad Luthfi, Bupati Sukoharjo Etik Suryani, dan Ketua Pengawas CT Arsa Foundation Muhammad Nuh turut hadir dalam acara ini. ",Penulis tidak ditemukan,https://www.cnnindonesia.com/nasional/20250628151929-20-1244696/dafa-aziz-anak-petani-cilacap-yang-diterima-14-kampus-luar-negeri,2025/06/28 15:34:44
"Anggota TNI AL Dikeroyok di Terminal Malang, Kepala Berlumur Darah","Seorang anggotaTNIAngkatan Laut (AL) menjadi korbanpengeroyokandi Terminal Arjosari, Kota Malang, Jawa Timur (Jatim). Korban diduga dikeroyok juru penumpang (jupang). ""Korban dikeroyok oleh sekitar lima sampai enam orang. Dugaan sementara, para pelaku merupakan juru panggil penumpang (jupang),"" kata Kepala Terminal Arjosari Mega Perwira Donowati, mengutipdetikcom, Sabtu (28/6). Jupang ialah orang yang bertugas mencari penumpang untuk bus yang berasal resmi dari perusahaan otobus (PO) atau individu yang bekerja tak terikat di terminal (liar). ADVERTISEMENT SCROLL TO CONTINUE WITH CONTENT Dalam video beredar, bagian kepala anggota TNI AL itu tampak berlumuran darah. Darahnya juga berceceran di Terminal Arjosari. Polisi bersama Polisi Militer TNI AL telah menangkap sejumlah orang terkait kasus ini. ""Informasi terakhir, tiga orang yang diduga terlibat pengeroyokan sudah berhasil diamankan dan akan diserahkan ke pihak kepolisian untuk proses hukum lebih lanjut,"" katanya. Peristiwa itu terjadi sangat cepat dan sulit dikendalikan. Beberapa kru bus sempat mencoba melerai namun para pelaku bertindak sangat agresif. Setelah kejadian itu salah satu kru akhirnya membawa korban menjauh dan melapor ke petugas terminal. Baca berita lengkapnyadi sini.",Penulis tidak ditemukan,https://www.cnnindonesia.com/nasional/20250628154419-12-1244703/anggota-tni-al-dikeroyok-di-terminal-malang-kepala-berlumur-darah,2025/06/28 16:15:47
Haru Biru & Air Mata Bahagia di Pelepasan Siswa SMA CT Arsa Sukoharjo,"Pelepasan Siswa Angkatan V SMA Unggulan CT Arsa Sukoharjo digelar dengan sederhana dan penuh haru, Sabtu (28/6). Di tengah suasana gembira perayaan kelulusan 101 siswa berjuluk Atmaja Bentala itu, terselip momen-momen haru diwarnai tangis para siswa dan orang tua yang mendampingi. Keharuan juga turut dirasakan Ketua Yayasan CT Arsa Anita Ratnasari Tanjung dan Pembina Yayasan CT Arsa Chairul Tanjung. Keduanya tampak mengusap air mata saat kepala sekolah CT Arsa Foundation Sukoharjo Usdiyanto memaparkan siswa kurang mampu di CT Arsa Foundation Sukoharjo diterima di perguruan tinggi kelas dunia. ADVERTISEMENT SCROLL TO CONTINUE WITH CONTENT Keharuan berlanjut saat Anita menyampaikan sambutannya di podium, Anita mengingat latar belakang anak-anak yang berasal dari keluarga kurang mampu. Anita juga mengenang pengalamannya merintis CT Arsa Foundation. Yasayan tersebut didirikan setelah bencana Tsunami di Aceh tahun 2004 silam. Saat itu Anita bersama suaminya, Chairul Tanjung tersentuh dengan kondisi keluarga korban bencana. Mereka pun memutuskan untuk mendirikan sekolah gratis dengan kualitas terbaik untuk keluarga yang kurang beruntung. ""Kita mempunyai visi dan misi memutus mata rantai kemiskinan dengan pendidikan yang berkualitas dan kesehatan yang optimal melalui pijar pendidikan dan juga kesehatan pemberdayaan masyarakat dan kemanusiaan,"" kata Anita sambil menitikkan air mata. Gubernur Jawa Tengah Ahmad Luthfi yang duduk di sebelah Chairul Tanjung melihat CT berkaca-kaca. ""Saya duduk di sebelahnya Pak Chairul Tanjung. Beliau saya amati berkaca-kaca. Saya yakin di hati beliau berat melepas adik-adik sekalian,"" katanya. Mantan Kapolda Jateng itu pun mengaku ikut terharu dan berkaca-kaca karena ingat orang tuanya. Salah satu momen mengharu-biru itu terjadi saat Dafa Aziz Firmansyah mengungkapkan perasaannya. Sebagai lulusan terbaik SMA Unggulan CT Arsa Sukoharjo, Dafa berbicara di hadapan teman-teman dan tamu undangan. ""Kali ini saya datang didampingi sosok yang luar biasa, ibu saya, yang mana bulan Juni ini adalah ulang tahun beliau. Dan hari ini saya sangat bersyukur semua pencapaian yang saya peroleh itu adalah usaha dan saya tujukan sebagai kado untuk bapak ibu saya,"" kata Dafa dalam pidatonya. Tangis Dafa pecah saat ia menyebut ayahnya. Dafa sangat ingin ayahnya bisa hadir di momen bahagia kelulusannya itu. Sayangnya, sang ayah yang harus tinggal di rumahnya di Cilacap karena stroke yang dialaminya sejak Dafa baru menjalani tiga bulan pertama sekolah. ""Jika mungkin bapak saya menonton atau melihat saya berbicara di sini, saya ingin menyampaikan, Pak, kenapa bapak tidak hadir di sini? Kenapa bapak masih sakit,"" kata dia sambil meneteskan air mata. Kata-kata Dafa itu menyentuh hati para hadirin. Banyak tamu undangan yang hadir ikut meneteskan air mata. ""Dulu bapak saya yang sangat ingin menemani saya ketika wisuda karena bapak saya ingin sekali melihat CT Arsa itu seperti apa,"" tutur Dafa. Meski harus melalui ujian berat, Dafa berhasil menorehkan prestasi sebagai siswa terbaik SMA Unggulan CT Arsa Sukoharjo. Ia diterima di 14 universitas di luar negeri lewat Beasiswa Indonesia Maju (BIM). Dafa mengatakan keberhasilannya tersebut tak lepas dari peran orang tuanya. ""Bapak saya bukan orang yang lemah. Bapak saya adalah orang yang kuat. Dan di kesempatan yang luar biasa ini, dengan bangga saya ingin memperkenalkan bahwa saya adalah anak dari Bapak dan putra dari Ibu Suarti, seseorang yang sangat luar biasa,"" kata dia. Suasana haru kembali menyeruak saat para siswa diberi kesempatan untuk menemui orang tua masing-masing. Tak sedikit dari orang tua dan siswa yang meneteskan air mata pada momen tersebut. Anita berharap agar Angkatan V SMA Unggulan CT Arsa Sukoharjo bisa melanjutkan kesuksesan mereka di masa depan. ""Dan saya berharap agar mereka juga dapat bermanfaat dan juga dapat nantinya memutus mata rantai kemiskinan, dengan bidang pendidikan untuk pribadi mereka, keluarga mereka, untuk masyarakat, dan akhirnya untuk bangsa kita tercinta,"" kata Anita. Dafa, kata Anita, merupakan salah satu contoh kesulitan ekonomi tidak harus menjadi penghalang seseorang untuk meraih keberhasilan. ""Dafa ini adalah anak dari seorang ayah petani, ibundanya juga selalu merawat dan mengajarkan budi pekerti dan selalu menjunjung untuk mendapatkan pendidikan yang tertinggi untuk anak-anaknya,"" kata dia.",Penulis tidak ditemukan,https://www.cnnindonesia.com/nasional/20250628183151-20-1244730/haru-biru-air-mata-bahagia-di-pelepasan-siswa-sma-ct-arsa-sukoharjo,2025/06/28 18:47:15
"6 WNI Dievakuasi dari Iran Tiba di RI, 18 Orang Masih di Azerbaijan","Kementerian Luar Negeri Republik Indonesia (Kemlu RI) melaporkan bahwa enam warga negara Indonesia (WNI) yang dievakuasi dariIrantelah tiba di Jakarta pada Sabtu (28/6). ""Pada hari ini tanggal 28 Juni 2025 telah tiba 6 WNIevacueedari Iran yang menempuh perjalanan dengan rute Baku-Doha-Bangkok-Jakarta,"" kata Direktur Pelindungan WNI Kemlu RI Judha Nugraha melalui keterangan tertulis di Jakarta. ADVERTISEMENT SCROLL TO CONTINUE WITH CONTENT Judha mengatakan total ada 97 WNI yang dievakuasi imbas perang Iran dan Israel yang berkecamuk sejak 13 Juni lalu. Hingga Sabtu, pemerintah telah memulangkan 79 orang yang terdiri dari 78 WNI dan satu warga Iran. Sementara itu, 18 orang sisanya masih berada di Baku, Azerbaijan, dan akan dipulangkan secara bertahap pada 28 dan 29 Juni 2025. Judha mengatakan lima orang lagi dijadwalkan tiba di Jakarta pada 29 Juni 2025 dengan dua penerbangan berbeda. Jumlah orang yang masih berada di Baku yaitu 13 orang dengan jadwal kepulangan pada Minggu (29/6) besok dari Baku. Orang-orang yang dievakuasi pada gelombang terakhir tersebut dijadwalkan tiba di Jakarta pada 30 Juni 2025. ""Kemlu berkoordinasi erat dengan Perwakilan RI di negara-negara transit guna memastikan kelancaran dan keselamatan proses evakuasi,"" kata Judha. ",Penulis tidak ditemukan,https://www.cnnindonesia.com/internasional/20250628225334-106-1244761/6-wni-dievakuasi-dari-iran-tiba-di-ri-18-orang-masih-di-azerbaijan,2025/06/28 23:51:10
"Berapa Populasi Yahudi di New York, Kota Calon Walkot Zohran Mamdani?","NamaZohran Mamdanisegera mencuri perhatian publikAmerika Serikatdan dunia setelah namanya masuk kandidat terkuat Calon Wali Kota New York. Zohran, imigran keturunan India muslim ini menghadapi serangan verbal dari Presiden Donald Trump yang menyebutnya ""komunis gila"". ADVERTISEMENT SCROLL TO CONTINUE WITH CONTENT Zohran sendiri selama kampanye tidak pernah membawa identitas ras dan agama. Dia justeru berkampanye untuk pembenahan transportasi publik seperti kereta bawah tanah. Tidak heran bila dia didukung oleh banyak warga dari berbagai latar belakang, termasuk kaum Yahudi New York, yang jumlahnya kini mencapai 1,9 juta orang menurut data The Jewish Cronicle 2023. Sementara jumlah warga New York sebesar 8,8 juta. Komunitas Yahudi New York terbesar mencakup lima wilayah kota New York (Manhattan, Brooklyn, Queens, Bronx, dan Staten Island), serta daerah Nassau, Suffolk, dan Westchester. Salah satunya lingkungan Williamsburg di Brooklyn yang dikenal dikenal sebagai pusat berkumpulnya para pemuda hipster dan rumah bagi salah satu komunitas Yahudi Hasid yang paling padat di New York. Dalam buku baru, ""A Fortress in Brooklyn: Race, Real Estate, and the Making of Hasidic Williamsburg,"" Nathaniel Deutsch dan Michael Casper mengungkap sejarah Williamsburg, Yahudi dan benturan komunitas Yahudi yang taat (Satmari) dengan kekuatan perdagangan dan pembangunan perkotaan (Hasidi). Dalam buku tersebut digambarkan bagaimana gerakan Satmari dan Hasidi mewakili versi alternatif dari ""Yahudi New York"" - kelompok yang berasimilasi yang sudah menuju ke pinggiran kota ketika Williamsburg mulai dipenuhi oleh para pengungsi Ortodoks dari Eropa di masa Hitler berkuasa di Jerman. Setelah perang dunia II, banyak Yahudi pindah ke Amerika Serikat. Saat ini sekitar 20 persen orang Yahudi New York mengidentifikasi diri dengan gerakan Reformasi, 19 persen mengatakan bahwa mereka Ortodoks, 15 persen menganggap diri mereka sebagai orang Yahudi Konservatif, dan 47 persen tidak mengidentifikasi diri dengan denominasi agama Yahudi mana pun. Data sensus AS terkini menunjukkan bahwa 7 persen dari 20 juta penduduk Negara Bagian New York adalah Yahudi dan orang Yahudi mencakup sekitar 2 persen dari populasi AS secara keseluruhan.",Penulis tidak ditemukan,https://www.cnnindonesia.com/internasional/20250628022816-134-1244551/berapa-populasi-yahudi-di-new-york-kota-calon-walkot-zohran-mamdani,2025/06/28 15:20:53
Warga Thailand Demo Tuntut PM Paetongtarn Mundur,"Ratusan pengunjuk rasa berkumpul di ibu kotaThailand, Bangkok, pada Sabtu (28/6), menuntut pengunduran diri Perdana Menteri Paetongtarn Shinawatra. Reutersmelaporkan unjuk rasa itu merupakan yang terbesar di Thailand sejak partai Paetongtarn, Pheu Thai, berkuasa pada 2023. Para demonstran mengibarkan bendera di samping Monumen Kemenangan, sebuah tugu peringatan perang di persimpangan Bangkok. Demonstrasi itu dipimpin oleh United Force of the Land, koalisi aktivis yang telah berunjuk rasa melawan pemerintah yang didukung keluarga Shinawatra selama dua dekade terakhir. ADVERTISEMENT SCROLL TO CONTINUE WITH CONTENT Meskipun tidak secara langsung menjatuhkan pemerintah, protes yang dilakukan United Force of the Land di masa lalu berhasil meningkatkan tekanan di publik yang berujung pada intervensi yudisial dan kudeta militer pada 2006 dan 2014. Pemerintahan Paetongtarn belakangan di ujung tanduk setelah percakapannya dengan eks PM Kamboja Hun Sen bocor ke publik. Dalam percakapan itu, ia terdengar mendiskreditkan militer Thailand, yang memiliki pengaruh signifikan serta pernah punya sejarah buruk dengan keluarga Shinawatra. Paetongtarn telah meminta maaf atas ucapannya di telepon tersebut. Percakapan itu sendiri membuat koalisinya terkikis karena Partai konservatif Bhumjaithai selaku mitra terbesar kedua Pheu Thai memutuskan keluar pekan lalu. Partai Bhumjaithai menarik dukungannya dengan alasan risiko hilangnya kedaulatan dan integritas Thailand buntut percakapan bocor itu. Saat ini, Paetongtarn terancam menghadapi mosi tidak percaya menjelang dimulainya kembali sidang parlemen pekan depan. Ia juga tengah menghadapi pengawasan hukum setelah sekelompok senator mengajukan petisi ke Mahkamah Konstitusi dan badan antikorupsi untuk menyelidiki perilakunya imbas panggilan telepon dengan Hun Sen. Keputusan dari dua badan ini dapat mengakibatkan Paetongtarn dicopot dari jabatannya. Paetongtarn sementara itu sudah memberikan tanggapan mengenai protes terhadapnya pada Sabtu ini. Ia mengaku tak khawatir dengan unjuk rasa tersebut, sambil menyatakan bahwa dirinya telah menginstruksikan pihak berwenang untuk memastikan demonstrasi berlangsung damai. ""Ini adalah hak rakyat dan saya tidak akan melakukan balasan,"" ujarnya.",Penulis tidak ditemukan,https://www.cnnindonesia.com/internasional/20250628145005-106-1244687/warga-thailand-demo-tuntut-pm-paetongtarn-mundur,2025/06/28 14:55:30
FOTO: Prosesi Pemakaman Komandan Militer dan Ilmuwan Nuklir Iran,,REUTERS,https://www.cnnindonesia.com/internasional/20250628140149-122-1244670/foto-warga-penuhi-jalan-hadiri-pemakaman-petinggi-militer-iran,2025/06/28 18:30:00
KPK: Total Nilai Proyek Jalan Sumut yang Jadi Bancakan Rp231 Miliar,"Komisi Pemberantasan Korupsi (KPK) mengungkapkan total nilai proyek jalan di Sumatera Utara (Sumut) yang menjadi bancakan sejumlah pihak sebesar Rp231,8 miliar. Direktur Penyidikan (Dirdik) KPK Asep Guntur Rahayu merinci proyek-proyek jalan tersebut ada di Dinas PUPR Sumut serta Satuan Kerja Pembangunan Jalan Nasional (PJN) Wilayah 1 Sumatera Utara. Proyek jalan di Dinas PUPR yaitu Preservasi Jalan Sp. Kota Pinang-Gunung Tua-SP. Pal XI Tahun 2023, dengan nilai proyek Rp56,5 miliar. ADVERTISEMENT SCROLL TO CONTINUE WITH CONTENT ""Preservasi Jalan Sp. Kota Pinang-Gunung Tua-Sp. Pal XI tahun 2024, dengan nilai proyek Rp17,5 miliar,"" kata Asep dalam konferensi pers di Gedung KPK, Jakarta, Sabtu (28/6). Kemudian Rehabilitasi Jalan Sp. Kota Pinang-Gunung Tua-Sp. Pal XI dan penanganan longsoran tahun 2025 serta preservasi Jalan Sp. Kota Pinang-Gunung Tua-Sp. Pal XI tahun 2025. Sedangkan pembangunan jalan di Satuan Kerja Pembangunan Jalan Nasional (PJN) Wilayah 1 Sumatera Utara, yaitu proyek pembangunan Jalan Sipiongot batas Labusel dengan nilai proyek Rp96 miliar dan proyek pembangunan jalan Hutaimbaru-Sipiongot, dengan nilai proyek Rp61,8 miliar. ""Sehingga total nilai proyek setidaknya sejumlah Rp231,8 miliar,"" kata Asep. Dalam kasus ini, KPK menetapkan lima tersangka, yakni Topan Obaja Putra Ginting selaku Kepala Dinas PUPR Provinsi Sumut, Rasuli Efendi Siregar selaku Kepala UPTD Gunung Tua Dinas PUPR Provinsi Sumut merangkap Pejabat Pembuat Komitmen (PPK). Kemudian Heliyanto selaku PPK Satker PJN Wilayah I Provinsi Sumut, M. Akhirun Efendi Siregar selaku Direktur Utama PT DNG, dan M. Rayhan Dulasmi Pilang selaku Direktur PT RN. KPK menduga bahwa pihak swasta yakni PT DNG dan PT TN menyuap pihak Topan Obaja, Rasuli Efendi, dan Heliyanto untuk menjadi pemenang dalam lelang proyek pembangunan jalan tersebut. Akhirun Efendi selaku Dirut PT DNG dan Rayhan selaku direktur PT TN diduga memberikan uang senilai Rp2 miliar pada tiga orang itu. ""Kami sudah mendapatkan informasi ada penarikan uang sekitar Rp2 miliar dari pihak swasta. Yang kemungkinan besar uang Rp2 miliar ini akan dibagi-bagikan kepada pihak-pihak tertentu di mana pihak swasta ini berharap untuk memperoleh proyek berkaitan dengan pembangunan jalan,"" katanya.",Penulis tidak ditemukan,https://www.cnnindonesia.com/nasional/20250628175118-12-1244726/kpk-total-nilai-proyek-jalan-sumut-yang-jadi-bancakan-rp231-miliar,2025/06/28 18:15:39
