Title,FullText,Author,Url,Date
Ajudan Bantah Isu Jokowi Kritis dan Masuk Rumah Sakit,"Presiden ke-7 RI Joko Widodo (Jokowi) dikabarkan dalam kondisisakitkritis dan masuk rumah sakit. Ajudan Jokowi Kompol Syarif Fitriansyah membantah kabar tersebut. Dalam sebuah video beredar di media sosial X, terlihat kerumunan warga di sebuah bangunan. Warga tampak sibuk merekam dengan HP masing-masing. Terlihat sosok seperti Jokowi dan pengamanan di lokasi. Narasi video tersebut tertulis 'Jokowi kritis masuk rumah sakit'. ADVERTISEMENT SCROLL TO CONTINUE WITH CONTENT ""Tidak, beliau sedang tidak dirawat di Rumah Sakit,"" kata Syarif mengutipdetikcom, Sabtu (28/6). Syarif menegaskan informasi yang beredar itu hoax. Dia meminta publik bijak dalam menerima informasi yang beredar di medsos. ""Hoax itu, mari kita bersama-sama lebih bijak dalam menerima dan membagikan informasi,"" katanya. ""Jangan mudah percaya sebelum memastikan kebenarannya. Menyebarkan hoaks hanya akan menimbulkan keresahan dan merugikan banyak orang. Verifikasi dulu, sebarkan kemudian,"" lanjutnya. Sebelumnya, Jokowi mengaku mengisi masa liburan sekolah bersama cucu-cucunya. Jokowi sekeluarga bertolak dari kediamannya di Kelurahan Sumber, Kecamatan Banjarsari, Kamis (26/6) lalu. Ayah dari Wakil Presiden Gibran Rakabuming Raka itu keluar dari rumah bersama istrinya, Iriana Joko Widodo. Disusul anak keduanya, Kahiyang Ayu dan tiga anaknya, Sedah Mirah Nasution, Panembahan Al-Nahyan Nasution, dan Panembahan Al-Saud Nasution. ""Ini nganter Cucu, nganter anak dan cucu,"" kata Jokowi sebelum berangkat. Jokowi mengatakan ia akan mengisi masa libur sekolah bersama cucu-cucunya untuk berwisata ke luar kota. Namun ia tidak menyebutkan tujuan wisata mereka. Ia juga tidak mengetahui sampai kapan ia akan berlibur bersama keluarganya. ""Nggak tahu ini liburannya sampai kapan,"" kata dia. Wajah Jokowi tampak sumringah selama melayani wawancara dengan awak media. Ia mengaku kondisinya masih sehat meski masih dalam proses pemulihan. ""Baik-baik saja. Tapi masih sedikit pemulihan,"" kata dia. Beberapa waktu lalu, Ajudan Jokowi, Syarif menegaskan Jokowi dalam kondisi bugar. Ruam-ruam di kulitnya, kata Syarif, disebabkan alergi yang dialami sepulang dari menghadiri Pemakaman Paus Fransiskus di Vatikan beberapa waktu lalu. ""Secara visual memang bisa kita lihat ya, kulit Bapak (Jokowi) memang agak berubah. Tapi beliau sangat sehat wal afiat,"" kata Syarif. Syarif juga memastikan Jokowi tidak memiliki penyakit lain. ""Nggak ada, nggak ada. Itu alergi beliau menyebabkan peradangan,"" kata Syarif. Baca berita lengkapnyadi sini. [Gambas:Twitter] ",Penulis tidak ditemukan,https://www.cnnindonesia.com/nasional/20250628203913-20-1244747/ajudan-bantah-isu-jokowi-kritis-dan-masuk-rumah-sakit,2025/06/28 21:01:13
Daftar Potensi Perubahan Pemilu Buntut Putusan MK: Pilkada Mundur 2032,"Mahkamah Konstitusi (MK) mengabulkan gugatan yang dilayangkan Perkumpulan untuk Pemilu dan Demokrasi (Perludem) terkait pengujian sejumlah pasal dalamUU Pemiludan UU Pilkada. Dalam amar putusan nomor perkara 135/PUU-XXII/2024, MK memutuskan pemilu nasional dan daerah dipisah alias tidak dalam tahun yang sama. MK memberikan opsi agar jeda waktu dari pemilu nasional dan daerah yakni selama 2 hingga 2,6 tahun. Artinya, dengan putusan itu, pemilihan DPRD dan kepala daerah yang semula akan digelar pada 2029, lima tahun sejak 2024, mundur menjadi 2031. ADVERTISEMENT SCROLL TO CONTINUE WITH CONTENT Putusan MK membuka peluang DPR atau pemerintah memperpanjang masa jabatan kepala daerah maupun anggota DPRD yang semula habis pada 2029 menjadi 2031. Potensi itu terbuka lebar jika putusan MK akan diatur dan masuk dalam revisi UU Pemilu atau Pilkada sebelum 2029. DPR dan pemerintah memiliki waktu hingga 2028 atau beberapa bulan sebelum Pemilu 2029 untuk melakukan revisi jika putusan MK ingin berlaku. Sementara, Ketua Komisi II DPR, Rifqinizami Karsayuda mengatakan putusan MK hanya membuka opsi perpanjangan masa jabatan bagi anggota DPRD. Sementara, bagi kepala daerah akan digantikan sementara dengan penjabat sementara (Pjs). Kasus yang sama terjadi pada 2024. ""Kalau bagi pejabat gubernur, bupati, wali kota bisa tunjuk penjabat seperti yang kemarin, tetapi untuk anggota DPRD satu-satunya cara adalah dengan cara memperpanjang masa jabatan,"" kata Rifqi saat dihubungi, Kamis (26/6). Hal yang sama disampaikan Komisioner KPU Idham Kholiq. Dia Idham meyakini jabatan anggota DPRD yang terpilih pada 2024 berpotensi diperpanjang hingga 2031. ""Jadi dengan adanya pemisahan Pemilu Nasional dan Lokal sebagaimana Putusan MK Nomor 135/PUU-XXII/2024, dimana Pemilu Lokal dilaksanakan paling singkat 2 tahun atau paling lama 2 tahun 6 bulan pasca pelantikan DPR RI dan DPD RI atau presiden dan wakil presiden terpilih hasil Pemilu nasional pada 2029, maka masa jabatan anggota DPRD berpotensi diperpanjang, karena pemilu lokal baru akan menghasilkan anggota DPRD terpilih pada 2031,"" ucap Idham, Jumat (27/6). Jika sesuai siklus lima tahunan, pemilihan kepala daerah akan kembali digelar pada 27 November 2029, atau lima tahun sejak 27 November 2024 lalu. Namun, dengan putusan MK terbaru agar pemilu nasional dan lokal dipisah, pelaksanaan pilkada bisa mundur menjadi Oktober 2031, atau April 2032 jika jedanya sampai 2,5 tahun. Waktu tersebut dihitung sejak pelantikan presiden pada 20 Oktober 2029 maupun DPR pada 1 Oktober 2029. ""Pemilihan dilaksanakan secara serentak di seluruh wilayah Negara Kesatuan Republik Indonesia untuk memilih anggota Dewan Perwakilan Rakyat Daerah provinsi, anggota Dewan Perwakilan Rakyat Daerah kabupaten/kota dan gubernur/wakil gubernur, bupati/wakil bupati, dan walikota/wakil walikota yang dilaksanakan dalam waktu paling singkat 2 (dua) tahun atau paling lama 2 (dua) tahun 6 (enam) bulan sejak pelantikan anggota Dewan Perwakilan Rakyat dan anggota Dewan Perwakilan Daerah atau sejak pelantikan Presiden/Wakil Presiden',"" kata Suhartoyo membacakan amar putusan. Di sisi lain, putusna MK agar pemilu nasional dan lokal atau daerah dipisah, juga bisa membuat jumlah kotak suara berkurang dari lima menjadi hanya dua. Sebab, kotak suara hanya berisi untuk pilpres, pileg, dan DPD. Pemilu dengan lima kotak suara digelar pada Pemilu Serentak 14 Februari 2024 lalu. Pemilih saat itu menerima lima surat suara sekaligus yang terdiri dari pasangan calon presiden dan wakil presiden, anggota DPR RI, anggota DPD RI, anggota DPRD provinsi, dan anggota DPRD kabupaten/kota. Ada lima jenis surat suara berlatar putih dengan lima warna penanda yang berbeda sesuai fungsinya. Warna abu-abu merupakan surat suara untuk pemilu presiden dan wakil presiden, warna merah untuk pemilu DPD, warna kuning untuk pemilu anggota DPR, warna biru untuk pemilu anggota DPRD provinsi dan warna hijau untuk surat suara pemilu anggota DPRD kabupaten/kota. Berikut bunyi putusan MK soal pemilu nasional dan daerah dipisah: ""Menyatakan Pasal 3 ayat (1) Undang-Undang Nomor 8 Tahun 2015 tentang Perubahan atas Undang-Undang Nomor 1 Tahun 2015 tentang Penetapan Peraturan Pemerintah Pengganti Undang-Undang Nomor 1 Tahun 2014 tentang Pemilihan Gubernur, Bupati, dan Walikota Menjadi Undang-Undang (Lembaran Negara Republik Indonesia Tahun 2015 Nomor 57, Tambahan Lembaran Negara Republik Indonesia Nomor 5678) bertentangan dengan Undang-Undang Dasar Negara Republik Indonesia Tahun 1945 dan tidak mempunyai kekuatan hukum mengikat secara bersyarat sepanjang ke depan tidak dimaknai, 'Pemilihan dilaksanakan secara serentak di seluruh wilayah Negara Kesatuan Republik Indonesia untuk memilih anggota Dewan Perwakilan Rakyat Daerah provinsi, anggota Dewan Perwakilan Rakyat Daerah kabupaten/kota dan gubernur/wakil gubernur, bupati/wakil bupati, dan walikota/wakil walikota yang dilaksanakan dalam waktu paling singkat 2 (dua) tahun atau paling lama 2 (dua) tahun 6 (enam) bulan sejak pelantikan anggota Dewan Perwakilan Rakyat dan anggota Dewan Perwakilan Daerah atau sejak pelantikan Presiden/Wakil Presiden',"" ujar Ketua MK Suhartoyo mengucapkan amar putusan, Kamis (26/6). ",Penulis tidak ditemukan,https://www.cnnindonesia.com/nasional/20250628161407-32-1244706/daftar-potensi-perubahan-pemilu-buntut-putusan-mk-pilkada-mundur-2032,2025/06/28 17:50:32
Daftar Jalan Ditutup Imbas Jakarta International Marathon Besok,"Dinas Perhubungan (Dishub) DKIJakartamenyiapkan sejumlah rekayasa lalu lintas (lalin) atau rute alternatif imbas pelaksanaan lari jarak jauh atau lari maraton (Jakarta International Marathon) pada Minggu (29/6) besok. Lewat akun Instagram @dishubdkijakarta, Dishub DKI mengungkapkan rekayasa akan berlaku mulai 3.30 - 10.30 WIB terhadap sejumlah ruas jalan karena rute kegiatan tersebut. Bukan hanya berlaku bagi kendaraan pribadi, rekayasa juga berlaku bagi transportasi umum Transjakarta yang akan akan dialihkan. Berikut daftar rekayasa lalin atau rute alternatif yang disiapkan: ADVERTISEMENT SCROLL TO CONTINUE WITH CONTENT 1. Lalu lintas dari utara (Harmoni) menuju timur (Stasiun Senen) dapat melalui Jalan Juanda-Jalan Pos-Jalan Gedung Kesenian-Jalan Lapangan Banteng Utara-Jalan Lapangan Banteng Barat-Jalan Pejambon-Jalan Medan Merdeka Timur-Jalan Ridwan Rais-Jalan Arief Rahman Hakim-Jalan Kwitang Raya-dst 2. Lalu lintas dari utara (Harmoni) menuju selatan (Semanggi) dapat melalui jalan Suryapranoto-Jalan Balikpapan-Jalan Kyai Caringin-Jalan Tomang Raya-Jalan S. Parman-Jalan Gatot Subroto-dst 3. Lalu Lintas dari barat (Cideng) menuju timur (Stasiun Senen) dapat melalui Jalan Jatibaru Raya-Jalan Abdul Muis-Jalan Majapahit-Jalan Juanda-dst 4. Lalu lintas dari utara (Harmoni) menuju Selatan (Tanah Abang) dapat melalui Jalan Suryapranoto-Jalan Balikpapan-Jalan Cideng Timur-Jalan Mas Mansyur-dst 5. Lalu Lintas dari timur (Taman Suropati) menuju barat (Tanah Abang) dapat melalui Jalan Teuku Umar-Jalan Cut Mutia-Jalan Menteng Raya-Jalan Ridwan Rais-Jalan Medan Merdeka Timur-Jalan Medan Merdeka Utara-dst 6. Lalu Lintas dari barat (Penjernihan) menuju ke barat (Stasiun Manggarai) dapat melalui Jalan Penjernihan-Jalan R.M Margono Djojohadikoesomo-Jalan Galunggung-Jalan Sultan Agung-dst 7. Lalu Lintas dari timur (Stasiun Manggarai) menuju ke timur (Benhil) dapat melalui Jalan Sultan Agung-Jalan Galunggung-Jalan Karet Pasar Baru Timur III-Jalan Karet Pasar Baru Timur II-Jalan Penjernihan-dst 8. Warga sekitar Kawasan Jalan Blora, Jalan Sumenep, Jalan Purworejo dan Jalan Blora dapat menggunakan Jalan Latuharry-Jalan Sultan Agun-Jalan Galunggung dst 9. Lalu Lintas dari Timur (Taman Suropati) menuju ke Timur (Stasun Karet) dapat menggunakan Jalan Madiun-Jalan Galunggung-Jalan Karet Pasar Baru Timur Ill-Jalan Karet Pasar Baru Timur II-Jalan Penjernihan-dst 10. Warga sekitar Kawasan Pedurenan dan Setiabudi untuk menuju Utara (Taman Menteng) dapat melalui Jalan H. R Rasuna Said sisi Barat-Jalan Sumenep-Jalan Latuharhary-Jalan Cimahi-Jalan Taman Sunda Kelapa-Jalan Taman Suropati-dst 11. Lalu lintas dari arah Timur (Pasar Rumput) menuju ke Selatan (Mampang prapatan) dapat menggunakan Jalan Galunggung-Jalan Gembira-Jalan Kuningan Persada-Jalan H.R Rasuna Said jalur lambat-Jalan terusan H.R Rasuna Said-Jalan Mampang Prapatan-dst 12. Lalu Lintas dari barat (karet) menuju timur (Kampung Melayu) dapat menggunakan Jalan Mas Mansyur-Jalan Layang Non Tol Kasablanka-Jalan Kasablanka Raya-Jalan Badullah Syafei-dst 13. Lalu Lintas dari timur (Kampung Melayu) menuju barat (Stasiun Palmerah) dapat menggunakan Jalan KH. Abdulah Syafei-Jalan Casablanka Raya-JLNT Dr. Satrio atau Jalan Dr. Satrio-Jalan Mas Mansyur-Jalan Penjernihan-Jalan Pejompongan Raya-Jalan Palmerah Timur 1-dst 14. Lalu Lintas dari barat (Slipi) menuju utara (Monas) dapat menggunakan Jalan Gatot Subroto-Jalan Sudirman sisi Barat-Jalan M.H Thamrin sisi barat-dst 15. Lalu Lintas dari selatan (Benhil) menuju utara (Monas) dapat menggunakan Jalan Sudirman sisi barat-Jalan M.H Thamrin sisi barat-dst 16. Lalu Lintas dari timur (Kampung Melayu) menuju selatan (Mampang Prapatan) dapat menggunakan Jalan KH. Abdulah Syafei-Jalan Casablanka Raya-Jalan H.R Rasuna Said-Jalan Terusan Rasuna Said-Jalan Mampang Prapatan-dst 17. Lalu Lintas dari selatan (Simpang Kuningan) menuju utara (Setiabudi) dapat menggunakan Jalan H.R Rasuna Said Jalan Pedurenan-dst 18. Lalu Lintas dari barat (Patra) menuju timur (Cawang) dapat menggunakan Jalan Gatot Subroto-Jalan M.T Haryono-Cawang-dst 19. Lalu lintas dari timur (Cawang) menuju barat (Slipi) dapat menggunakan Kupingan Besar Semanggi-Jalan Jenderal Sudirman-Jalan Mas Masnyur-Jalan Penjernihan-Jalan Pejompongan Raya-Kupingan Pejompongan Raya-Jalan Gatot Subroto-dst 20. Lalu Lintas dari selatan (Blok M) menuju utara (Semanggi) dapat menggunakan Jalan Panglima Polim-Jalan Kyai Maja-Jalan Pakubuowo-Jalan Hang Lekir-Jalan Asia Afrika-Jalan Gerbang Pemuda-Jalan Gatot Subroto-Semanggi-dst 21. Masyarakat di sekitar Kawasan Dharmawangsa dan Brawijaya yang ingin bepergian ke arah utara (Blok M) dapat menggunakan Jalan Fatmawati Raya-Jalan Panglima Polim-dst 22. Lalu Lintas dari selatan (Antasari) menuju utara (Mabes Polri) dapat menggunakan Jalan Brawijaya-Jalan Fatmawati Raya-Jalan Panglima Polim-Jalan Trunojoyo-dst 23. Masyarakat di sekitar Kawasan sisi timur Jalan Prapanca Raya (Jalan Bangka, Jalan Wijaya 1, Jalan Kemang Raya) yang ingin berpergian ke arah barat (Blok M) dapat menggunakan Jalan Bangka Raya-Jalan Kapten Tendean-Jalan Wolter Monginsidi-Jalan Trunojoyo-Jalan Panglima Polim-dst 24. Lalu Lintas dari timur (Mampang Prapatan) menuju barat (Blok M) dapat menggunakan Jalan Tendean-jalan Wolter Monginsidi-Jalan Trunojoyo-Jalan Panglima Polim-dst 25. Lalu Lintas dari utara (Senopati) menuju timur (Cawang) dapat menggunakan Jalan Suryo-Jalan Tendean-Jalan Gatot Subroto-Jalan M.T Haryono-dst 26. Lalu lintas dari arah selatan (Kemang) menuju utara (Kuningan) dapat menggunakan jalan Mampang Prapatan Raya-Jalan Terusan H. R Rasuna Said-Jalan H.R RasunaSaid-dst 27. Lalu lintas dari arah timur (Mampang VIII) menuju barat (Mampang VII) dapat menggunakan jalan Mampang Prapatan Raya-berputar di Uturn Simpang Jalan Duren Tiga Selatan-Jalan Mampang Raya-dst 28. Lalu lintas dari arah timur (Pancoran) menuju barat (Kemang) dapat menggunakan Jalan KH Guru Amin-Jalan Duren Tiga Raya-Jalan Mampang Prapatan Raya-simpang Jalan Duren Tiga Selatan-Jalan Mampang Prapatan Raya-Jalan Duren Bangka-dst 29. Masyarakat di sekitar Kawasan sisi timur Jalan Pattimura (Jalan Galuh, Jalan Mataram Raya, Jalan Kertanegara) yang ingin berpergian ke arah selatan (Blok M) dapat menggunakan Jalan Senopati-Jalan Suryo-Jalan Wolter monginsidi-Jalan Trunojoyo-Jalan Panglima Polim-dst 30. Masyarakat di sekitar Kawasan sisi timur Jalan Sisingamangaraja yang ingin bepergian ke arah timur (Kuningan) dapat menggunakan Jalan Sisingamangaraja sisi Timur-Jalan Raden Patah II-Jalan Raden Patah I-Jalan Trunojoyo-Jalan Jalan Wolter monginsidi-Jalan Gunawarman-Jalan Senopati-Jalan Suryo-Jalan Kapten Tendean-dst 31. JLNT Antasari baik dari arah Utara-Selatan dan arah selatan-utara ditutup selama acara Jakarta International Marathon 2025 berlangsung. ",Penulis tidak ditemukan,https://www.cnnindonesia.com/nasional/20250628164935-20-1244710/daftar-jalan-ditutup-imbas-jakarta-international-marathon-besok,2025/06/28 17:30:43
SMA Unggulan CT Arsa Teken Kerja Sama dengan ITS dan ITB,"SMA Unggulan CT Arsa Foundationmenjalin kerja sama dengan Institut Teknologi Sepuluh November (ITS) dan Institut Teknologi Bandung (ITB). Dua institut ternama di tanah air itu meneken Memorandum of Understanding (MoU) dengan CT Arsa Foundation di momen pelepasan Angkatan V SMA Unggulan CT Arsa, di Sukoharjo, Jawa Tengah, Sabtu (28/6). ADVERTISEMENT SCROLL TO CONTINUE WITH CONTENT Rektor ITS, Bambang Pramujati mengatakan pihaknya menginginkan lebih banyak lulusan SMA Unggulan CT Arsa yang meneruskan pendidikan di ITS. ""Tahun ini ada tiga. Insyaallah nanti akan semakin banyak kesempatan yang kita berikan kepada siswa-siswa CT Arsa,"" kata Bambang. Ia menilai Sekolah Unggulan CT Arsa berhasil melahirkan lulusan dengan kualitas yang sangat baik. Alumni SMA CT Arsa berpeluang diterima di ITS tanpa melalui seleksi. ""Nantinya kita akan melihat potensi itu, misalnyagolden ticketsalah satu hal yang sangat mungkin untuk kita berikan kepada mereka karena mereka adalah lulusan-lulusan yang luar biasa. Itu salah satunya, kesempatan kuliah tanpa tes,"" kata dia. Selaingolden ticket, kata Bambang, alumni SMA Unggulan CT Arsa juga bisa mendapatkan beasiswa. Hanya saja beasiswa tersebut akan diberikan dengan melihat kapasitas dari ITS. ""(Beasiswa) Ini akan kita pikirkan. Tadi ada yang bertanya kepada sayapengenmasuk ke asrama,"" ujarnya. ""Saya sudah berkontak dengan teman-teman di sana apakah masih ada tempat di sana sehingga mereka bisa tinggal di asrama,"" kata Bambang melanjutkan. Terpisah, Rektor ITB, Tatacipta Dirgantara mengatakan pada tahun ini hanya dua lulusan SMA Unggulan CT Arsa yang diterima di ITB. Menurutnya, jumlah tersebut masih sangat kurang, mengingat kualitas lulusan sekolah binaan Chairul Tanjung dan istrinya, Anita Ratnasari Tanjung itu terbilang baik. ""ITB perlu lebih banyak, tidak cuma dua. Dan ditindaklanjuti dengan MoU ini,"" ujarnya. Kerja sama ITB dengan SMA Unggulan CT Arsa akan dituangkan dalam bentuk program kemitraan. Tata mengatakan pihaknya memiliki banyak program kemitraan yang bisa dikerjakan bersama SMA Unggulan CT Arsa. ""Misalnya pengembangan kualifikasi guru STEM (science, technology, engineering, and mathematics), juga program pra-universitas untuk mempersiapkan siswa-siswa supaya siap diterima di perguruan tinggi, dan banyak lagi,"" kata dia. Tata mengatakan lulusan CT Arsa Foundation nantinya tetap harus mengikuti proses seleksi jika ingin kuliah di ITB. Namun dengan program-program kemitraan tersebut, peluang mereka untuk diterima di perguruan tinggi akan semakin besar. ""Kita sudah banyak kerja sama dengan SMA yang lain. Dan diterima di perguruan tinggi yang lain, ada di UI, UGM juga. Tapi tentu saja kita harapannya yang bagus-bagus masuk ITB,"" katanya. ",Penulis tidak ditemukan,https://www.cnnindonesia.com/nasional/20250628152711-20-1244700/sma-unggulan-ct-arsa-teken-kerja-sama-dengan-its-dan-itb,2025/06/28 16:10:15
"Tantang Klaim China, AL Inggris-Australia Gelar Latihan Bersama di LCS","Sebuah kapal perusak Angkatan LautAustraliatelah bergabung dengan kapal patroliInggrisuntuk melakukan latihan kebebasan navigasi diLaut Cina Selatan. Latihan ini menjadi salah satu tanda bahwa militer Australia tetap berniat untuk menolak klaim Beijing atas perairan yang disengketakan tersebut. Operasi tersebut diumumkan Markas Besar Bersama Tetap Kementerian Pertahanan Inggris di media sosial pada Selasa, (24/6/2025). ADVERTISEMENT SCROLL TO CONTINUE WITH CONTENT ""HMS SPEY dan HMAS SYDNEY baru saja melakukan Aktivitas Kebebasan Navigasi di sekitar Kepulauan Spratly di Laut Cina Selatan, sesuai dengan UNCLOS,"" demikian pernyataan Markas Besar itu di X. Angkatan Pertahanan Australia tidak mengumumkan operasi tersebut hingga Kamis (26/6) ketika mereka mengunggah foto-foto latihan tersebut di situs web mereka. Dalam sebuah pernyataan yang dikeluarkan untuk ABC, seorang juru bicara Departemen Pertahanan mengatakan HMAS Sydney ""melaksanakan latihan yang konsisten dengan Konvensi Perserikatan Bangsa-Bangsa tentang Hukum Laut bersama dengan HMS Spey, di sekitar Kepulauan Spratly di Laut Cina Selatan"". ""Australia secara rutin beroperasi dengan para mitra, termasuk Inggris, saat melakukan pengerahan pasukan regional,"" kata mereka, sebagaimana dilansir ABC. Kedua negara melaksanakan latihan tersebut sementara sebagian besar perhatian dunia masih terfokus pada serangan Amerika Serikat terhadap Iran dan ancaman konflik yang lebih luas di Timur Tengah beberapa waktu terakhir. Beijing mengklaim hampir seluruh Laut Cina Selatan sebagai wilayahnya - meskipun ada putusan internasional tahun 2016 yang menyatakan klaim tersebut tidak sah - dan angkatan laut serta penjaga pantainya telah berulang kali bentrok dengan kapal-kapal dari Filipina, yang merupakan salah satu negara Asia Tenggara yang juga memiliki klaim yang tumpang tindih di laut tersebut. China dan Filipina juga telah beberapa kali terlibat dalam pertemuan udara yang berpotensi membahayakan di Laut Cina Selatan, termasuk pada bulan Februari, ketika militer China mengatakan telah mengusir tiga pesawat Filipina dari Kepulauan Spratly. Australia telah melakukan aktivitas kebebasan navigasi di Laut Cina Selatan dengan sejumlah negara yang terus bertambah, termasuk AS, Jepang, Kanada, dan Filipina - yang semuanya telah menunjukkan tekad yang semakin kuat untuk menegaskan hak mereka untuk berlayar melalui perairan tersebut. Namun, Euan Graham dari Australian Strategic Policy Institute mengatakan bahwa tampaknya ini adalah pertama kalinya Inggris dan Australia melakukan operasi kebebasan navigasi yang diprakarsai secara terbuka di Laut Cina Selatan sendiri. Ia mengatakan kedua negara ""menentang klaim maritim China yang berlebihan dan meningkatkan kehadiran militer di Laut Cina Selatan"" dengan menegaskan hak mereka untuk berlayar. Graham mengatakan Canberra mengisyaratkan bahwa pelayaran parsial China baru-baru ini di daratan Australia tidak akan menghalanginya untuk terus beroperasi di Laut Cina Selatan. Lanjut ke sebelah... Beberapa analis China telah menyatakan bahwa Beijing menggunakan pengerahan pasukan ke Australia untuk mencegah pemerintah federal mengirim kapal angkatan laut ke perairan dekat China. ""Ada kesan bahwa Australia meningkatkan permainannya dan hadir (di Laut Cina Selatan) pada saat angkatan laut China mengerahkan kehadirannya di dekat Australia,"" kata Graham. ""Saya pikir apa yang Australia coba lakukan ... adalah menunjukkan bahwa mereka akan tetap beroperasi (di kawasan itu) dan tidak akan terhalang untuk melakukannya."" Inggris dan Australia telah meningkatkan kegiatan angkatan laut bersama di kawasan itu - termasuk dengan mengambil bagian dalam operasi untuk menegakkan sanksi Perserikatan Bangsa-Bangsa terhadap Korea Utara. Pada Februari, kapal-kapal Inggris dan Australia juga bergabung dengan Angkatan Laut Amerika Serikat di Laut Cina Selatan untuk melakukan ""latihan manuver terkoordinasi"", dan minggu lalu Cina mengecam Inggris setelah HMS Spey memberi tanda bahwa mereka berlayar melalui Selat Taiwan. Pemerintah Inggris telah mengatakan bahwa HMAS Sydney dan HMS Spey sekarang akan berlayar ke Singapura, di mana mereka akan bertemu dengan kapal induk Inggris Prince of Wales dan Strike Group dengan sejumlah kapal angkatan laut dari Inggris, Kanada, Norwegia, Selandia Baru, dan Spanyol. Carrier Strike Group kemudian akan berlayar ke Northern Territory untuk bergabung dengan Operation Talisman Sabre - latihan militer gabungan besar-besaran Australia-AS yang juga akan menarik pasukan dari lebih dari selusin negara lain. Perdana Menteri Inggris Keir Starmer mengatakan pengerahan kapal induk dan kapal angkatan laut Inggris lainnya ke wilayah tersebut - bersama dengan sekitar 4.000 personel militer Inggris - ditujukan untuk ""mengirimkan pesan kekuatan yang jelas kepada musuh kita, dan pesan persatuan dan tujuan kepada sekutu kita.""",Penulis tidak ditemukan,https://www.cnnindonesia.com/internasional/20250628150300-113-1244691/tantang-klaim-china-al-inggris-australia-gelar-latihan-bersama-di-lcs,2025/06/28 15:40:05
Pencarian 3 ABK KLM Asia Mulia Tenggelam Disetop usai 10 Hari Hilang,"Tim SAR gabungan menghentikan pencarian tiga anak buah kapal (ABK)KLM Asia Muliayang tenggelam di Perairan Bantaeng,Sulawesi Selatan, setelah operasi dilakukan selama 10 hari. Namun, hingga hari terakhir pencarian pada Sabtu (28/6), para korban belum ditemukan. ""Operasi Sar kapal KLM Asia Mulia ini telah dilaksanakan selama tujuh hari, kemudian penambahan selama tiga hari atas permintaan keluarga korban dan di hari ke sepuluh ini, operasi SAR kami nyatakan selesai dengan hasil nihil,"" kata Kepala Basarnas Makassar, Muhammad Arif Anwar, Sabtu (28/6). ADVERTISEMENT SCROLL TO CONTINUE WITH CONTENT Arif menerangkan tim SAR gabungan telah memperluas area pencarian terhadap ketiga korban yakni, Supriadi Nunung (46) yang merupakan nakhoda kapal, Asdar (52) dan Aldi (27) hingga ke Kabupaten Takalar. Perluasan daerah pencarian ini dilakukan setelah muncul laporan penemuan serpihan kapal di area tersebut. ""Sejak adanya laporan dari serpihan kapal kayu dan bangkai kerbau yang memakai tag muatan KLM Asia Mulia. Maka pencarian di perluas hingga ke arah Takalar. Namun, belum membuahkan hasil,"" ungkapnya. Arif mengatakan bahwa setelah dilakukan operasi SAR selama 10 hari dan belum menemukan tiga korban kapal tenggelam tersebut, sehingga pencarian para korban KLM Asia Mulia dihentikan dan ditutup. ""Namun, akan dibuka kembali jika terdapat ada tanda-tanda keberadaan korban untuk kemudian dilakukan evakuasi,"" pungkasnya. Sebelumnya, KLM Asia Mulia yang memuat delapan orang ABK dan mengangkut 57 ekor kerbau dengan rute Pulau Rote, NTT menuju ke Pelabuhan Bunge, Kabupaten Jeneponto pada Kamis, (19/6) pukul 04.00 WITA, ditabrak oleh kapal besi yang melintas di jalur yang sama, sehingga menyebabkan KLM Asia Mulia terbalik dan tenggelam.",Penulis tidak ditemukan,https://www.cnnindonesia.com/nasional/20250628211617-20-1244750/pencarian-3-abk-klm-asia-mulia-tenggelam-disetop-usai-10-hari-hilang,2025/06/28 21:27:02
