Title,FullText,Author,Url,Date
"Dicecar Pengacara, Ahli Bahasa Klarifikasi Sosok ""Bapak"" di Telepon Harun Masiku Bukan Hasto","JAKARTA, KOMPAS.com –Ahli bahasa dari Universitas Indonesia (UI),Frans Asisi Datang, mengklarifikasi bahwa sosok “bapak” yang disebutkan dalam sambungan telepon antara satpam DPP PDI-P, Nurhasan, denganHarun MasikubukanlahHasto Kristiyanto. Hal itu disampaikan Frans saat menjawab pertanyaan dari kuasa hukum Hasto, Ronny Talapessy, dalam sidang perkara dugaan suap pergantian antarwaktu (PAW) anggota DPR serta perintangan penyidikan kasus Harun Masiku, Kamis (12/6/2025). Awalnya, Ronny menyinggung isi Berita Acara Pemeriksaan (BAP) Nurhasan, tepatnya poin nomor 9 dan 10. Dalam bagian tersebut, Nurhasan menyatakan tidak mengetahui siapa sosok “bapak” yang dimaksud oleh Harun Masiku. Baca juga:Ahli Sebut “Bapak” dalam Telepon Harun Masiku Merujuk ke Hasto Selain itu, dalam BAP tersebut, Nurhasan mengaku hanya mengikuti perintah dari dua orang tak dikenal yang berpenampilan seperti aparat, dengan ciri khas berambut cepak, untuk menelepon Harun Masiku. “Bisa bantu jelaskan maksud kata bapak ini siapa, Pak, dalam BAP ini?” tanya Ronny dalam sidang di Pengadilan Tipikor Jakarta, Kamis (12/6/2025). “Kalau di sini, 9 dan 10 ini, bapak itu orang yang tidak diketahui,” jawab Frans. Ronny kemudian mempertegas bahwa sosok “bapak” yang disebut oleh Nurhasan bukanlah Hasto Kristiyanto, melainkan dua orang tak dikenal. “Berarti bukan Hasto Kristiyanto?” tanya Ronny. “Bukan,” jawab Frans. Baca juga:Ahli UI Akui Analisis Kasus Hasto Hanya Berdasarkan Ilustrasi Penyidik KPK Setelah mendengar pernyataan itu, Ronny membacakan kembali keterangan Nurhasan yang sebelumnya telah bersaksi di persidangan. Dalam keterangannya, Nurhasan menyebut bahwa sosok “bapak” yang dimaksud adalah dua orang tak dikenal tersebut. Ia pun membantah bahwa “bapak” yang dimaksud merupakan Sekjen PDI-P, Hasto Kristiyanto. Frans kemudian menyatakan, jika merujuk pada keterangan yang disampaikan di persidangan, maka sosok “bapak” tersebut bukanlah Hasto. “Ya, kalau ini sama dengan yang tadi, tidak mengarah ke sana,” ujar Frans.",Penulis tidak ditemukan,https://nasional.kompas.com/read/2025/06/12/22130651/dicecar-pengacara-ahli-bahasa-klarifikasi-sosok-bapak-di-telepon-harun,"Kompas.com- 12/06/2025, 22:13 WIB"
Terbakar Cemburu Diduga Picu Suami Aniaya Istri hingga Tewas di Karawang,"KARAWANG, KOMPAS.com– Polisi menduga motif penganiayaan terhadap seorang istri hingga tewas di Karawang, Jawa Barat, dipicu kecemburuan suami. Kapolres Karawang AKBP Fiki N. Ardiansyah melalui Kasi Humas Ipda Solikhin membenarkan bahwa pelaku diduga adalah suami korban, Bagus Setyojadi (27). Korban diketahui bernama Lusi Febiyani (23). “Benar, polisi telah melakukan olah TKP,” kata Solikhin saat dikonfirmasi, Kamis (12/6/2025). Solikhin menjelaskan, peristiwa ini terjadi sekitar pukul 01.30 WIB saat tetangga korban mendengar teriakan minta tolong. Dita Yulyana (33), tetangga Lusi, kemudian menghubungi kerabat korban yang juga Ketua RT, Tuti Herawati (38). Bersama Wardeni (39) dan Ahmad Jaelani (43), mereka langsung menuju lokasi kejadian. Baca juga:Istri Tewas dan Suami Kritis, Diduga Korban Penganiayaan di Karawang Saat tiba, kata Solikhin, pintu rumah dibuka oleh anak korban yang masih berusia 5 tahun. Mereka lalu masuk dan menemukan Lusi serta Bagus tergeletak di atas kasur. “Lusi Febiyani sudah dalam kondisi tidak bernyawa dengan tubuh bersimbah darah,” kata Solikhin. Ia menyebut, dugaan sementara motif kejadian ini adalah rasa cemburu dari pihak suami. Keterangan dari para tetangga menyebut pasangan ini sering terlibat cekcok. “Saat ini, kasus tersebut masih dalam penyelidikan lebih lanjut oleh kepolisian. Tujuannya untuk memastikan kronologi dan motif pasti dari dugaan pembunuhan ini,” ujar Solikhin. Baca juga:Anak 5 Tahun di Karawang Buka Pintu Sambil Menangis: Mama-Papa Aku Meninggal Sebelumnya, kasus dugaan penganiayaan suami terhadap istri ini terjadi di Perum Lemahmulya Indah, Desa Lemahmulya, Kecamatan Majalaya, Karawang, Jawa Barat, Kamis (12/6/2025). Sang istri meninggal dunia, sedangkan suaminya dalam kondisi kritis. PantauanKompas.compada Kamis pukul 10.00 WIB menunjukkan tim Inafis Polres Karawang tengah melakukan olah tempat kejadian perkara (TKP). Garis polisi terlihat terpasang di pagar rumah bercat cokelat. Dita, tetangga korban, menyebut bahwa pada Rabu (11/6/2025) pukul 20.30 WIB, Lusi sempat membeli kudapan darinya. Saat mengantarkan makanan, Dita melihat mata Lusi sembab, seperti habis menangis. Saat itu, Bagus juga berada di rumah. “Hanya saja saya tidak berani bertanya,” kata Dita. Baca juga:Tragedi di Balik Rumah Tangga Romantis di Karawang: Istri Tewas, Suami Kritis Sekitar pukul 01.30 WIB, Kamis dini hari, Dita mendengar suara teriakan minta tolong dari rumah Lusi. Ia kemudian menghubungi Ibu RT sekaligus saudara Lusi. Bersama petugas sekuriti dan Ketua RT, mereka masuk ke dalam rumah dan menemukan Lusi telah meninggal, sementara Bagus dalam kondisi kritis.",Penulis tidak ditemukan,https://bandung.kompas.com/read/2025/06/12/210515278/terbakar-cemburu-diduga-picu-suami-aniaya-istri-hingga-tewas-di-karawang,"Kompas.com- 12/06/2025, 21:05 WIB"
"3 Wakapolri pada Era Kapolri Jenderal Sigit, Siapa Saja Mereka?","JAKARTA, KOMPAS.com- PosisiWakapolriakan segera kosong setelah KomjenAhmad Dofiriakan segera pensiun pada Juni 2025. Ahmad Dofiri sendiri merupakan nama ketiga yang mengisi posisi Wakapolri pada era Kapolri JenderalListyo Sigit Prabowo. Listyo Sigit sendiri menduduki kursi tertinggi di Polri sejak 27 Januari 2021, menggantikan Jenderal Idham Azis. Sebelum Ahmad Dofiri, posisi Wakapolri diisi oleh Komjen Agus Andrianto. Adapun sebelum kedua nama itu, KomjenGatot Eddy Pramonoyang menjabat sebagai Wakapolri sejak era Kapolri Jenderal Idham Azis. Baca juga:Komjen Ahmad Dofiri Segera Pensiun, Wakapolri Akan Diisi Jenderal Bintang 3 Kadiv Humas Polri Irjen Sandi Nugroho mengungkapkan, Polri tengah menyiapkan sejumlah nama yang sudah berbintang tiga untuk mengisi posisi Wakapolri yang akan ditinggalkan Komjen Ahmad Dofiri. “Wakapolri bulan ini memang memasuki masa pensiun dan saat ini sedang dipersiapkan calon-calon terbaik yang sudah berpangkat bintang 3 atau yang memenuhi syarat untuk menggantikan Wakapolri,"" ujar Sandi di Markas Besar Polri, Jakarta, Kamis (12/6/2025). Sebelum nama baru ditunjuk sebagai Wakapolri keempat pada era Kapolri Jenderal Listyo Sigit Prabowo, berikut profil singkat Ahmad Dofiri, Agus Andrianto, dan Gatot Eddy Pramono: Ahmad Dofiri menjabat sebagai Wakapolri sejak 11 November 2024. Jauh sebelum itu, ia merupakan lulusan Akademi Kepolisian (Akpol) pada 1989. Ia juga merupakan lulusan terbaik dan mendapatkan penghargaan Adhi Makayasa pada 1989. Sebelum ditunjuk sebagai Wakapolri, ia pernah menduduki posisi sebagai Kapolda Banten (14 April 2016 - 5 Oktober 2016), Kapolda Daerah Istimewa Yogyakarta (4 November 2016 - 6 Desember 2019), dan Asisten Logistik Kapolri (6 Desember 2019 - 16 November 2020). Setelah itu, ia ditunjuk sebagai Kapolda Jawa Barat (16 November 2020 - 31 Oktober 2021), Kepala Badan Intelijen dan Keamanan Polri (31 Oktober 2021 - 26 Februari 2023), dan Inspektur Pengawasan Umum Polri (26 Februari 2023 - 11 November 2024). Baca juga:Respons Kapolri Usai Prabowo Mau Potong Anggaran Polri Demi Naikkan Gaji Hakim: Bercanda Itu Komjen (purn) Agus Andrianto merupakan Wakapolri sejak 24 Juni 2023 hingga 21 Oktober 2024. Pria kelahiran 16 Februari 1967 lulus dari Akademi Kepolisian (Akpol) pada 1989. Ia pernah menjabat sebagai Wakapolda Sumatera Utara (4 Januari 2017 - 13 Agustus 2018), Kapolda Sumatera Utara (13 Agustus 2018 - 6 Desember 2019), Kepala Badan Pemelihara Keamanan Polri (6 Desember 2019 - 18 Februari 2021), dan Kepala Badan Reserse Kriminal Polri (18 Februari 2021 - 24 Juni 2023). Setelah pensiun dan tak menjabat sebagai Wakapolri, ia ditunjuk Presiden Prabowo Subianto menjadi Menteri Imigrasi dan Pemasyarakatan dalam Kabinet Merah Putih. Baca juga:Prabowo Siap Potong Anggaran TNI-Polri demi Gaji Hakim, Berapa Jumlahnya Saat Ini? Komjen (purn) Gatot Eddy Pramono merupakan Wakapolri pada dua era Kapolri, yakni Idham Azis dan Listyo Sigit Prabowo. Ia menjabat sebagai Wakapolri sejak 7 Januari 2020 hingga 24 Juni 2023. Ia merupakan lulusan Akpol pada 1988 yang berpengalaman dalam bidang reserse. Sebelum menjabat sebagai Wakapolri, Gatot Eddy Pramono sempat menduduki posisi strategis di kepolisian. Baca juga:Penghargaan Tinggi Prabowo untuk Listyo Sigit di Tengah Isu Pergantian Kapolri Mulai dari Wakapolda Sulawesi Selatan (31 Desember 2015 - 2 Juni 2017), Staf Ahli Sosial Ekonomi Kapolri (2 Juni 2017 - 20 Juni 2018), Asisten Perencanaan dan Anggaran Kapolri (20 Juni 2018 - 22 Januari 2019), Kapolda Metro Jaya (22 Januari 2019 - 7 Januari 2020), dan Pelaksana Tugas Sementara Kepala Divisi Profesi dan Pengamanan (18 Juli 2022 - 8 Agustus 2022).",Penulis tidak ditemukan,https://nasional.kompas.com/read/2025/06/12/20133551/3-wakapolri-pada-era-kapolri-jenderal-sigit-siapa-saja-mereka,"Kompas.com- 12/06/2025, 20:13 WIB"
"Festival Kuliner Pasar Guyub 2025, Saat Gen Z Menemukan Rasa dan Cerita dari Nusantara","SURABAYA, KOMPAS.com- Surabaya menjadi tuan rumahFestival KulinerPasar Guyub 2025yang berlangsung diGrand City Mallmulai 11 hingga 22 Juni 2025. Festival ini tidak hanya sekadar perayaan makanan, tetapi juga menjadi ruang interaksi antara generasi muda dan kekayaan kuliner warisan bangsa, terutama makanan ringan tradisional yang semakin sulit ditemukan. Iwan Wijaya, Marketing Communication Manager Grand City Surabaya, menjelaskan bahwa tahun ini Pasar Guyub akan lebih banyak menampilkan jajanan dan makanan ringan khas daerah. ""Guyub Rukun sudah masuk tahun kedua. Fokus kali ini lebih ke makanan ringan, snack tradisional. Meski begitu, tetap ada beberapa makanan berat agar pengunjung bisa sekaligus makan siang atau malam di sini,"" ujarnya. Baca juga:Cegah Kasus Ayam Goreng Widuran, Satgas Halal Kemenag Solo Sidak Pelaku Kuliner Festival ini akan menampilkan berbagai kuliner dari berbagai daerah, seperti Selendang Mayang khas Betawi hingga Kue Lumpur Kentang dari Semarang. Setiap tenant akan membawa cita rasa dan cerita dari daerah asal mereka. Sebanyak 40 stand kuliner dari kota-kota seperti Bandung, Jakarta, Yogyakarta, Solo, Palembang, hingga Pontianak akan hadir, menawarkan cita rasa yang tidak hanya enak tetapi juga sarat makna sejarah. ""Ada Selendang Mayang, itu kuliner Betawi yang benar-benar jadul dan sekarang susah ditemukan. Harus dilestarikan,"" kata Iwan Wijaya. Namun, mengenalkan makanan warisan kepada generasi muda, terutama Gen Z, bukanlah hal yang mudah. Iwan mengakui perlu pendekatan yang lebih kreatif untuk menarik perhatian mereka. Baca juga:Kuliner Betawi Serbu Surabaya, Nostalgia Rasa Jakarta di Tengah Pasar Atom ""Anak-anak muda sekarang lebih tertarik pada makanan yang viral. Jadi kami gunakan influencer, karena mereka aktif di Instagram dan TikTok,"" sambungnya. Harga kuliner yang ditawarkan tetap terjangkau meskipun ada sedikit penyesuaian karena para pelaku usaha datang langsung dari kota asalnya. ""Mereka membawa bahan dan resep otentik. Jadi walau ada perubahan harga, itu masih masuk akal dan tetap bersahabat untuk anak muda,"" tambah Iwan. Dimas Pramudya, perwakilan penyelenggara dari Jiiscomm, juga menambahkan bahwa para tenant yang dihadirkan telah melalui proses kurasi yang ketat. ""Kuliner legendaris ini banyak yang nyaris punah. Kadang hanya bisa ditemukan di satu tempat. Kami harus jemput bola dan yakinkan mereka untuk tampil di sini,"" ucapnya. Baca juga:Cerita Koko Jony, Pelestari Sagu Sep Kuliner Khas Suku Marind di Merauke Lebih dari sekadar festival, Pasar Guyub merupakan bentuk nyata pelestarian budaya dalam format yang dekat dengan gaya hidup kekinian. Dengan sentuhan visual modern, pilihan menu yang otentik, dan pendekatan digital melalui media sosial, festival ini menjembatani generasi muda dengan warisan leluhurnya melalui rasa. Festival kulinerini menargetkan 8.000 pengunjung pada hari biasa dan 15.000 pada akhir pekan, angka yang optimistis tetapi realistis. Mengingat antusiasme masyarakat, khususnya anak muda, terus bertumbuh terhadap hal-hal berbau lokal yang dikemas dengan cara yang relevan.",Penulis tidak ditemukan,https://surabaya.kompas.com/read/2025/06/12/222647478/festival-kuliner-pasar-guyub-2025-saat-gen-z-menemukan-rasa-dan-cerita-dari,"Kompas.com- 12/06/2025, 22:26 WIB"
"TikToker Terkenal Khaby Lame Keluar dari AS, Sempat Ditahan Imigrasi","LAS VEGAS, KOMPAS.com— Bintang TikTok asal Italia-Senegal,Khaby Lame, dilaporkan telah meninggalkan Amerika Serikat (AS) setelah ditahan oleh petugas Imigrasi dan Bea Cukai (ICE) di Bandara Internasional Harry Reid, Las Vegas. Menurut pernyataan juru bicara ICE, pria bernama lengkap Seringe Khabane Lame itu diamankan pada Jumat (6/6/2025) karena diduga melewati batas waktu tinggal yang diizinkan oleh visanya. Khaby tercatat memasuki wilayah Amerika Serikat sejak 30 April 2025. ""Penahanan dilakukan karena pelanggaran durasi tinggal sesuai visa. Namun, ia kemudian meninggalkan AS secara sukarela tanpa dikenai perintah deportasi,"" ujar perwakilan ICE. Baca juga:Los Angeles Makin Ricuh, Gubernur California Gugat Trump Langkah “kepergian sukarela” ini, lanjut ICE, memungkinkan Khaby Lame untuk menghindari catatan deportasi resmi. Jika dideportasi, ia berisiko dilarang kembali ke Amerika Serikat selama sepuluh tahun ke depan. Hingga kini, Khaby belum memberikan pernyataan resmi terkait insiden tersebut.Associated Presstelah menghubungi akun Instagraminfluencerberusia 25 tahun itu, tetapi belum mendapat tanggapan. Penahanan Khaby terjadi di tengah memanasnya situasi kebijakan imigrasi di bawah pemerintahan Presiden AS Donald Trump. Beberapa waktu terakhir, tindakan keras otoritas imigrasi, termasuk penggerebekan di Los Angeles, memicu gelombang protes masyarakat. Baca juga:Kerusuhan Los Angeles Meluas ke San Francisco, Ratusan Orang Ditangkap Khaby Lame dikenal sebagai salah satu kreator konten paling populer di dunia, berkat video TikTok tanpa dialog yang menunjukkan reaksi lucunya terhadaplife hacksyang dianggap terlalu rumit. Ekspresi wajah khas tanpa kata-kata menjadi ciri khas kontennya. Saat ini, jumlah pengikutnya di TikTok telah menembus angka 162 juta, menjadikannya sebagai salah satu tokoh digital paling berpengaruh secara global. Lahir di Senegal dan dibesarkan di Italia sejak masih bayi, Khaby kini memegang kewarganegaraan Italia. Ketenarannya membawanya berkolaborasi dengan berbagai merek internasional, salah satunya adalah Hugo Boss pada 2022. Pada awal 2025, UNICEF menunjuknya sebagai duta besar untuk kampanye global organisasi tersebut. Khaby juga sempat menghadiri ajang bergengsi Met Gala di New York City, hanya beberapa hari setelah ia tiba di AS. Baca juga:Kenapa Terjadi Kerusuhan di Los Angeles? Begini Awal Mulanya",Penulis tidak ditemukan,https://internasional.kompas.com/read/2025/06/12/051500770/tiktoker-terkenal-khaby-lame-keluar-dari-as-sempat-ditahan-imigrasi,"Kompas.com- 12/06/2025, 05:15 WIB"
"Soal Gaza, Greta Thunberg: Saya Tak Takut Ditahan, Saya Takut Dunia Diam","STOCKHOLM, KOMPAS.com –Aktivis lingkunganasal Swedia,Greta Thunberg, kembali ke kampung halamannya pada Selasa (10/6/2025) malam setelahdideportasidariIsrael. Ia tiba di Bandara Arlanda, Stockholm, sekitar pukul 22.30 waktu setempat. Saat tiba di bandara, Thunberg langsung memberikan pernyataan kepada awak media. Ia mengecam keras tindakan Israel terhadapGazayang dinilainya melanggar hukum internasional dan merupakan bentuk kejahatan perang. Baca juga:Usai Dideportasi, Greta Thunberg Ungkap Pengakuan Saat Ditahan Israel “Saya takut bukan karena penahanan. Yang saya takutkan adalah ketika dunia memilih diam di tengah genosida yang sedang berlangsung,” ujar Thunberg. Thunberg (22) dideportasi bersama tiga aktivis lainnya setelah pasukan keamanan Israel menghentikan kapal layar Madleen yang mereka tumpangi. Kapal tersebut membawa total 12 aktivis dan memuat bantuan kemanusiaan untuk Gaza. Misi mereka bertujuan menembus blokade Israel di wilayah Palestina. Delapan dari 12 aktivis ditahan karena menolak meninggalkan Israel secara sukarela. Sementara empat lainnya, termasuk Thunberg, langsung dideportasi. Menurut kelompok hak asasi manusia yang mendampingi mereka secara hukum, seluruh aktivis itu kini dilarang masuk Israel selama 100 tahun. Saat tiba di Stockholm, sekitar 30 orang simpatisan menyambut Thunberg dengan membawa bendera Palestina dan meneriakkan dukungan di tengah kerumunan media. Baca juga:Israel Deportasi Greta Thunberg, Sita Kapal Madleen Sebelum tiba di Swedia, Thunberg sempat transit di Paris. Di sana, ia menyampaikan tuduhan bahwa Israel telah menculik dirinya dan aktivis lain yang berada di kapal. “Saya paling mengkhawatirkan pelanggaran terhadap hukum internasional dan kejahatan perang yang terus dilakukan Israel,” ujarnya. Ia juga menuding Israel telah melakukan “genosida sistematis” dan “membuat lebih dari dua juta orang kelaparan secara sistematis” di Gaza. Sejumlah organisasi hak asasi manusia, termasuk Amnesty International, turut menyuarakan tuduhan genosida terhadap Israel. Namun, Pemerintah Israel membantah tegas semua tuduhan tersebut. “Kita harus bertindak. Kita harus menuntut agar pemerintah kita bertindak. Dan kita pun harus bertindak sendiri ketika pemerintah kita tidak bertindak,” ucap Thunberg dalam pernyataannya yang dikutipAFP, Rabu (11/6/2025). Nama Greta Thunberg dikenal sebagai simbol gerakan global perubahan iklim. Ia kerap menghindari perjalanan dengan pesawat untuk mengurangi jejak karbon, bahkan pernah melintasi Samudera Atlantik dua kali menggunakan kapal layar. Baca juga:Ratusan Aktivis Pro-Palestina Berusaha Tembus Blokade Israel Menuju Gaza Ketika ditanya wartawan soal keputusannya naik pesawat dalam perjalanan pulang kali ini, Thunberg tampak bingung. “Kenapa Anda bertanya soal itu?” katanya singkat.",Penulis tidak ditemukan,https://internasional.kompas.com/read/2025/06/12/061700270/soal-gaza-greta-thunberg--saya-tak-takut-ditahan-saya-takut-dunia-diam,"Kompas.com- 12/06/2025, 06:17 WIB"
Mendagri Ingatkan Pemda Segera Buat Kebijakan Pembatasan Tempat Merokok,"JAKARTA, KOMPAS.com- Menteri Dalam Negeri (Mendagri) Tito Karnavian mengingatkan kembali agar pemerintah daerah di seluruh Indonesia segera membuat regulasi pembatasan tempat merokok. Hal ini disampaikan Tito dalam Rakornas Kebijakan Kawasan Tempat Rokok (KTR) setelah diatur dalam Peraturan Pemerintah (PP) Nomor 28 Tahun 2024. ""Acara ini menjadi wake up call kita kembali, wake up call tentang pentingnya untuk kesehatan, terutama untuk masalah smoking, merokok,"" ujar Tito dalam keterangannya, Kamis (12/6/2025). ""Kebiasaan merokok berkurang dan kemudian di antaranya, salah satu instrumennya adalah membuat kebijakan pembatasan tempat-tempat rokok,” imbuhnya. Dalam kesempatan itu, Tito mengapresiasi sejumlah Pemda yang telah memiliki Perda dan Peraturan Kepala Daerah (Perkada) tentang KTR. Baca juga:Tak Cuma Rokok Biasa, Vaping Juga Akan Didenda di Kawasan Jakarta Ini Berdasarkan data Direktorat Jenderal (Ditjen) Otonomi Daerah (Otda) Kemendagri per Juni 2025, sebanyak 377 daerah (kabupaten/kota) telah memiliki Perda, sementara sebagian lainnya mengatur KTR melalui Perkada, yaitu sebanyak 109 daerah. Sedangkan terdapat 28 daerah yang belum memiliki Perda maupun Perkada tentang KTR sama sekali. Dalam kesempatan tersebut, Mendagri meminta Direktur Jenderal (Dirjen) Otda Kemendagri agar berkoordinasi dengan direktorat terkait di Kemenkes untuk menelusuri Perda yang dapat dijadikan role model. Perda yang akan jadi percontohan itu akan direplikasi oleh Pemda lain. Mendagri juga membuka kemungkinan untuk memberikan penghargaan kepada Pemda yang telah melakukan terobosan optimal dalamkebijakan KTR. “Beberapa daerah sudah menerapkan (kebijakan KTR). Mereka berani, berani menerapkan dan ini mungkin kita akan undang kapan-kapan dengan Pak Menkes, juga dengan mungkin dengan Komnas, Komite Nasional Pengendalian Tembakau ini. Kita bersama, kolaborasi Pak untuk memberikan penghargaan kepada beberapa daerah tersebut,” imbuh dia. Baca juga:Bisakah Berharap Rusun Bebas dari Asap Rokok? Dalam forum tersebut, mantan Kapolri itu juga menyarankan agar kebijakan KTR dicantumkan sebagai bagian dari komponen urusan wajib pelayanan dasar, khususnya pada bidang kesehatan. Namun, ia juga meminta Kemenkes dan Komnas Pengendalian Tembakau untuk memberikan usulan konkret terkait program tersebut. Dengan demikian, Kemendagri dapat melakukan penyesuaian terhadap kode anggaran dan program Pemda. Kode tersebut nantinya akan digunakan dalam Sistem Informasi Pemerintahan Daerah (SIPD). “Nah kalau udah ada terkunci, dari ketok APBD oleh DPRD dieksekusi, maka mau enggak mau berlaku program follow money. Uangnya sudah ada, alokasinya mau enggak mau dia harus dieksekusi, direalisasikan,” tandasnya.",Penulis tidak ditemukan,https://nasional.kompas.com/read/2025/06/12/20191401/mendagri-ingatkan-pemda-segera-buat-kebijakan-pembatasan-tempat-merokok,"Kompas.com- 12/06/2025, 20:19 WIB"
"Diduga Selewengkan Dana Operasional, Kejati Sumbar Sita Truk Dirut Perumda PSM","PADANG, KOMPAS.com– Tim penyidik Kejaksaan Tinggi Sumatera Barat (Kejati Sumbar) kembali menyita aset terkait dugaan korupsi di tubuh Perusahaan Umum Daerah Padang Sejahtera Mandiri (Perumda PSM). Kali ini, satu unit dump truck milik tersangka berinisial PI disita penyidik pada Rabu (11/6/2025). “Benar, Tim Penyidik Kejati Sumbar telah menyita satu unit dump truck milik tersangka berinisial PI,” kata Kepala Seksi Penyidikan Kejati Sumbar, M Rasyid dikutip dari Antara, Kamis (12/6/2025). Baca juga:Kasus Penyelewengan Dana di Bank Purworejo, Negara Rugi Rp 3,4 Miliar Kendaraan berat itu ditemukan di salah satu lokasi batching plant milik rekanan Perumda PSM. Setelah diverifikasi, penyidik langsung memasang garis sitaan pada unit tersebut sebagai barang bukti. Kepala Seksi Penyidikan lainnya, Lexy Fatharani Kurniawan, menyebut penyitaan dilakukan sebagai bagian dari penelusuran aliran dana dalam kasus ini. “Dalam tahap penyidikan kami berusaha menelusuri ke mana aliran dana, maka dari sanalah terungkap satu unit truk yang telah menjadi barang sitaan,” jelas Lexy. Baca juga:Penyelewengan BBM Subsidi Terbongkar, Polisi Sita 1.310 Liter Solar dan Tangkap 3 Pelaku Selain truk, penyidik juga telah menggeledah kantor Perumda PSM dan menyita uang tunai sebesar Rp13 juta. Uang tersebut disebut berasal dari pengembalian hasil pekerjaan tiga wahana taman bermain di kawasan Pantai Air Manis Padang yang dikelola perusahaan. “Kami akan terus menelusuri lebih dalam terkait aliran dana dari kasus ini, untuk mencari tahu siapa saja yang turut menikmati,” ujarnya. Sampai saat ini, penyidik baru menetapkan satu orang tersangka, yakni Direktur Utama Perumda PSM Padang, PI, yang telah ditahan sejak Kamis (22/5/2025). “Tidak tertutup kemungkinan adanya penambahan tersangka, karena penyidikan terhadap perkara ini masih terus berjalan sampai sekarang,” imbuh Lexy. Kasus ini bermula saat Perumda PSM menerima dana subsidi sebesar Rp18 miliar dari APBD Kota Padang melalui Dinas Perhubungan. Dana itu diperuntukkan untuk mendukung operasional Bus TransPadang dan membayar gaji pegawai. Namun, menurut hasil penyidikan, PI justru diduga menggunakan dana tersebut untuk keperluan di luar operasional. Termasuk di antaranya membangun wahana taman bermain yang kini mangkrak, membuka usaha semen beton, hingga melakukan transaksi hutang dengan bank tanpa persetujuan dewan pengawas. Berdasarkan audit Badan Pengawasan Keuangan dan Pembangunan (BPKP) Sumbar, perbuatan PI telah menimbulkan kerugian keuangan negara sebesar Rp2,7 miliar.",Penulis tidak ditemukan,https://regional.kompas.com/read/2025/06/12/204509478/diduga-selewengkan-dana-operasional-kejati-sumbar-sita-truk-dirut-perumda,"Kompas.com- 12/06/2025, 20:45 WIB"
