Title,FullText,Author,Url,Date
Seorang Jemaah Haji Kloter 1 asal Tulungagung Batal Pulang karena Sakit,"SURABAYA, KOMPAS.com- Seorangjemaah hajiyang tergabung dalamkloter 1asal KabupatenTulungagungdilaporkan tidak ikut pulang ke Tanah Air karenasakit. Jemaah tersebut direncanakan akan mengikuti penerbangan pada kloter selanjutnya. Plh Sekretaris Panitia Penyelenggara Ibadah Haji (PPIH) Embarkasi Surabaya, Sugiyo, menjelaskan bahwa jemaah haji tersebut diperbolehkan tinggal sementara di Arab Saudi. ""Jadi memang ada jemaah itu yang istilahnya tanazul. Tanazul itu ada yang tanazul karena sakit atau karena kepentingan dinas,"" kata Sugiyo saat berada di AHES, Kamis (12/6/2025). Baca juga:Antisipasi Covid-19, Jemaah Haji Jalani Cek Kesehatan di Bandara Juanda Sugiyo menambahkan bahwa pihaknya belum mendapatkan informasi detail mengenai identitas dan jenis penyakit yang diderita oleh jemaah tersebut. Namun, ia memperkirakan bahwa jemaah tersebut akan terbang pada kloter berikutnya. ""Nanti yang tanazul karena sakit akan diikutkan kloter berikutnya. Kalau info yang kami terima, ada satu dari kloter 1 ini yang berasal dari Tulungagung, tetapi kami belum mendapatkan informasi yang lebih lengkap,"" ujarnya. Pada hari pertama kepulangan, total jemaah haji yang tiba di Tanah Air ada 376 orang dari Kabupaten Tulungagung. Setelah tiba di asrama, mereka menjalani serangkaian proses hingga kembali ke daerah asal. Baca juga:Kelelahan, 2 Jemaah Haji Tulungagung Dilarikan ke Rumah Sakit Saat Tiba di Asrama Surabaya ""Setelah sampai di asrama, ada upacara penyambutan. Dilanjutkan dengan pemanggilan jemaah untuk melihat dan mengontrol tas besar mereka, serta sebagian tas kabin,"" ujar Sugiyo. Ia juga menambahkan, sebanyak 70 petugas disiapkan untuk membantu mengangkut tas besar jemaah ke truk atau mobil penjemputan. Ratusan jemaah tersebut kemudian diminta untuk memperlihatkan paspor mereka untuk pemeriksaan lebih lanjut. Setelah itu, setiap jemaah akan menerima air zam-zam dari petugas sebanyak 5 liter.",Penulis tidak ditemukan,https://surabaya.kompas.com/read/2025/06/12/215156078/seorang-jemaah-haji-kloter-1-asal-tulungagung-batal-pulang-karena-sakit,"Kompas.com- 12/06/2025, 21:51 WIB"
Gaji Hakim Naik 280 Persen Harus Diikuti Komitmen Moral dan Integritas,"JAKARTA, KOMPAS.com-Komisi Yudisial(KY) mengingatkan pesan soal komitmen moral usai PresidenPrabowo Subiantomengumumkan kenaikan gajihakimdi Indonesia. Pesan tersebut disampaikan agar para hakim harus dapat menjaga independensi dan integritasnya. ""KY mengingatkan sekaligus berharap, peningkatan kesejahteraan ini harus diikuti dengan komitmen moral hakim untuk menjaga integritas dan kemandirian,"" ujar Anggota sekaligus juru bicara KY Mukti Fajar Dewata saat dihubungi Kompas.com, Kamis (12/6/2025). Baca juga:Alasan Prabowo Naikkan Gaji Hakim: Agar Tidak Bisa Dibeli Dengan adanya kenaikangaji hakim, KY berharap tidak ada lagi aparatur peradilan hingga hakim yang melakukan korupsi dan menerima gratifikasi. Apalagi saat ini, publik tengah menyorot kondisi peradilan di Indonesia yang sedang tidak baik-baik saja. Di samping itu, KY mengapresiasi kebijakan pemerintah menaikkan gaji hakim. Hal tersebut dipandang sebagai upaya untuk meningkatkan kesejahteraan hakim. ""Presiden menyebutkenaikan gaji hakimtersebut bervariasi, yang tertinggi mencapai 280 persen untuk golongan paling junior,"" kata Mukti. Baca juga:Ini Gaji Hakim dan Tunjangannya Saat Ini, Bakal Naik 280 Persen Anggota Komisi III DPR Abdullah juga mengingatkan pentingnya integritas bagi para hakim dalam menjalankan tugas dan tanggung jawabnya. ""Kita semua tahu, integritas hakim adalah pondasi dari kepercayaan publik terhadap sistem hukum kita. Jadi kata kuncinya tidak hanya honor atau gaji, tapi integritas. Karena itu, selain peningkatan kesejahteraan, kami juga menekankan pentingnya pembinaan dan pengawasan yang berkelanjutan terhadap etika dan profesionalitas hakim,"" ujar Abdullah lewat keterangan tertulisnya, Kamis (12/6/2025). Ia berharap, kenaikan gaji hakim yang diumumkan Prabowo secara langsung dapat menjadi awal reformasi di sektor peradilan. Tegasnya, sistem hukum yang berkeadilan serta berpihak kepada rakyat menjadi komitmen antara antara eksekutif, legislatif, dan yudikatif. ""Kami mengapresiasi kebijakan Presiden Prabowo yang responsif terhadap kebutuhan para penegak hukum, khususnya para hakim. Kesejahteraan adalah bagian penting dalam menjaga marwah dan integritas lembaga peradilan,"" ujar Abdullah. Baca juga:Berapa Gaji Hakim Jika Dinaikkan Prabowo Menjadi 280 Persen? ""Negara yang kuat dibangun di atas keadilan. Dan keadilan itu hanya bisa ditegakkan jika para penegaknya hidup dengan layak dan bekerja dengan integritas tinggi,"" sambungnya. Diketahui, Prabowo mengumumkan kenaikan gaji hakim di Indonesia. Gaji para hakim akan naik secara bervariasi sesuai dengan golongannya. ""Saya Prabowo Subianto, Presiden Indonesia ke-8, hari ini mengumumkan bahwa gaji-gaji hakim akan dinaikkan demi kesejahteraan para hakim dengan tingkat kenaikan bervariasi sesuai golongan,"" ujar Prabowo di acara pengukuhan calon hakim di Mahkamah Agung (MA), Jakarta, Kamis (12/6/2025). Prabowo mengungkapkan, kenaikan gaji paling tinggi akan mencapai angka 280 persen. Lanjutnya, kenaikan gaji tertinggi itu akan diberikan kepada hakim yang paling junior. ""Di mana kenaikan tertinggi mencapai 280 persen dan golongan yang naik tertinggi adalah golongan junior, paling bawah,"" kata Prabowo disambut tepuk tangan meriah. Prabowo pun menegaskan semua hakim akan mendapat kenaikan gaji secara signifikan. Namun, ia tak merincikan detailnya dalam acara tersebut.",Penulis tidak ditemukan,https://nasional.kompas.com/read/2025/06/12/20432021/gaji-hakim-naik-280-persen-harus-diikuti-komitmen-moral-dan-integritas,"Kompas.com- 12/06/2025, 20:43 WIB"
"Atasi Kerusuhan Los Angeles, Trump Tak Terima Disebut Langkahi Gubernur: Saya Sudah Telepon","WASHINGTON, KOMPAS.com –Presiden Amerika Serikat Donald Trump membantah tudingan Gubernur California Gavin Newsom yang menyatakan tidak menerima komunikasi darinya saat kerusuhan pecah di Los Angeles sejak pekan lalu. Trump mengklaim telah berbicara langsung dengan Newsom selama kurang lebih 16 menit pada Sabtu (7/6/2025) dini hari waktu setempat. “Awalnya dia tidak menjawab panggilan pertama saya, tapi kemudian saya coba lagi dan dia mengangkat. Kami bicara sekitar 16 menit,” ujar Trump dalam wawancara denganFox Newssaat kunjungan ke Fort Bragg, Carolina Utara, Selasa (10/6/2025). Baca juga:Gubernur California Murka, Anggap Trump Lancang Kerahkan Pasukan ke Los Angeles Menurut Trump, dalam percakapan itu ia mendesak Newsom untuk segera mengambil tindakan mengendalikan situasi. “Saya bilang padanya, intinya, ‘Cepat bertindak dan hentikan kerusuhan yang sudah lepas kendali,’” ujarnya. Trump bahkan menunjukkan bukti berupa tangkapan layar panggilan yang ia lakukan pada 7 Juni pukul 01.23 pagi. Sementara itu, Direktur Komunikasi Gedung Putih Steven Cheung juga melontarkan kritik tajam kepada Newsom. “Presiden menelepon Gavin Newsom untuk memerintahkannya bertindak. Namun, gubernur justru lebih memilih memihak para perusuh daripada melindungi warganya,” ujar Cheung kepadaFox Digital. “Yang jelas-jelas berbohong di sini adalah Newsom, yang berkali-kali gagal memimpin dan malah sibuk tampil di media kiri untuk mengaburkan fakta daripada mengurus rakyatnya sendiri,” tambahnya. Namun, klaim dari Trump tersebut langsung dibantah oleh Newsom. Melalui unggahan di platform X pada Selasa sore, ia menegaskan tidak ada satu pun panggilan atau pesan suara dari Presiden. “Tidak ada panggilan. Bahkanvoicemailpun tidak ada. Warga AS patut cemas jika ada Presiden yang mengerahkan Marinir ke jalanan tapi tidak tahu pasti siapa yang sedang dia hubungi,” tulis Newsom sambil menyertakan video Trump di Ruang Oval. Tim komunikasi gubernur kemudian menambahkan bahwa panggilan yang dimaksud Trump sebenarnya terjadi tiga hari sebelum kerusuhan, bukan saat kekacauan berlangsung. Baca juga:Los Angeles Ricuh, Trump Setuju Gubernur California Ditangkap Juru bicara Newsom, Izzy Gardon, turut menegaskan tidak ada rekaman komunikasi apapun dari pihak Trump dalam waktu yang disebutkan. “Saya periksa langsung ponsel gubernur. Tidak ada panggilan tak terjawab, tidak ada voicemail, tidak ada sama sekali. Kontak terakhir mereka terjadi pada hari Jumat, dan itu pun saat gubernur yang menelepon Presiden,” ujar Gardon kepada Sacramento Bee. Kerusuhan di Los Angeles mulai pecah sejak Jumat (6/6/2025), dipicu oleh operasi penegakan imigrasi oleh aparat federal yang menahan sejumlah imigran ilegal.",Penulis tidak ditemukan,https://internasional.kompas.com/read/2025/06/12/060000770/atasi-kerusuhan-los-angeles-trump-tak-terima-disebut-langkahi-gubernur,"Kompas.com- 12/06/2025, 06:00 WIB"
Tom Lembong Sebut Keputusan Koperasi TNI Polri Impor Gula Wewenang Kemendag,"JAKARTA, KOMPAS.com- Menteri Perdagangan (Mendag) 2015-2016, Thomas Trikasih Lembong alias Tom Lembong, menyebut penunjukan koperasi TNI-Polri untuk mengimpor gula merupakan wewenangKementerian Perdagangan(Kemendag). Menurutnya, wewenang ini tidak terdapat pada Kementerian Koordinator (Kemenko) bidang Perekonomian, melainkan kementerian teknis. Menurut Tom Lembong, hal ini sesuai dengan keterangan eks SekretarisKemenko Perekonomian, Lukita Dinarsyah Tuwo, yang dihadirkan sebagai saksi perkara dugaan korupsi importasi gula yang menjeratnya di persidangan. Baca juga:Asosiasi Petani di Sidang Tom Lembong: Sejak Dewan Gula Dibubarkan Jokowi, Kami Tak Dilibatkan Lagi “Itu bukan ranah dan bukan wewenangnya Kemenko. Itu merupakan hal teknis yang merupakan ranah dan tanggung jawab, dan wewenang daripada kementerian teknis, dalam hal ini Kementerian Perdagangan,” ujar Tom Lembong saat ditemui di Pengadilan Tipikor Jakarta Pusat, Kamis (12/6/2025). Tom Lembong mengatakan, peran Kemenko bidang Perekonomian dan rapat koordinasi tingkat menteri di bawahnya hanya sebagai forum koordinasi dan sinkronisasi. “Bukan pelaksanaan. Pelaksanaan sepenuhnya di kementerian teknis,” ujar Tom Lembong. Selain itu, Tom Lembong juga menyebut, jika kebijakan importasi gula yang diambil Kemendag bermasalah, tentu Menteri Pertanian dan Menteri Badan Usaha Milik Negara (BUMN) akan melapor di rapat tersebut. Baca juga:Sidang Tom Lembong, PT DSI Raup Untung Rp 101,2 M dari Kerja Sama dengan PT PPI Namun, kata dia, saat itu tidak ada kementerian teknis di bawah Kemenko bidang Perekonomian yang menyampaikan keluhan. “Katakan petani tebu tidak suka atau mengeluh keberatan dengan impor. Menteri Pertanian pasti akan menyampaikan yang di rakor,” tutur Tom Lembong.",Penulis tidak ditemukan,https://nasional.kompas.com/read/2025/06/12/21341631/tom-lembong-sebut-keputusan-koperasi-tni-polri-impor-gula-wewenang-kemendag,"Kompas.com- 12/06/2025, 21:34 WIB"
Pemprov Aceh Singgung Kesepakatan 1992 soal Empat Pulau: Harusnya Ditetapkan Dulu Batas Laut,"BANDA ACEH, KOMPAS.com– Pemerintah Provinsi Aceh membantah pernyataan Kementerian Dalam Negeri (Kemendagri) yang menyebut perpindahan empat pulau ke Sumatera Utara (Sumut) berdasarkan kedekatan lokasi secara geografis. Kepala Biro Pemerintahan dan Otonomi Daerah Setda Aceh, Syakir, menegaskan bahwa hingga saat ini batas wilayah laut antara Aceh dan Sumut belum pernah ditetapkan secara resmi. “Harusnya ditetapkan dulu garis batas laut karena sudah ada kesepakatan Gubernur Aceh dan Gubernur Sumut pada tahun 1992, yang sampai dengan saat ini belum ada kesepakatan kedua gubernur yang merubah garis batas laut tersebut,” kata Syakir dalam keterangan tertulis, Kamis (12/6/2025). Ia menyebut pernyataan Dirjen Bina Administrasi Kewilayahan Kemendagri, Safrizal Zakaria Ali, yang menjadikan batas darat sebagai patokan penetapan kepemilikan empat pulau tersebut sebagai keliru. Baca juga:4 Pulau Dipindah ke Sumut, Muzakir Manaf: Sejak Dulu Itu Punya Aceh Syakir tak menampik bahwa jika dilihat secara geografis, empat pulau tersebut memang lebih dekat ke wilayah Tapanuli Tengah. Namun, ia menegaskan bahwa kepemilikan tidak bisa diputuskan hanya berdasarkan kedekatan jarak. “Dengan pernyataan Kemendagri itu semestinya jangan ditetapkan dulu empat pulau tersebut karena masih ada sengketa,” ujarnya. Ia merujuk pada Permendagri Nomor 141 Tahun 2017 tentang penegasan batas daerah, yang dalam Pasal 3 ayat (2) huruf f menyebutkan bahwa dokumen penegasan batas daerah harus mencakup kesepakatan batas yang pernah dibuat antara pemerintah daerah yang berbatasan. Dalam lampiran Permendagri itu juga dijelaskan bahwa penegasan batas laut harus melalui pengecekan lapangan dan pengumpulan dokumen seperti peta dasar serta dokumen lain yang disepakati para pihak. Selanjutnya, dilakukan pelacakan batas dan pemasangan Pilar Batas Permanen di titik acuan. Baca juga:4 Pulau Aceh Pindah ke Sumut Dekat Blok OSWA, Benarkah karena Potensi Cadangan Migas di Sekitarnya? “Perintah regulasi itu sudah jauh hari dilakukan Aceh dan Sumut berdasarkan kesepakatan bersama tahun 2002 antara Tim Penegasan Batas Daerah Aceh dan Sumut,” ungkap Syakir. Ia menyebutkan bahwa kesepakatan batas darat antara Kabupaten Aceh Singkil (Aceh) dan Kabupaten Tapanuli Tengah (Sumut) telah dituangkan dalam Peraturan Menteri Dalam Negeri Nomor 30 Tahun 2020. Namun, regulasi itu hanya menetapkan batas darat, bukan wilayah laut atau kepemilikan pulau. Hal ini, kata dia, juga telah dijelaskan dalam surat Gubernur Aceh tertanggal 4 Juli 2022 sebagai tanggapan terhadap surat Gubernur Sumut Nomor 125/6614 tentang kepemilikan empat pulau. Syakir memaparkan, pada 2008 sempat dilakukan pembakuan nama rupabumi secara terpisah. Dalam proses itu, Sumut lebih dulu mendaftarkan Pulau Panjang, Pulau Lipan, Pulau Mangkir Kecil/Ketek, dan Pulau Mangkir Besar/Gadang ke dalam daftar pulau miliknya. Baca juga:Empat Pulau Aceh yang Jadi Milik Sumut Dekat Blok Migas OSWA, Bobby Ajak Aceh Kelola Bareng Sementara saat giliran Aceh pada 20–22 November 2008, Tim Nasional Pembakuan Nama Rupabumi tidak mengizinkan empat pulau itu masuk dalam daftar Aceh, dengan alasan telah lebih dulu dicatat oleh Sumut dan tengah disengketakan. Ia juga menyinggung kekeliruan konfirmasi Gubernur Aceh pada 2009, yang telah dikoreksi melalui surat nomor 136/30705 tanggal 21 Desember 2018 kepada Menteri Dalam Negeri. Surat itu meminta revisi koordinat keempat pulau yang dianggap tidak relevan jika merujuk pada Berita Acara Rapat Kementerian/Lembaga tanggal 30 November 2017. Menurutnya, rapat tersebut dilakukan sepihak tanpa melibatkan Pemerintah Aceh. “Harusnya, ditetapkan dulu pagar rumah, otomatis rumah berada dalam wilayah. Nah, Kemendagri sebaliknya, yang dilakukan penetapan rumah dulu, padahal pagar dan halaman milik Aceh berdasarkan kesepakatan 1992,"" pungkas Syakir.",Penulis tidak ditemukan,https://regional.kompas.com/read/2025/06/12/202835678/pemprov-aceh-singgung-kesepakatan-1992-soal-empat-pulau-harusnya-ditetapkan,"Kompas.com- 12/06/2025, 20:28 WIB"
KPK Dalami Besaran Tarif Tak Resmi yang Diminta Eks Pegawai Kemenaker ke TKA yang Urus Izin,"JAKARTA, KOMPAS.com -Komisi Pemberantasan Korupsi (KPK) mendalami besaran tarif yang diminta para tersangkakasus pemerasanpengurusan izin Rencana Penggunaan Tenaga Kerja Asing (RPTKA) di Kementerian Ketenagakerjaan (Kemenaker) kepada para agen TKA. Materi tersebut didalami KPK saat memeriksa tiga saksi, yaitu Erwin Yostinus selaku wiraswasta (freelance jasa pengurusan RPTKA di Kemenaker); Ety Nurhayati selaku karyawan swasta (staf operasional PT Indomonang Jadi); dan Purwanto selaku staf operasional PT Dienka Utama. Pemeriksaan dilakukan di Gedung Merah Putih KPK, Jakarta, Kamis (12/6/2025). ""Ketiganya diperiksa terkait besaran tarif tidak resmi yang diminta oleh para tersangka agar proses pengurusan RPTKA dipercepat,"" kata Juru Bicara KPK Budi Prasetyo dalam keterangannya, Kamis. Baca juga:KPK Panggil Eks Sekjen Kemenaker sebagai Saksi Kasus Pemerasan Izin TKA Budi mengatakan, penyidik juga mendalami tindakan yang dilakukan para tersangka jika tidak menerima uang yang diminta dari para agen TKA untuk pengurusan izin RPTKA. ""KPK mendalami apa yang akan dilakukan oleh para tersangka jika uang tarif tidak resmi tersebut tidak diberikan oleh para agen TKA,"" ujarnya. Dalam perkara ini, Komisi Pemberantasan Korupsi (KPK) menetapkan delapan orang tersangka dalam kasus pemerasan pengurusan izin Rencana Penggunaan Tenaga Kerja Asing (RPTKA) di Kementerian Ketenagakerjaan (Kemenaker) pada Kamis (5/6/2025). ""Harus saya sampaikan bahwa per tanggal 19 Mei 2025, KPK telah menetapkan delapan orang tersangka terkait dengan tindak pidana korupsi yang saya sebutkan tadi di atas,"" kata Plh Direktur Penyidikan KPK Budi Sukmo dalam konferensi pers di Gedung Merah Putih, Jakarta, Kamis. Kedelapan tersangka adalah Suhartono (SH) selaku eks Dirjen Pembinaan Penempatan Tenaga Kerja dan Perluasan Kesempatan Kerja (Binapenta dan PKK); Haryanto (HY) selaku Dirjen Binapenta Kemenaker periode 2024-2025. Baca juga:Ketika KPK Duga Pemerasan TKA Juga Terjadi di Imigrasi, Tak Hanya di Kemenaker Kemudian Wisnu Pramono (WP) selaku Direktur Pengendalian Penggunaan TKA (PPTKA) Kemenaker tahun 2017-2019; Devi Angraeni (DA) selaku Koordinator Uji Kelayaan Pengesahan Pengendalian Penggunaan TKA; Gatot Widiartono (GTW) selaku Kepala Sub Direktorat Maritim dan Pertanian di Direktorat Jenderal Pembinaan Penempatan Tenaga Kerja dan Perluasan Kesempatan Kerja; serta Putri Citra Wahyoe (PCW), Jamal Shodiqin (JMS), dan Alfa Eshad (ALF) selaku staf. KPK mengatakan, para tersangka telah menerima uang hasil pemerasan sebesar Rp 53,7 miliar dari para pemohon izin RPTKA selama periode 2019-2024. Budi merinci uang yang diterima para tersangka di antaranya, Suhartono (Rp 460 juta), Haryanto (Rp 18 miliar), Wisnu Pramono (Rp 580 juta), Devi Angraeni (Rp 2,3 miliar), Gatot Widiartono (Rp 6,3 miliar), Putri Citra Wahyoe (Rp 13,9 miliar), Alfa Eshad (Rp 1,8 miliar), dan Jamal Shodiqin (Rp 1,1 miliar).",Penulis tidak ditemukan,https://nasional.kompas.com/read/2025/06/12/20253711/kpk-dalami-besaran-tarif-tak-resmi-yang-diminta-eks-pegawai-kemenaker-ke-tka,"Kompas.com- 12/06/2025, 20:25 WIB"
"Bocah 1 Tahun 11 Bulan di Singkawang Hilang Misterius, Polisi Sisir Pakai Anjing Pelacak","SINGKAWANG, KOMPAS.com– Seorang bocah berusia 1 tahun 11 bulan,Rafa Fauzan, dilaporkan hilang secara misterius di KotaSingkawang, Kalimantan Barat (Kalbar) sejak Selasa (10/6/2026) siang. Hingga Kamis (12/6/2025) sore, upayapencarianyang dilakukan oleh berbagai pihak masih belum membuahkan hasil. Kasat Reskrim Polres Singkawang, AKP Deddi Sitepu, menyatakan bahwa pihaknya telah mengerahkan dua ekor anjing pelacak (tim K-9) dari Polda Kalbar untuk membantu pencarian di sekitar lokasi hilangnya Rafa. Baca juga:Hilang Kendali, Bus MGI Tabrak Rumah dan Pohon di Sukabumi, Sopir Tewas “Pencarianfokus di Jalan RA Kartini Gang Kapas, Kelurahan Sekip Lama, Kecamatan Singkawang Tengah,” ungkap Deddi kepada wartawan pada Kamis sore. Deddi menjelaskan bahwa tim K-9 telah menemukan aroma yang diduga berasal dari tubuh korban di satu titik yang tidak jauh dari rumah pengasuhnya. “Kedua anjing pelacak berhenti di lokasi yang sama. Saat ini, kami masih menganalisis hasil olah tempat kejadian perkara. Kami berharap ada titik terang dalam kasus ini,” tambahnya. Ia juga menambahkan bahwa hasil penciuman anjing pelacak akan dikembangkan lebih lanjut, termasuk penelusuran rekaman CCTV warga di sekitar lokasi. Rafa Fauzan adalah anak ketiga dari pasangan suami istri, Rasiwan, seorang ASN di Satpol PP, dan Hazni Fatziah, ASN di Rumah Sakit Abdul Aziz Singkawang. Saat kejadian, Rafa sedang diasuh oleh seorang tetangga bernama Riska di rumahnya di Gang Kapas. Baca juga:Gudang Rumput Laut di Nunukan Dimaling, 200 Karung Hilang, Pemilik Rugi Rp 375 Juta Menurut kesaksian di lokasi, saat itu Rafa berada di dapur, sementara Shellsi, anak dari pengasuh, masuk ke kamar. Setelah sekitar dua menit, ketika Shellsi keluar dari kamar, Rafa sudah tidak ada dan pintu belakang rumah ditemukan dalam keadaan terbuka. “Upaya pencarian masih terus kami lakukan,” tutup Deddi.",Penulis tidak ditemukan,https://regional.kompas.com/read/2025/06/12/202805178/bocah-1-tahun-11-bulan-di-singkawang-hilang-misterius-polisi-sisir-pakai,"Kompas.com- 12/06/2025, 20:28 WIB"
"Saat Wamendagri Ribka Haluk ""Minta Ampun"" jika Terjadi PSU Jilid II di Papua","JAKARTA, KOMPAS.com -Wakil Menteri Dalam Negeri,Ribka Haluk, mengaku ""meminta ampun"" kepada Menteri Dalam NegeriTito Karnavianjika Provinsi Papua harus menjalani pemungutan suara ulang (PSU) Jilid II. Sebab saat ini pemerintah daerah sudah kewalahan dengan pemungutan suara ulang, khususnya di bagian anggaran pembiayaan. ""Saya sudah sisir semua APBD yang ada di daerah, jujur saja hampir (semua) teman-teman di daerah ini sudah posisinya angkat tangan,"" kata Ribka dalam acara HUT Ke-13 Dewan Kehormatan Penyelenggara Pemilu (DKPP) di Kantor DKPP, Jakarta Pusat, Kamis (12/6/2025). ""Dan saya sudah laporkan ke Pak Menteri, kalau ada PSU lagi (jilid II), saya minta ampun ya,"" ucap Ribka sambil mengangkat tangan. Baca juga:PSU Papua Digelar 6 Agustus Mendatang, Anggaran Dipastikan Tersedia Dia menjelaskan, saat ini ada beberapa daerah yang masih menggelar PSU karena konsekuensi putusan Mahkamah Konstitusi (MK) terkait sengketa Pilkada. Dia meminta jajaran penyelenggara pemilu yang hadir dalam forum itu serius menjalankan proses PSU agar tak terjadi PSU jilid II yang diakibatkan oleh penyelenggara. ""Yang masih PSU ulang ini menjadi tanggung jawab kita bersama,"" tandasnya. Dalam kesempatan sebelumnya, Ribka memastikan anggaran pelaksanaan PSU di Provinsi Papua sebesar Rp 160 miliar telah tersedia. Ketersediaan anggaran ini dipastikan dalam penandatanganan Naskah Perjanjian Hibah Daerah (NPHD) antara Pemerintah Provinsi (Pemprov) Papua dengan penyelenggara pemilu maupun pihak keamanan. ""Kalau sudah (menandatangani) NPHD, artinya itu sudah dasar hukumnya, sudah pasti bahwa itu akan dibiayai sesuai dengan NPHD yang ada,"" ujar Ribka, Kamis (15/5/2025). Baca juga:PSU Pilkada Papua, Ramses Limbong Ingatkan KPU agar Distribusi Logistik Harus Tepat Waktu Ribka menegaskan, pihaknya bakal terus mendampingi pemerintah daerah (Pemda) yang menggelar PSU sehingga berjalan sesuai ketentuan, terutama terkait dukungan APBD dalam membiayai pelaksanaan PSU. Dia juga menjelaskan, pembiayaanPSU Papuayang akan digelar pada 6 Agustus 2025 dengan menggunakan APBD merupakan amanat dari Undang-Undang (UU) Nomor 10 Tahun 2016 tentang Pemilihan Kepala Daerah. ""Itu amanat undang-undang, jadi kita mengimplementasikan atau kita melaksanakan amanat tersebut,"" imbuh Ribka. Sebagai informasi, Provinsi Papua menjadi salah satu daerah yang harus menggelar PSU sesuai dengan putusan Mahkamah Konstitusi (MK) pada 24 Februari 2025. Dalam putusannya, MK memerintahkan KPU Provinsi Papua untuk menggelar PSU tanpa keikutsertaan salah satu calon gubernur, Yermias Bisai, karena terbukti tidak jujur dan tidak beritikad baik dalam memenuhi persyaratan pencalonan. Diharapkan masyarakat mengawasi ketat pelaksanaan pemungutan suara ulang yang harus digelar paling lambat 180 hari sejak putusan dibacakan itu.",Penulis tidak ditemukan,https://nasional.kompas.com/read/2025/06/12/20353201/saat-wamendagri-ribka-haluk-minta-ampun-jika-terjadi-psu-jilid-ii-di-papua,"Kompas.com- 12/06/2025, 20:35 WIB"
