Title,FullText,Author,Url,Date
"Indonesia Beli Jet Tempur Kaan Rp 162 Triliun, Turkiye Pecah Rekor","JAKARTA, KOMPAS.com —Setelah menandatangani kesepakatan baru dengan Perancis untuk menambah pesanan jet tempur Rafale, Indonesia kini menyepakati pembelian 48 unit jet tempur generasi kelima Kaan buatan Turkiye. Presiden Turkiye Recep Tayyip Erdogan menyampaikan hal tersebut di platform X pada Rabu (11/6/2025), seraya menegaskan bahwa Indonesia adalah “negara sahabat dan saudara” bagi Turkiye. ""Sebagai bagian dari perjanjian yang ditandatangani dengan negara sahabat dan saudara kita, Indonesia, sebanyak 48 Kaan akan diproduksi di Turkiye dan dikirim ke Indonesia,"" tulis Erdogan melalui unggahan di platform X. Baca juga:Indonesia Siap Beli Jet Rafale Lagi meski Pernah Tumbang oleh Jet Tempur Buatan China Millî muharip uça??m?z KAAN ile ilgili çok önemli ve güzel bir geli?meyi milletimle payla?mak istiyorum… Dost ve karde? Endonezya ile imzalad???m?z anla?ma çerçevesinde 48 adet KAAN, Türkiye’de üretilerek Endonezya’ya ihraç edilecek.…pic.twitter.com/D9wZ33wzgz Menurut media setempat, nilai kontrak ini mencapai 10 miliar dollar AS atau sekitar Rp 162 triliun, rekor tertinggi bagi ekspor militer Turkiye. Pengiriman jet dilakukan secara bertahap selama sepuluh tahun ke depan. Selain itu, kesepakatan ini juga mencakup kerja sama teknologi, di mana sejumlah kemampuan manufaktur dalam negeri Indonesia akan dilibatkan dalam proses produksi. ""Kapabilitas dalam negeri Indonesia juga akan digunakan dalam produksi jet Kaan,"" tambah Erdogan tanpa menjelaskan detail teknis lebih lanjut. Jet tempur Kaan merupakan proyek unggulan Turkish Aerospace Industries (TAI) dan telah melakukan penerbangan perdana pada Februari 2024. Awalnya pesawat ini dilengkapi mesin sekelas F-16, tetapi Turkiye berambisi untuk menyematkan mesin produksi dalam negeri pada versi lanjutannya. Baca juga:Jet Tempur Pakistan Buatan China Jatuhkan Jet Rafale India Sektor pertahanan Turkiye belakangan memang mencatat pertumbuhan pesat. Pada 2024, total ekspor industri pertahanan negara itu mencapai 7,1 miliar dollar AS (sekitar Rp 115 triliun), meningkat signifikan dibanding tahun sebelumnya. Selain Kaan, produk sepertidroneBayraktar turut berkontribusi terhadap angka ekspor tersebut. Langkah Indonesia menggaet Turkiye terjadi hanya beberapa minggu setelah Presiden Prabowo Subianto menerima kunjungan Presiden Perancis Emmanuel Macron di Jakarta. Dalam kunjungan itu, kedua pemimpin menandatanganiletter of intent(LoI) yang membuka jalan bagi penambahan pesanan jet Rafale, melengkapi kontrak awal pada 2022 yang mencakup 42 unit senilai lebih dari Rp 130 triliun. Meski performa Rafale sempat jadi sorotan usai jatuh ditembak di perbatasan India–Pakistan, pesawat ini tetap dianggap sebagai salah satu jet tempur paling canggih saat ini. Baca juga:5 Keunggulan Jet Tempur KAAN Turkiye yang Baru Dibeli Indonesia, 1 Unit Rp 3,3 Triliun ",Penulis tidak ditemukan,https://internasional.kompas.com/read/2025/06/12/064518870/indonesia-beli-jet-tempur-kaan-rp-162-triliun-turkiye-pecah-rekor,"Kompas.com- 12/06/2025, 06:45 WIB"
"Soal 4 Pulau Masuk Sumut, Erni Ariyanti Minta Patuhi Mendagri","MEDAN, KOMPAS.com- Ketua Dewan Perwakilan Rakyat Daerah (DPRD) Sumatera Utara,Erni Ariyanti, meminta semua pihak mematuhi keputusan Menteri Dalam Negeri, Tito Karnavian, terkait penetapan empat pulau yang kini menjadi bagian dari Sumatera Utara. Kementerian Dalam Negeri juga menyatakan, jika ada gugatan, dipersilakan untuk mengajukan ke Pengadilan Tata Usaha Negara (PTUN). ""Pak Mendagri sudah buka suara jika memang ada gugatan, ke PTUN mempersilahkan Provinsi Aceh,"" ujar Erni Ariyanti di kantorDPRD Sumut, Kamis (12/6/2025). Baca juga:Pemprov Aceh Singgung Kesepakatan 1992 soal Empat Pulau: Harusnya Ditetapkan Dulu Batas Laut Erni menambahkan, Gubernur Sumatera Utara Bobby Nasution telah berkunjung ke Aceh. Tindakan tersebut perlu diapresiasi sebagai upaya untuk meredakan ketegangan di masyarakat Aceh. Meskipun demikian, Erni menegaskan, Sumatera Utara harus mempertahankan keempat pulau tersebut agar tetap menjadi bagian dari provinsi ini. ""Ya kita harus mempertahankan juga ya. Ya kita tunggulah hasil diskusi dari pemerintah,"" tuturnya. Baca juga:Guru Besar USK soal 4 Pulau Aceh Masuk Sumut: Bukan Sekadar Pengalihan tapi Pengabaian Politisi Golkar ini juga menyampaikan, Bobby Nasution telah menawarkan pengelolaan bersama jika terdapat potensi di daerah tersebut. Pada kesempatan itu, Erni menekankan bahwa penetapan empat pulau tersebut didasarkan pada kajian yang mendalam dan bukan keputusan yang diambil secara sembarangan. ""Ya tidak tiba-tiba, ini ada kajian ilmiahnya,"" pungkas Erni. Sebelumnya, Kementerian Dalam Negeri telah menetapkan empat pulau yang sebelumnya merupakan bagian dari wilayah Aceh kini masuk ke dalam administrasi Kabupaten Tapanuli Tengah, Sumatera Utara. Keputusan ini tercantum dalam Keputusan Menteri Dalam Negeri Nomor 300.2.2-2138 Tahun 2025 tentang Pemberian dan Pemutakhiran Kode serta Data Wilayah Administrasi Pemerintahan dan Pulau, yang ditetapkan pada 25 April 2025. Keempat pulau yang dimaksud adalah Pulau Lipan, Pulau Panjang, Pulau Mangkir Besar, dan Pulau Mangkir Kecil.",Penulis tidak ditemukan,https://medan.kompas.com/read/2025/06/12/205958678/soal-4-pulau-masuk-sumut-erni-ariyanti-minta-patuhi-mendagri,"Kompas.com- 12/06/2025, 20:59 WIB"
"Jalan Rusak di Kalteng Dikeluhkan Warga, Wagub: Tak Semua Kewenangan Pemprov","PALANGKA RAYA, KOMPAS.com- Keluhankerusakan jalandi Provinsi Kalimantan Tengah (Kalteng) marak terjadi sejak sebulan terakhir.Jalan rusakbanyak dikeluhkan masyarakat dari berbagai daerah ke media sosial dan kerap mendapat banyak respons. Keluhan banyak disampaikan kepada Pemerintah Provinsi (Pemprov) Kalteng agar segera memperbaiki jalan yang mengalami kerusakan tersebut. Namun, tidak semua jalan di yang dikeluhkan rusak berada di bawah kewenangan Pemprov Kalteng, sebab masih ada jalan nasional yang berada di bawah kewenangan balai Kementerian Pekerjaan Umum (PU). Baca juga:Saat Warga di Blora Hadang Truk Pertamina, Tuntut Perbaikan Jalan Rusak... Wakil Gubernur (Wagub) Kalteng Edy Pratowo tidak menampik masih banyak warga yang beranggapan bahwa persoalanjalan rusakdi Kalteng sepenuhnya menjadi tanggung jawab Pemprov, padahal terdapat jalan nasional yang dikelola oleh Balai Jalan Nasional Kementerian PU. “Kami harap ke depannya antara balai jalan nasional dan pemerintah daerah lebih nyambung lagi (komunikasinya), istilahnya tidak ada egosektoral, jadi masing-masing lembaga bersatu untuk menyelesaikan persoalan yang ada,” ujar Edy saat diwawancarai awak media di Kantor DPRD Kalteng, Palangka Raya, Kamis (12/6/2025). Edy menjelaskan, persoalan kerusakan jalan nasional di Kalteng perlu solusi bersama antara Pemprov Kalteng dan Kementerian PU melalui unit kerjanya seperti Balai Jalan Nasional. Sebab, kerusakan jalan nasional di Kalteng tidak berbanding lurus dengan anggaran penanganan jalan nasional yang digelontorkan oleh pemerintah pusat. Anggaran yang dialokasikan masih belum cukup untuk menangani kerusakan jalan nasional di Kalteng. “Misalnya seperti kendala tadi, balai sudah mengusulkan anggaran perbaikan (jalan nasional di Kalteng) sekian, tapi ternyata yang dikeluarkan kurang dari usulan, bisa disampaikan ke Pemprov Kalteng, supaya kami bisa sama-sama mencari solusinya,” jelas Edy. Baca juga:Anggaran Perbaikan Jalan Nasional di Kalteng Tak Sebanding Kerusakan, Wagub: Akhirnya Tambal Sulam... Selama ini, pihaknya selalu menekankan tidak adanya egosektoral antarlembaga, visi-misi kepala negara hingga kepala daerah harus selalu terimplementasikan dalam kerja-kerja lembaga negara. “Sebenarnya bukan bicara soal egosektoral, tetapi komunikasi dan kolaborasi antarinstansi saja yang perlu dipertajam, itu yang penting sekarang,” pungkas Edy.",Penulis tidak ditemukan,https://regional.kompas.com/read/2025/06/12/214648978/jalan-rusak-di-kalteng-dikeluhkan-warga-wagub-tak-semua-kewenangan-pemprov,"Kompas.com- 12/06/2025, 21:46 WIB"
"Diduga Tak Perhatikan Arus Lalin, Dua Motor Adu Banteng","BANGKALAN, KOMPAS.com- Dua sepeda motor terlibat kecelakaan di Jalan Raya Halim Perdana Kusuma, Kecamatan Burneh, KabupatenBangkalan, Jawa Timur, Kamis (12/6/2025). Kecelakaan ini diduga disebabkan oleh pengemudi yang tidak memperhatikan arus lalu lintas, sehingga terjadi adu banteng. Banit Gakkum Satlantas Polres Bangkalan, Aipda M Buchori, menjelaskan bahwa kecelakaan bermula ketika sepeda motor dengan pelat M 6741HF yang dikendarai oleh M (27) dan penumpangnya RM (21), melaju dari arah selatan menuju utara. Baca juga:Kronologi Ambulans Pasien Darurat Tabrakan dengan Land Cruiser di Pelalawan Keduanya berencana belok ke kanan menuju perumahan Khayangan Residence. Namun, saat akan berbelok, mereka bertabrakan dengan sepeda motor lain yang dikendarai AR (16) dan penumpangnya L (38), yang datang dari arah depan dengan pelat M 3358 IK. Kecelakaan tersebut terekam oleh kamera pengawas di pintu masuk perumahan. Dalam rekaman berdurasi 29 detik tersebut, terlihat bahwa motor yang dikendarai AR melaju dengan kecepatan tinggi, sementara M berbelok ke arah perumahan. ""Diduga pengemudi tidak memperhatikan arus lalu lintas, sehingga terjadilah kecelakaan tersebut,"" ungkap Aipda Buchori. Akibat kecelakaan ini, empat orang dari kedua kendaraan tersebut jatuh terpental. Baca juga:Ambulans Tabrakan dengan Land Cruiser di Pelalawan, Sopir dan Pasien Tewas Dua pengemudi mengalamiluka berat, sedangkan masing-masing penumpang mengalami luka ringan. Saat ini, semua korban masih dirawat di RSUD Syarifah Ambami Rato Ebhu Bangkalan. Sementara itu, kedua kendaraan mengalami kerusakan parah di bagian depan akibat tabrakan tersebut. ""Korban masih dirawat, untuk kendaraan sudah kami amankan dan kondisinya ringsek bagian depan,"" pungkas Buchori.",Penulis tidak ditemukan,https://surabaya.kompas.com/read/2025/06/12/214840678/diduga-tak-perhatikan-arus-lalin-dua-motor-adu-banteng,"Kompas.com- 12/06/2025, 21:48 WIB"
Ahli UI Akui Analisis Kasus Hasto Hanya Berdasarkan Ilustrasi Penyidik KPK,"JAKARTA, KOMPAS.com- Ahli Bahasa dari Universitas Indonesia (UI),Frans AsisiDatang, menjelaskan bahwa analisis perkara Sekretaris Jenderal (Sekjen) Partai Demokrasi Indonesia Perjuangan (PDI-P)Hasto Kristiyantoyang dituangkan dalam Berita Acara Pemeriksaan (BAP) hanya berdasarkan 29 poin ilustrasi dari penyidik Komisi Pemberantasan Korupsi (KPK). Pernyataan ini disampaikan Frans menjawab pertanyaan kuasa hukum Hasto, Febri Diansyah, yang mengonfirmasi apakah dosen Fakultas Ilmu Bahasa (FIB) UI itu diberikan BAP para saksi dalam perkara Sekjen PDI-P tersebut. Diketahui, Hasto merupakan terdakwakasus dugaan suappergantian antar-waktu (PAW) anggota DPR RI dan perintangan penyidikan perkara buron Harun Masiku. ""Kalau di perkara ini, agarclearsaja ya pak ya, di perkara ini bapak diberikan salinanBAP saksi-saksi?"" tanya Febri dalam sidang di Pengadilan Tindak Pidana Korupsi (Tipikor) pada Pengadilan Negeri (PN) Jakarta Pusat, Kamis (12/6/2025). Baca juga:Hasto: Keterangan Ahli Bahasa dalam Sidang Dipengaruhi Ilustrasi dari Penyidik KPK ""Tadi sudah saya jawab, tidak (diberikan salinan BAP saksi lain),"" jawab Frans. Mendengar jawaban itu, Febri lantas mempertanyakan analisis Frans. Pasalnya, analisis tersebut dilakukan hanya berdasarkan puluhan ilustrasi yang diberikan oleh penyidik. ""Berarti yang bapak terima 29 poin ilustrasi di awal tadi?"" tanya Febri. ""Iya,"" timpal Frans. ""29 poin ilustrasi tanpa informasi keterangan saksi-saksi?"" cecar Febri melanjutkan. ""Betul,"" kata Frans. Eks juru bicara KPK itu pun terus mencecar Frans soal hasil analisis yang dituangkan dalam BAP. Pasalnya, kondisi ini berbeda ketika Frans menjadi ahli bahasa di perkara lain. Baca juga:Soal Chat “Ok Sip” Hasto ke Saeful Bahri, Ronny Talapessy: Bukan Menyetujui Dalam menganalisis komunikasi, dosen UI ini biasanya diberikan seluruh salinan keterangan atau BAP saksi. ""Kalau di pemeriksaan di luar perkara ini, di kasus lain, maksud bapak tadi ya? Itu bapak diberikan informasi tentang keterangan saksi-saksi yang cukup banyak ya pak?"" tanya Febri mengonfirmasi.",Penulis tidak ditemukan,https://nasional.kompas.com/read/2025/06/12/20074851/ahli-ui-akui-analisis-kasus-hasto-hanya-berdasarkan-ilustrasi-penyidik-kpk,"Kompas.com- 12/06/2025, 20:07 WIB"
"Rencana Giant Sea Wall Digagas Sejak Era Soeharto, Prabowo: Tak Ada Lagi Penundaan","JAKARTA, KOMPAS.com- Presiden RIPrabowo Subiantomenegaskan tidak ada lagi penundaan terhadap pembangunan proyek tanggul laut raksasa ataugiant sea walldi sepanjang Pantai Utara Pulau Jawa. ""Sekarang tidak ada lagi penundaan, sudah enggak perlu lagi banyak bicara. Kita akan kerjakan itu segera,"" kata Prabowo dalam acara International Conference on Infrastructure (ICI) di JCC, Senayan, Jakarta, Kamis (12/6/2025). Bagi Prabowo, proyek infrastruktur ini sangat strategis dan vital bagi Indonesia. Selain itu, rencana proyek giant sea wall sudah ada sejak 1995 di era Presiden RI ke-2 Soeharto. Baca juga:Prabowo Minta Pemprov DKI Urunan Bangun Giant Sea Wall di Teluk Jakarta ""Proyek ini sangat vital. Proyek ini berada dalam perencanaan Bappenas sejak tahun 1995. Bayangkan. Sejak tahun 95. 30years ago(30 tahun lalu) kalau tidak salah ya, tapi kita tidak berkecil hati,"" ungkap Prabowo. AdapunGiant Sea Wallyang merupakan salah satuProyek Strategis Nasional(PSN) yang dirancang untuk melindungi pesisir Pantai Utara Jawa, membentang dari Jakarta hingga Gresik, Jawa Timur. Prabowo juga menyebut, anggaran megaproyek ini sangat besar mencapai 80 miliar dollar Amerika Serikat (USD). ""Kalau tidak salah sekitar 500 km dari Banten sampai ke Jawa Timur, Gresik, 500 km dan perkiraan biaya yang diperlukan 80 miliar dollar (Amerika Serikat/USD),"" ucap Prabowo. Baca juga:Prabowo Segera Bentuk Badan Otorita Giant Sea Wall Pantai Utara Jawa Proses pengerjaannya juga, kata Prabowo, memakan waktu puluhan tahun. Meski begitu, Prabowo menegaskan proyek ini akan segera dimulai. ""Tapi ini vital dan ini suatu megaproyek. Saya akan mulai saya tidak tahu presiden mana yang akan menyelesaikan. Tapi kita harus mulai dan kita akan mulai,"" imbuhnya. Kepala Negara juga akan segera membentuk badan otorita terkait pembangunan giant sea wall ini. ""Kita akan segera mulai itu saya sudah perintahkan satu tim untuk roadshow keliling dan dalam waktu dekat saya akan bentuk otorita, badan otorita tanggul laut pantai utara Jawa,"" ujar eks Menhan ini.",Penulis tidak ditemukan,https://nasional.kompas.com/read/2025/06/12/20281491/rencana-giant-sea-wall-digagas-sejak-era-soeharto-prabowo-tak-ada-lagi,"Kompas.com- 12/06/2025, 20:28 WIB"
Jejak Pengedar Uang Palsu di Purworejo: dari Facebook ke Grup WhatsApp,"PURWOREJO, KOMPAS.com -Jajaran Satreskrim PolresPurworejomengungkap praktikperedaran uang palsuyang dilakukan seorang pemuda asal Banyumas, berinisial B (24). Aksi pelaku terdeteksi setelah ia bergabung dalam sebuah grup WhatsApp bernama ""Elite Global Rezero"", yang sebelumnya ia akses melalui tautan dari Facebook. Kasus ini bermula ketika warga melaporkan adanya transaksi mencurigakan dengan uang pecahan palsu. Setelah dilakukan penyelidikan, polisi berhasil menangkap pelaku di wilayah Kecamatan Purwodadi, Kabupaten Purworejo, Jawa Tengah. Baca juga:Warga Banyumas Mengaku 9 Kali Beli Uang Palsu di E-commerce dan Edarkan di Purworejo Kapolres Purworejo AKBP Andry Agustiano mengatakan, kasus ini bermula saat pelaku melihat promosi penjualan uang palsu di Facebook. Tertarik dengan tawaran tersebut, pelaku menghubungi penjual dan diarahkan untuk bergabung ke dalam grup WhatsApp bernama ""Elite Global Rezero"" ""Di dalam grup tersebut, pelaku memperoleh tautan untuk melakukan pembelian uang palsu melalui aplikasi belanja online,"" kata Kapolres dalam keterangan resminya Kamis (12/6/2025). Pelaku sudah memesan sebanyak sembilan kali dengan total uang asli senilai Rp 3,8 juta, yang ditukarkan menjadi uang palsu sekitar Rp10,8 juta. ""Pelaku memesan uang palsu pecahan Rp 50.000 dan Rp 100.000, lalu menggunakannya untuk berbelanja di toko kelontong di wilayah Purworejo,"" jelas Kapolres. Baca juga:Polisi Belum Tahan Mahasiswi Pencetak Uang Palsu di Palopo, Ini Alasannya Penangkapan pelaku dilakukan pada 13 Mei 2025 di Simpang 4 Desa Geparang, Kecamatan Purwodadi, Purworejo. Barang bukti yang disita meliputi sejumlah uang palsu, satu unit ponsel, serta bukti pengiriman paket dari platform belanja online. Polres Purworejo menerapkan Pasal 36 Ayat (2) jo Pasal 26 Ayat (2) Undang-Undang Nomor 7 Tahun 2011 tentang Mata Uang, dengan ancaman hukuman maksimal 15 tahun penjara dan denda hingga Rp50 miliar. ""Kami mengimbau jika ada warga menemukan uang palsu agar segera melaporkannya ke kantor polisi terdekat,"" Imbau Kapolres.",Penulis tidak ditemukan,https://regional.kompas.com/read/2025/06/12/204311878/jejak-pengedar-uang-palsu-di-purworejo-dari-facebook-ke-grup-whatsapp,"Kompas.com- 12/06/2025, 20:43 WIB"
Ahli Sebut “Bapak” dalam Telepon Harun Masiku Merujuk ke Hasto,"JAKARTA, KOMPAS.com- Ahli Bahasa Universitas Indonesia (UI),Frans Asisi Datang, berpendapat bahwa kata “Bapak” dalam percakapan teleponHarun Masikusebelum jejaknya lenyap merujuk pada Sekretaris Jenderal (Sekjen) PDI-P,Hasto Kristiyanto. Keterangan ini disampaikan Frans saat diperiksa sebagai ahli dalam sidang dugaan suap dan perintangan penyidikan kasus Harun Masiku yang menjerat Hasto di Pengadilan Tipikor Jakarta Pusat, Kamis (12/6/2025). Pada persidangan tersebut, jaksa penuntut umum Komisi Pemberantasan Korupsi (KPK) kembali memutar sadapan rekaman telepon antara Harun dan petugas keamanan Rumah Aspirasi tempat Hasto kadang berkantor, Nurhasan. Baca juga:Ahli UI Akui Analisis Kasus Hasto Hanya Berdasarkan Ilustrasi Penyidik KPK “Bapak di mana? Bapak di mana? Bapak aja di mana?” tanya Harun dalam telepon itu. “Bapak lagi di luar, Pak,” jawab Nurhasan. “Di mana?” timpal Harun. “Lagi di luar,” ujar Nurhasan. “Saya di... Halo Pak. Bapak suruh ke mana? Bapak suruh ke mana?” tanya Harun lagi. “Perintahnya Pak Harun suruhstandbydi DPP,” ujar Nurhasan. Jaksa kemudian meminta Frans menganalisis percakapan Harun dan Nurhasan, di antaranya menyangkut kata “Bapak”. Baca juga:Soal Chat “Ok Sip” Hasto ke Saeful Bahri, Ronny Talapessy: Bukan Menyetujui Menurut Frans, dari percakapan itu sudah tergambar bahwa Harun dan Nurhasan sudah saling mengenal. Keduanya berada di tempat yang berbeda. Meski Nurhasan memanggil Harun dengan kata “Pak”, namun kata itu merujuk pada sosok yang berbeda dengan kata “Bapak” yang disebutkan Harun ketika menanyakan keberadaan sosok tertentu. “Yang disebutkan keduanya Harun Masiku yang sebagai Harun Masiku itu menanyakan, ‘Bapak di mana? Bapak di mana?’ Sedangkan yang satu menjawab ‘Bapak lagi di luar’. Tidak mungkin dia yang si Hasan itu Bapak yang dia maksud. Tapi pasti seseorang,” kata dia. Menurutnya, baik Harun maupun Nurhasan sama-sama memahami sosok “Bapak” itu merujuk pada seseorang atau pihak ketiga yang tidak terlibat dalam percakapan. Baca juga:Hasto: Keterangan Ahli Bahasa dalam Sidang Dipengaruhi Ilustrasi dari Penyidik KPK",Penulis tidak ditemukan,https://nasional.kompas.com/read/2025/06/12/21092001/ahli-sebut-bapak-dalam-telepon-harun-masiku-merujuk-ke-hasto,"Kompas.com- 12/06/2025, 21:09 WIB"
"Tim SAR Hentikan Pencarian Ketut Sudika, Keluarga Tempuh Jalur Niskala di Pantai Lean","KLUNGKUNG, KOMPAS.com- TimSARgabungan menghentikan pencarian terhadap warga asal Desa Bunutan, Kecamatan Abang,Karangasem,Bali, IKetut Sudika(25) yang hilang saat memancing diPantai Lean, Kecamatan Abang, Kamis (12/6/2025). Koordinator SAR Karangasem, I Gusti Ngurah Eka Wiadnyana mengatakan, pencarian terhadap I Ketut Sudika sudah memasuki hari ke-7 tetapi belum ada tanda-tanda keberadaannya. ""Sesuai SOP, operasi pencarian sudah dilakukan selama 7 hari dan belum ada tanda-tanda korban ditemukan, sehingga operasi SAR kami hentikan,"" ujar I Gusti Ngurah Eka Wiadnyana. Meskipun demikian, operasi SAR kembali akan dilanjutkan bila kembali ditemukan adanya tanda-tanda keberadaan korban. Baca juga:Hilang 5 Hari, Kusnadi Tidak Tahu Bagaimana Bisa sampai Madura Para nelayan dan warga setempat juga diharapkan melakukan pemantauan dan melapor jika menemukan tanda-tanda keberadaan Sudika. Sementara itu, setelah operasi SAR dihentikan, pihak keluarga menempuh jalur niskala dengan menggelar upacara ngulapin di Pantai Lean. Pihak keluarga berharap Sudika dapat ditemukan dengan selamat dan dapat bertemu istri serta anaknya yang baru lahir. Perbekel Desa Bunutan I Gede Suparwata mengatakan, ketika Ketut Sudika dilaporkan hilang saat memancing Kamis (5/6/2025), sang istri dalam keadaan hamil tua. Barulah keesokan harinya, istrinya melahirkan. ""Pihak keluarga merasa sangat terpukul. Padahal keluarga seharusnya bahagia karena kelahiran bayi niki (anak Ketut Sudika). Namun bapaknya hilang saat memancing,"" ujar Suparwata. Baca juga:Tergelincir Saat Memancing, Pria di Bandung Ditemukan Tewas di Palung Sungai Keluarga Ketut Sudika sebelumnya masuk dalam data Data Terpadu Kesejahteraan Sosial (DTKS). Ketut Sudika dketahui bekerja di hotel di wilayah Kecamatan Abang. Karena berlatar belakang keluarga nelayan, ia juga terkadang ikut memancing di laut untuk tambahan penghasilan. ""Kami tentu berharap, agar warga kami itu ditemukan dalam keadaan selamat. Informasi terkahir dari tim SAR, hari ini hari terkahir pencarian,"" kata dia. Artikel ini telah tayang di Tribun-Bali.com dengan judul""Pencarian Ketut SudikaDihentikan, Keluarga Tempuh Jalur Niskala diPantai Lean Karangasem.""",Penulis tidak ditemukan,https://denpasar.kompas.com/read/2025/06/12/203242178/tim-sar-hentikan-pencarian-ketut-sudika-keluarga-tempuh-jalur-niskala-di,"Kompas.com- 12/06/2025, 20:32 WIB"
"Serangan 24 Bom dan Senjata Api Guncang Kolombia, Tewaskan 7 Orang","CALI, KOMPAS.com- Kolombia diguncang rentetan serangan terkoordinasi yang terjadi di wilayah barat daya pada Selasa (10/6/2025). Sedikitnya tujuh orang tewas dan puluhan lainnya mengalami luka-luka akibat insiden ini. Sebanyak 24 serangan dilaporkan terjadi hampir bersamaan di sejumlah lokasi, termasuk Kota Cali—kota terbesar ketiga di Kolombia—serta wilayah Villa Rica, Guachinte, dan Corinto. Sasaran mencakup pos polisi, kantor pemerintahan, hingga fasilitas sipil lainnya. Kepala Kepolisian Nasional Kolombia, Jenderal Carlos Fernando Triana, menyatakan bahwa pelaku serangan diduga kuat berasal dari kelompok gerilya lokal. Baca juga:Remaja 15 Tahun Penembak Capres Kolombia Miguel Uribe Disidang, Mengaku Tak Bersalah “Mereka menggunakan berbagai metode, seperti bom mobil, bom sepeda motor, senapan serbu, dan kemungkinan juga drone bersenjata,” ujar Triana. Ia menambahkan, dua anggota kepolisian turut menjadi korban jiwa. Kepolisian kemudian mengonfirmasi jumlah korban tewas sebanyak tujuh orang, sedangkan 28 lainnya mengalami luka-luka. WartawanAFPyang berada di sejumlah lokasi kejadian melaporkan kerusakan parah akibat ledakan. Sejumlah kendaraan tampak hangus terbakar, sedangkan beberapa bangunan dilaporkan runtuh. Seorang warga Corinto, Luz Amparo, menuturkan bahwa ledakan hebat menghancurkan toko rotinya. ""Kami kira itu gempa bumi, tapi suami saya bilang, tidak, itu tembakan,"" ujarnya. Luz segera menuju tokonya setelah menerima sejumlah panggilan telepon. “Ketika saya sampai di tikungan, para tetangga memandang saya dengan cemas. Semuanya hancur,” tuturnya. Baca juga:Profil Miguel Uribe Turbay, Capres Kolombia yang Ditembak 2 Kali di Kepala Polisi dan sejumlah analis meyakini bahwa pelaku serangan berasal dari kelompok pembangkang FARC yang menolak kesepakatan damai. Faksi tersebut dikenal dengan nama Staf Umum Pusat (Estado Mayor Central/EMC). “Serangan ini sangat terkoordinasi, menunjukkan kapasitas militer yang telah mereka bangun,” kata Elizabeth Dickinson, analis keamanan dari International Crisis Group. Menurut Dickinson, kemampuan EMC untuk melancarkan serangan di kawasan metropolitan seperti Cali menjadi indikator kekuatan kelompok ini. Ia juga menduga serangan itu merupakan balasan terhadap operasi militer pemerintah yang menargetkan pemimpin EMC, Ivan Mordisco. “Mereka mencoba menaikkan biaya politik dari inisiatif militer itu untuk pemerintah,” katanya. Ketegangan di Kolombia semakin meningkat menjelang pemilu, menyusul percobaan pembunuhan terhadap calon presiden dari partai konservatif, Miguel Uribe, di Ibu Kota Bogota, tiga hari sebelum serangan terjadi. Uribe (39) ditembak dua kali di kepala saat berkampanye. Polisi menangkap seorang remaja laki-laki berusia 15 tahun yang dituduh sebagai pelaku, meskipun remaja tersebut mengaku tidak bersalah. Pemerintah meyakini bahwa pelaku adalah pembunuh bayaran profesional. Presiden Kolombia, Gustavo Petro, turut bereaksi atas situasi ini. Dalam pernyataan melalui media sosial, Petro menduga serangan terhadap Uribe bisa saja diperintahkan oleh “mafia internasional”. Ia juga menyampaikan kecurigaan atas pengurangan jumlah pengawal Uribe pada hari kejadian penembakan. Sementara itu, faksi EMC merilis pernyataan yang memperingatkan masyarakat agar menjauh dari instalasi militer dan kantor polisi. Namun, mereka tidak mengklaim bertanggung jawab atas serangkaian serangan tersebut. Baca juga:Penembak Capres Kolombia Miguel Uribe Buron, Dibanderol Rp 11,8 Miliar",Penulis tidak ditemukan,https://internasional.kompas.com/read/2025/06/12/050000970/serangan-24-bom-dan-senjata-api-guncang-kolombia-tewaskan-7-orang,"Kompas.com- 12/06/2025, 05:00 WIB"
