Title,FullText,Author,Url,Date
18 Daftar Film yang Tayang di Bioskop Indonesia Juli 2025 | tempo.co,"TEMPO.CO, Jakarta -&nbsp;Memasuki Juli 2025, industri perfilman kembali diramaikan dengan deretan judul menarik yang siap menghiasi layar lebar. Jika di bulan lalu genre film bervariasi mulai dari horor, romansa, keluarga, hingga komedi, di Juli ini film-film yang akan tayang kembali didominasi oleh genre horor.&nbsp; Pilihan Editor: 11 Daftar Film Horor Indonesia Terbaru Bioskop Juli 2025 Beberapa film unggulan yang telah lama dinanti dijadwalkan rilis bulan ini, seperti Assalamualaikum Baitullah, Selepas Tahlil, Hotel Sakura, hingga Sore: Istri dari Masa Depan. Berikut ini deretan film yang tayang di bioskop Indonesia pada Juli 2025, jadwal tayang dan pemainnya. Film dengan genre aksi komedi ini menceritakan dua agen rahasia Martha dan Dito yang tergabung dalam agen PUANAS (Pusat Usaha Nasional). Saat sistem intelijen negara lumpuh akibat serangan siber, justru mereka yang tersisa dan harus turun tangan.&nbsp; Dibantu Jessica, mereka terlibat dalam misi mengejar sindikat judi online dengan cara-cara kocak dan tak terduga. Aksi mereka yang absurd justru membuka rahasia besar yang mengancam keamanan nasional. Film Seribu Bayang Purnama mengangkat kisah seorang pemuda bernama Putro Purnama yang memutuskan kembali ke kampung halamannya setelah merasa gagal mengejar impian di kota.&nbsp; Dengan tekad baru, ia ingin menghidupkan kembali lahan pertanian warisan keluarganya. Tak sekadar bertani, Putro memiliki cita-cita membangun sistem pertanian berkelanjutan yang lebih ramah lingkungan dan bisa menjadi solusi bagi kesejahteraan warga desa. Kisah bermula ketiga Jojo dan ketiga saudaranya memutuskan mudik ke kampung halaman untuk bertemu ayah dan adik bungsunya. Saat itu, mereka memutuskan berjalan-jalan ke beberapa tempat untuk mengenang masa kecil. Namun naas, mereka mengalami kecelakaan sehingga membuat nyawa Sofi tak tertolong.&nbsp; Sejak saat itu, Jojo dan keluarganya terus dihantui oleh hantu yang diduga arwah Sofi, seolah ingin memberi tahu hal misterius. Seorang mahasiswi bernama Kenara mengunjungi desa sahabatnya di pelosok Jawa, namun sejak kedatangannya, ia mengalami mimpi buruk dan kerasukan tarian misterius.&nbsp; Tarian itu ternyata adalah bagian dari ritual kuno bernama Narik Sukmo, yakni tarian kematian dari pasangan yang meninggal tragis. Teror pun menyebar di desa, dan Kenara harus mengungkap rahasia kelam masa lalu sebelum semuanya terlambat. Poster film Sore: Istri dari Masa Depan. Dok. Cerita Films Seorang pria bernama Jo bertemu dengan Sore, wanita misterius yang mengaku datang dari masa depan dan mengaku sebagai istrinya.&nbsp; Pertemuan itu mengubah hidup Jo, yang semula skeptis, menjadi penuh pertanyaan tentang takdir, cinta, dan pilihan hidup. Di tengah hubungan yang tumbuh, Jo mulai memahami bahwa masa depan bisa berubah dan bahwa kehadiran Sore bukan sekadar kebetulan. Sarah, seorang wanita muda yang belum pulih dari trauma kematian ibunya, memutuskan mengikuti sebuah ritual spiritual di hotel tua bernama Sakura. Ia berharap bisa terhubung kembali dengan sang ibu, namun justru memicu kekuatan gaib yang telah lama terkunci. Untuk bisa selamat, ia harus menghadapi ketakutan terbesarnya dan mengungkap misteri kelam yang selama ini tersembunyi di balik dinding hotel itu. Film ini mengangkat peristiwa kelam yang terjadi di sebuah kawasan di Makassar pada 1995, saat satu keluarga menjadi korban pembantaian brutal oleh kelompok preman.&nbsp; Kekerasan itu dipicu oleh konflik yang dipelintir oleh hasutan seorang pengusaha, hingga berujung pada tragedi berdarah yang mengguncang masyarakat. Namun, setelah kejadian, para pelaku satu per satu mulai mengalami kejadian aneh dan teror gaib yang mengarah pada kutukan. Arwah korban dipercaya bangkit untuk menuntut balas Film Selepas Tahlil dibintangi Aghniny Haque dan Bastian Steel. Foto: Instagram/@visinemaid Usai acara tahlilan untuk sang ayah, Saras dan Yudhis mendadak mengalami kejadian tak masuk akal. Ayah mereka yang sudah meninggal tiba-tiba bangkit lagi dan menghilang secara misterius. Di tengah usaha mencari penjelasan, mereka menemukan wasiat misterius yang mengungkap rahasia lama yang selama ini disembunyikan. Setelah mengalami peristiwa menyakitkan dalam hidupnya, Yuli berubah menjadi seorang yang penuh dendam dalam hatinya. Ia pun meminta pertolongan dukun untuk menyantet keluarga Ambar yang selama ini membuatnya menderita. Agar santet ini berhasil masuk ke keluarga Ambar, Yuli harus melakukan ritual-ritual sulit, yakni memasukkan nama target santet ke mayat yang baru meninggal dalam waktu satu minggu.&nbsp; Poster film Assalamualaikum Baitullah yang dibintangi Michelle Ziudith. Dok. VMS Studio Amira, seorang wanita yang tengah dilanda luka batin dan kehilangan, memutuskan menempuh perjalanan ke Tanah Suci untuk menenangkan jiwanya. Dalam proses ibadah yang penuh haru dan refleksi, ia menemukan arti ikhlas, memaafkan, dan menerima segala ketetapan Tuhan. Di tengah keramaian kota suci, ia justru menemukan kedamaian yang selama ini hilang dalam hidupnya. Guntur Sadewa menjalani kehidupan rumah tangga yang tampak ideal bersama sang istri, Anna, dan putri mereka, Julie, berkat kemampuannya menyembunyikan perselingkuhan yang telah berlangsung lama.&nbsp; Namun, ketika rahasia itu akhirnya terbongkar, keharmonisan yang dibangun perlahan runtuh. Kini, Guntur dihadapkan pada kenyataan pahit, mampukah ia memperbaiki kesalahan masa lalunya dan mengembalikan keutuhan keluarganya? Diceritakan, lima sekawan Diki, Beni, Rachel, Bagas, dan Wina pergi wisata horor ke Desa Lawase Urip. Wisata ini mereka lakukan setelah Beni menemukan selebaran misterius di mading kampus.&nbsp; Sesampainya di Desa Lawase Urip mereka merasakan sesuatu yang aneh dan menegangkan. Meski begitu, mereka menganggap hal ini sebagai petualangan dan wisata yang menyenangkan. Akan tetapi, perjalanan mereka tiba-tiba berubah menjadi teror yang mengerikan ketika setan yang asli dan yang pura-pura sudah tidak dapat dibedakan. Agus dibesarkan dalam asuhan disiplin oleh ayahnya, Sersan Kepala Dedi, seorang prajurit yang pernah terluka dalam operasi militer di Timor Timur. Setelah kepergian sang ayah, barulah Agus menyadari betapa besar pengorbanan yang telah dilakukan demi keluarga dan negara. Terinspirasi oleh semangat itu, Agus memutuskan mengikuti jejak ayahnya dengan menjadi tentara. Di tengah tekanan tugas dan konflik pribadi, ia juga berusaha menjaga keutuhan rumah tangganya bersama sang istri, Evi, agar tidak mengalami kehancuran. Ikhsan, seorang pemuda lulusan pesantren, kembali ke desa asalnya dengan niat memperbaiki citra mendiang ayahnya yang dituduh mempraktikkan ilmu hitam. Namun, kedatangannya justru memicu serangkaian kejadian misterius, termasuk kematian warga secara tak wajar.&nbsp; Di balik itu, ada Daeng Rewa, dukun tua yang menyimpan dendam dan kekuatan gaib mematikan. Ketika rahasia masa lalu terungkap, Ikhsan harus menghadapi warisan gelap yang membayangi keluarganya dan melawan kekuatan hitam yang mengancam keselamatan desa. Empat sahabat bernama Agoy, Bruno, Cherry, dan Darlina adalah mahasiswa abadi yang tak kunjung lulus. Suatu hari, proposal penelitian mereka akhirnya disetujui. Namun, terungkap jika biaya yang dibutuhkan mencapai Rp 100 juta. Untuk mendapatkan dana, mereka nekat membeli tanah murah yang disebut harganya akan naik. Tapi, ternyata mereka malah ditipu karena tanah tersebut memiliki posisi miring, mereka pun harus memutar otak agar tanah tersebut menguntungkan. Dikisahkan, seorang model muda bernama Weda tengah berada di puncak kariernya. Namun, semuanya terancam runtuh akibat skandal yang melibatkan sang kekasih, Bagas.&nbsp; Dalam keputusasaan mencari jalan keluar, Bagas mengajak Weda ke kampung halamannya, Desa Rangkaspuna, sebuah desa terpencil yang pernah menjadi tempat pembuangan mayat tak dikenal. Desa itu terisolasi dan masih menjalankan praktik mistis kelam yang dipimpin oleh seorang dukun bernama Ni Itoh Lena dan kakaknya Benhur pergi ke Malang untuk menempuh pendidikan. Selama di Malang, mereka tinggal di sebuah kost milik suami istri Bu Astri dan Pak Wiryo. Awalnya, keduanya merasa nyaman tinggal di kost tersebut. Namun, lambat laun muncul teror dari dunia ghaib yang mengganggu. Diketahui jika ternyata kost ini bukanlah kost biasa. Ada harga yang harus dibayar. Dikisahkan, Yuli pindah ke Bandung bersama ibunya setelah kedua orang tuanya bercerai. Di sekolah barunya, ia bertemu dengan Magnus yang terkenal pendiam dan misterius. Lambat laun, keduanya semakin dekat dan sama-sama menemukan tempat aman dan nyaman satu sama lain. Pilihan Editor: Pilihan Animasi: dari Elio, Dandadan, hingga Kaiju No. 8",Penulis tidak ditemukan,https://www.tempo.co/teroka/18-daftar-film-yang-tayang-di-bioskop-indonesia-juli-2025-1835389,Tanggal tidak ditemukan
6 WNI Dievakuasi dari Iran Tiba di Jakarta | tempo.co,"TEMPO.CO, Jakarta -&nbsp;Kementerian Luar Negeri Republik Indonesia (Kemlu RI) melaporkan bahwa enam warga negara Indonesia (WNI) yang dievakuasi dari Iran telah tiba di Jakarta pada Sabtu 28 Juni 2025. ""Pada hari ini tanggal 28 Juni 2025 telah tiba 6 WNI evacuee dari Iran yang menempuh perjalanan dengan rute Baku-Doha-Bangkok-Jakarta,"" kata Direktur Pelindungan WNI Kemlu RI Judha Nugraha melalui keterangan tertulis di Jakarta, Sabtu malam seperti dilansir Antara. Judha mengatakan bahwa hingga 28 Juni 2025, Pemerintah Indonesia telah mengevakuasi sebanyak 79 orang yang terdiri dari 78 orang WNI dan satu warga negara Iran. Sementara itu, 18 orang sisanya, dari total 97 orang yang dievakuasi dan masih berada di Baku, Azerbaijan, akan dipulangkan secara bertahap pada 28 dan 29 Juni 2025. Lima orang lagi dijadwalkan tiba di Jakarta pada 29 Juni 2025 dengan dua penerbangan berbeda. Jumlah orang yang masih berada di Baku yaitu 13 orang dengan jadwal kepulangan esok hari pada 29 Juni 2025 dari Baku. Orang-orang yang dievakuasi pada gelombang terakhir tersebut dijadwalkan tiba di Jakarta pada 30 Juni 2025. Kemlu berkoordinasi erat dengan Perwakilan RI di negara-negara transit guna memastikan kelancaran dan keselamatan proses evakuasi, demikian kata Judha. Pilihan Editor: 72 WNI dari Iran Sudah Kembali ke Indonesia, 24 Masih di Azerbaijan",Penulis tidak ditemukan,https://www.tempo.co/internasional/6-wni-dievakuasi-dari-iran-tiba-di-jakarta-1835384,Tanggal tidak ditemukan
Militer Israel Selidiki Kejahatan Perang atas Penembakan di Gaza | tempo.co,"TEMPO.CO, Jakarta -&nbsp;Advokat Jenderal Militer Israel telah memerintahkan penyelidikan atas kemungkinan kejahatan perang tentaranya di Gaza. Hal ini atas laporan bahwa pasukan Israel sengaja menembaki warga sipil Palestina di dekat lokasi distribusi bantuan Gaza. Hal ini dilaporkan surat kabar Haaretz pada Jumat seperti dilansir Al Arabiya. Ratusan warga Palestina telah tewas selama bulan lalu di sekitar area tempat makanan dibagikan karena ditembaki militer Israel dangan tank hingga drone militer, kata rumah sakit dan pejabat setempat. Haaretz, surat kabar Israel yang condong ke kiri, mengutip pernyataan tentara Israel yang tidak disebutkan namanya yang mengatakan bahwa mereka diperintahkan untuk menembaki kerumunan untuk menahan mereka. Mereka juga menggunakan kekuatan mematikan yang tidak perlu terhadap warga Palestina meski tidak menimbulkan ancaman. Militer Isreal mengklaim pihaknya tidak memerintahkan tentara untuk secara sengaja menembak warga sipil Palestina. Militer menambahkan bahwa mereka hanya meningkatkan ""respons operasional"" di area bantuan, dan baru-baru ini memasang pagar dan rambu baru, serta membuka rute tambahan untuk mencapai zona pembagian bantuan. Haaretz mengutip sumber yang tidak disebutkan namanya yang mengatakan bahwa unit tentara yang dibentuk untuk meninjau insiden yang mungkin melibatkan pelanggaran hukum internasional telah ditugaskan untuk memeriksa tindakan tentara di dekat lokasi bantuan selama bulan lalu. Militer israel mengatakan bahwa beberapa insiden sedang ditinjau oleh otoritas terkait. ""Setiap tuduhan penyimpangan dari hukum atau arahan [tentara Israel] akan diperiksa secara menyeluruh, dan tindakan lebih lanjut akan diambil sebagaimana diperlukan."" Terjadi kekurangan parah pangan dan pasokan dasar lainnya setelah hampir dua tahun genosida Israel terhadap Gaza. Serangan ini telah menghancurkan sebagian besar daerah kantong itu menjadi puing-puing dan membuat sebagian besar dari dua juta penduduk Palestina mengungsi. Ribuan orang berkumpul di sekitar pusat distribusi dengan putus asa menunggu pengiriman berikutnya, tetapi hampir setiap hari ada laporan penembakan dan pembunuhan di rute yang dilalui. Petugas medis Palestina mengatakan enam orang tewas akibat tembakan pada Jumat saat mereka berusaha mendapatkan makanan di Jalur Gaza selatan. Secara keseluruhan, lebih dari 500 orang tewas di dekat pusat bantuan yang dioperasikan oleh Yayasan Kemanusiaan Gaza (GHF) yang didukung Amerika Serikat atau di area tempat truk makanan PBB akan lewat sejak akhir Mei, kata otoritas kesehatan Gaza. Tentara Israel yang tidak disebutkan namanya itu mengatakan kepada Haaretz bahwa komandan militer telah memerintahkan pasukan untuk menembaki kerumunan warga Palestina untuk membubarkan mereka dan membersihkan area tersebut. Selama pertemuan tertutup dengan pejabat senior Advokat Jenderal Militer minggu ini, perwakilan hukum menolak klaim tentara Israel bahwa insiden tersebut merupakan kasus yang terisolasi, Haaretz melaporkan. Ada kebingungan yang meluas tentang akses ke bantuan, dengan tentara memberlakukan jam malam dari pukul 6 sore hingga 6 pagi untuk sementara waktu di rute pendekatan ke lokasi GHF. Namun, penduduk setempat sering kali harus berangkat jauh sebelum fajar untuk mendapatkan kesempatan mengambil makanan. Dalam sebuah pernyataan pada Jumat malam, seorang juru bicara GHF mengatakan tidak ada insiden atau kematian hingga saat ini di atau di sekitar lokasi distribusinya. Pernyataan tersebut mengatakan bahwa tentara Israel bertugas menyediakan jalur aman bagi para pencari bantuan ke semua organisasi kemanusiaan yang beroperasi di Gaza, termasuk GHF. &ldquo;GHF tidak mengetahui adanya insiden ini, tetapi tuduhan ini terlalu serius untuk diabaikan dan oleh karena itu kami meminta Israel untuk menyelidikinya dan mempublikasikan hasilnya secara transparan tepat waktu,&rdquo; kata juru bicara tersebut. Genosida Israel di Gaza dimulai ketika Hamas melancarkan serangan mendadak ke Israel pada 7 Oktober 2023. Serangan ini diklaim menewaskan hampir 1.200 orang, dan menyandera 251 orang lainnya di daerah kantong itu. Dalam sebuah wawancara setelah dipecat PM Israel Benjamin Netanyahu, mantan menteri pertahanan Yoav Gallant mengaui sejumlah warga Israel yang tewas pada 7 Oktober 2023 disebabkan Oleh militer Israel sendiri, berdasarkan Arahan Hannibal. Sebagai balasan, Israel melancarkan genosida yang telah menewaskan lebih dari 56.300 warga Palestina, sebagian besar dari mereka warga sipil, menurut otoritas kesehatan setempat di Gaza. Sementara Haaretz menyebut korban tewas Palestina hampir menyentuh 100 ribu jiwa. Adapun studi Israel lain pada Rabu lalu bahkan menyebut korban jiwa di Gaza mencapai 377.000 jiwa atau 17 persen dari total populasi. Kementerian Kesehatan Gaza mengatakan pada Jumat bahwa sedikitnya 72 orang tewas dan lebih dari 170 orang terluka oleh tembakan Israel di Jalur Gaza dalam 24 jam terakhir. Pilihan Editor: Haaretz: Tentara Israel Diminta Tembaki Pencari Bantuan di Gaza",Penulis tidak ditemukan,https://www.tempo.co/internasional/militer-israel-selidiki-kejahatan-perang-atas-penembakan-di-gaza-1835335,Tanggal tidak ditemukan
Kedubes Prancis dan Kemenperin Dorong Penguatan Kerja Sama Industri | tempo.co,"TEMPO.CO, Jakarta -Duta Besar Prancis untuk Indonesia, Timor Leste, dan ASEAN, Fabien Penone, dan Direktur Industri Mesin dan Alat Pertanian Kementerian Perindustrian (Kemenperin) RI, Solehan, mengunjungi pabrik perusahaan teknologi Schneider Electric Cikarang, Bekasi, pada Selasa, 24 Juni 2025. Kunjungan menandakan tonggak penting dalam rencana perluasan pabrik asal Prancis itu selama lima tahun, yang berlangsung dari 2024 hingga 2029.&nbsp; Fabien Penone menuturkan bahwa Prancis dan Indonesia tengah memperkuat kemitraan ekonomi mereka, sebagaimana telah diputuskan oleh Presiden Emmanuel Macron dan Presiden Prabowo Subianto pada 28 Mei lalu. Penone menyebut bahwa banyak perusahaan Prancis yang berpartisipasi dalam pengembangan basis industri dan teknologi Indonesia.&nbsp; Penone menilai bahwa Schneider Electric merupakan perusahaan terkemuka sekaligus salah satu pelopor industri terkemuka di Prancis.&nbsp; ""Perluasan pabrik pintar Cikarang merupakan simbol kuat dari kemitraan Prancis-Indonesia ini,"" kata Penone, dikutip dari keterangan resminya.&nbsp; Menurut Penone, investasi ini membawa dampak nyata, menciptakan lapangan kerja yang berkualitas, meningkatkan kemampuan produksi, dan mendukung transformasi energi dan industri Indonesia.&nbsp; Dia mengaku bangga karena situs ini sepenuhnya didukung oleh energi hijau dan mengintegrasikan teknologi canggih seperti akal imitasi (AI), yang menunjukkan bahwa keunggulan industri dapat berjalan seiring dengan tanggung jawab terhadap iklim.&nbsp; ""Prancis sepenuhnya mendukung pertumbuhan Schneider Electric yang berkelanjutan di Indonesia dan berharap keberhasilan ini akan menginspirasi lebih banyak perusahaan Prancis untuk berkontribusi pada masa depan Indonesia yang hijau dan digital,"" ujarnya.&nbsp; Berkenaan dengan itu, Direktur Industri Permesinan dan Alat Mesin Pertanian Kemenperin RI Solehan menilai perluasan pabrik Schneider Electric di Cikarang merupakan upaya untuk memperkuat ketahanan industri Indonesia dan mempercepat transformasi sektor manufakturnya.&nbsp; Inisiatif ini tidak hanya menciptakan lapangan kerja yang berkualitas bagi tenaga kerja Indonesia, tetapi juga memperkuat rantai pasokan domestik dan mendorong pertumbuhan manufaktur berteknologi tinggi,"" tuturnya.&nbsp; Solehan menyebut pemerintah sepenuhnya mendukung kemitraan strategis seperti ini sebagai bagian dari komitmen untuk mendorong pertumbuhan ekonomi yang berkelanjutan dan berdampak. Presiden Direktur Schneider Electric Indonesia dan Timor-Leste, Martin Setiawan, mengatakan bahwa Perluasan pabriknya di Cikarang bertujuan untuk mendukung pemerintah Indonesia dalam mendorong transformasi dan ketahanan industri nasional.&nbsp; ""Hal ini juga mewujudkan semangat bersama antara Indonesia dan Prancis dalam mempromosikan inovasi dan memajukan teknologi hijau,"" ucapnya.&nbsp; Menurut catatan Schneider Electric Indonesia, fasilitas Schneider Electric Cikarang memainkan peran penting dalam rantai pasokan regional dan operasi ekspor perusahaan. Pada 2025, pabrik tersebut berhasil menyelesaikan perluasan seluas 3.200 meter persegi untuk memenuhi permintaan yang meningkat di pasar domestik dan internasional, khususnya di sektor-sektor seperti pusat data, utilitas listrik, minyak &amp; gas, dan pertambangan.&nbsp; Perluasan ini akan meningkatkan kapasitas produksi tegangan rendah hingga 200 persen dan meningkatkan skalabilitas operasional. Schneider Electric juga akan terus memperluas fasilitas tersebut secara bertahap hingga tahun 2029 untuk mendukung pertumbuhan jangka panjang. Tak hanya itu, perusahaan tersebut mengklaim akan mempekerjakan hingga 1.500 karyawan, yang diharapkan akan berdampak positif pada 400.000 orang, termasuk karyawan, mitra, dan vendor. Saat ini, hampir 100 persen karyawan di Schneider Electric Cikarang adalah pekerja lokal.&nbsp; Schneider Electric Cikarang memproduksi Switchgear Tegangan Rendah dan Menengah dengan kandungan lokal hingga 40 persen dan 82 persen material dan komponen Outside-Group bersumber dari mitra Indonesia, yang menggarisbawahi komitmen perusahaan untuk mendukung rantai pasokan nasional.&nbsp; Hampir setengah dari hasil produksi pabrik melayani pasar domestik, sementara setengah sisanya diekspor ke pasar global utama seperti Vietnam, Malaysia, Korea Selatan, Australia, dan Singapura.&nbsp; Pilihan Editor: Aset Pemerintah di Prancis Terancam Disita Buntut Kasus dengan Navayo International &nbsp;",Penulis tidak ditemukan,https://www.tempo.co/internasional/kedubes-prancis-dan-kemenperin-dorong-penguatan-kerja-sama-industri-1835324,Tanggal tidak ditemukan
Suka Duka Kisah Peraih Beasiswa Ajinomoto | tempo.co,"TEMPO.CO, Jakarta - Melangkah keluar dari zona nyaman bukan hal mudah bagi Almi Alfarghiani Casbana. Namun ia membuktikan bahwa keberanian untuk mencoba bisa membuka jalan menuju mimpi besar. Peraih Beasiswa Ajinomoto tahun ajaran 2022 ini berhasil meraih gelar Master of Science dalam bidang Ilmu Gizi dari Kagawa Nutrition University (KNU), Jepang. Almi masih ingat bagaimana ia sempat merasa kesulitan ketika harus mengikuti kompetisi ketat untuk memenangkan 1 bangku beasiswa yang tersedia. ""Setiap tahunnya hanya memilih satu orang peraih beasiswa. Jadi bisa dibilang Ajinomoto mencari yang terbaik untuk diberikan beasiswa melanjutkan studi ke Jepang,"" kata Almi dalam keterangan pers yang diterima Tempo pada 25 Juni 2025. Saat itu Almi memulai sebagai research student pada April 2022 &ndash; Maret 2023, melanjutkan studi sebagai mahasiswi Master Program pada April 2023 &ndash; Maret 2025. Ia pun berhasil lulus dan diwisuda pada April 2025. Almi kemudian melanjutkan kariernya sebagai Penelitian dan Pengembangan di Kawasaki Factory - Ajinomoto, Jepang.&nbsp; ""Selama mengikuti program beasiswa dari Ajinomoto ini, saya tidak hanya memperdalam ilmu dan pengetahuan di bidang pangan dan gizi, tetapi juga mendapatkan pengalaman berharga dengan bertemu teman-teman dari berbagai negara dan latar belakang budaya, yang memperluas wawasan dan perspektif saya,"" kata Almi.&nbsp; Selama menjalani program beasiswa ini, Almi juga bisa fokus pada studi saya dan merasa aman dan nyaman. Maklum jumlah uang beasiswanya itu lebih dari cukup untuk bisa bertahan hidup tinggal di Jepang. Setelah menyelesaikan studi di KNU, Almi mengaku diterima berkarir di Dept Research &amp; Development Ajinomoto Headquarter Jepang. Mungkin ada beberapa temannya yang menilai ia bekerja di situ karena ia adalah peraih beasiswa Ajinomoto. ""Namun, sebenarnya para penerima beasiswa dari Indonesia dibebaskan untuk memilih jalur karir masing-masing. Setelah lulus, saya memang menargetkan berkarier di perusahaan makanan agar sejalan dengan bidang keilmuan saya,"" katanya.&nbsp; Almi mengatakan ia mendaftar dan mengikuti seleksi dengan jalur dan proses yang sama seperti pelamar lainnya, yaitu tahap seleksi, mulai dari seleksi dokumen, tes skolastik, wawancara tahap 1, wawancara tahap 2, dan wawancara final. ""Proses seleksi di Ajinomoto Jepang sangat ketat dan panjang, mengingat Ajinomoto adalah salah satu perusahaan yang masuk dalam Top 5 pilihan utama lulusan Jepang menurut beberapa situs job-hunting ternama (seperti Asahi Gakujo, MyNavi, Yahoo! News, dll), sehingga saya harus bersaing dengan lulusan-lulusan terbaik dari seluruh Jepang,"" katanya.&nbsp; Tentu saja hidup di Jepang tidak semudah yang kebanyakan orang kira. Almi sempat merasa kesulitan ketika menjalani 3 tahun melanjutkan studi di Jepang. ""Saya menghadapi kendala bahasa karena semua komunikasi dan perkuliahan di kampus dilakukan dalam bahasa Jepang, terutama terkait dengan istilah-istilah teknis dalam bidang pangan dan gizi,"" katanya.&nbsp; Walau begitu, ia merasa sangat bersyukur karena Ajinomoto Scholarship memberikan fasilitas sekolah bahasa selama satu tahun penuh. Belajar di sekolah bahasa memungkinkan Almi untuk meningkatkan kemampuan bahasa Jepang secara intensif. Saat memasuki program master, Almi pun masih merasa kesulitan dengan penggunaan alat-alat analisis yang menjadi bagian penting dalam penelitian. ""Namun, berkat bimbingan dan dukungan dari senior di laboratorium, saya akhirnya dapat menguasai teknik analisis tersebut dan mulai melakukan penelitian secara mandiri,&rdquo; ucap Almi.&nbsp;Almi juga bercerita soal momen yang paling berkesan baginya, yaitu saat ia melakukan presentasi hasil penelitian di scientific conference pada &lsquo;The 78th Annual Meeting of Japan Society of Nutrition and Food Science&rsquo; yang diselenggarakan di Fukuoka. Hari itu adalah pengalaman pertama Almi dalam mengikuti konferensi ilmiah. ""Sehingga saya sempat merasa gugup dan cemas. Namun, sensei (dosen pembimbing) dan lab-mates sangat membantu dengan memberikan latihan presentasi,"" kata Almi.&nbsp; Ia beruntung mendapat banyak sekali dukungan. ""Saya juga berdoa agar &nbsp;lancar dan mampu menjawab pertanyaan dengan percaya diri di sesi diskusi. Momen ini juga sangat berkesan karena saya bisa mengunjungi Fukuoka, yang terletak di prefektur Kyushu di ujung selatan pulau utama Jepang,&rdquo; lanjutnya. Tidak hanya soal akademik, Almi pun belajar budaya baru di Jepang. ""Setelah lulus S2 dan kini berkarir di penelitian dan pengembangan Ajinomoto Jepang, ke depannya saya ingin berkontribusi lebih bagi masyarakat melalui pengembangan potensi asam amino dalam menghadirkan kelezatan di setiap masakan sehingga dapat mendorong konsumsi makanan dengan gizi seimbang, serta melalui penelitian fungsi asam amino dalam membantu menciptakan solusi bagi permasalahan gizi masyarakat,&rdquo; kata Almi. Kisah penerima beasiswa Ajinomoto lain adalah Rafiq Usdika Maulana. Pemuda asal Solok Sumatera Utara ini adalah penerima beasiswa 2026. Alumni S1 Program Studi (Prodi) Bioteknologi &ndash; Universitas Brawijaya tersebut akan menjalani jenjang pendidikan Pasca Sarjana di Jepang pilihannya. &ldquo;Melalui beasiswa ini, saya berharap dapat menjalani studi S2 ini dengan sebaik-baiknya, serta memberikan kontribusi nyata di bidang yang saya tekuni,"" katanya.&nbsp; Pilihan Editor: Ketahui 5 Kategori Beasiswa LPDP. Siapa yang Bisa Mendapatkannya?",Penulis tidak ditemukan,https://www.tempo.co/ekonomi/suka-duka-kisah-peraih-beasiswa-ajinomoto-1835347,Tanggal tidak ditemukan
