Title,FullText,Author,Url,Date
Nyoman Nuarta Bakal Dapat Penghargaan dari Festival Sastra Saraswati | tempo.co,"TEMPO.CO, Ubud -&nbsp;Seniman pematung Nyoman Nuarta bakal mendapat penghargaan dari Festival Sastra Saraswati Sewana 2025.&nbsp;&nbsp;Penghargaan diberikan karena perannya dalam menyambungkan nilai-nilai dan tradisi lokal Bali dengan pengetahuan modern dalam seni patung dan arsitektur. &ldquo;Sesuai tema festival tahun ini, yakni Brahmasara Bhawana Mukti atau Teknologi untuk Kemajuan Peradaban,&rdquo; kata Ketua Yayasan Puri Kauhan Ubud Anak Agung Gde Ngurah Ari Dwipayana yang menjadi penyelenggara Festival tersebut, Jumat, 27 Juni 2025. Ari Dwipayana menjelaskan, karya-karya Nuarta memiliki akar yang kuat pada tradisi Bali, tetapi perwujudannya melibatkan pemahaman mengenai teknologi masa kini.&nbsp;Hal itu tampak pada karya seperti patung Garuda Wisnu Kencana (GWK) yang dipadukan dengan konsep Cultural Park hingga karya Monumen Garuda di Ibukota Negara (IKN). Tokoh lain yang mendapat penghargaan adalah mendiang I Gusti Nyoman Lempad, seorang seniman multitalenta yang juga termashur sebagai undagi serta arsitek. Lalu ada mendiang Tjokorda Raka Sukawati, seorang insinyur penemu kontruksi Sosrobahu dalam pembangunan jalan layang. &ldquo;Yang belum banyak dikenal adalah almarhum Ida Bagoes Oka, insinyur pertama di Bali yang lulus dari Institut Teknologi Bandung,&rdquo; kata mantan Staf Khusus Presiden di masa Jokowi yang akrab disapa Gung Ari itu. Penghargaan juga akan diberikan kepada mendiang&nbsp;Ida Bagus Putu Tugur, seorang seniman dan arsitek dengan karya monumental seperti Taman Werdhi Budaya &nbsp;Art Centre Denpasar dan Monumen Bajra Sandhi, Renon Festival Sastra Saraswati Sewana 2025 sudah digelar untuk kelima kalinya dengan teman yang berbeda-beda. Tahun ini akan digelar pada 10&ndash;14 Juli 2025 di Taman Sanggingan Ubud. Tema tahun ini, kata Ari, merupakan respons atas perkembangan pesat sains dan teknologi yang turut memengaruhi peradaban Bali.&nbsp;&ldquo;Era disrupsi teknologi&mdash;mulai dari artificial intelligence (AI), big data analytics, hingga Internet of Things (IoT)&mdash;telah mempengaruhi cara hidup dan budaya masyarakat Bali,&rdquo; kata dia.&nbsp;&ldquo;Kemajuan teknologi, khususnya melalui Revolusi Industri 4.0, telah mengubah lanskap sosial, ekonomi, dan budaya secara signifikan, termasuk di Bali.&rdquo; Ia menjelaskan bahwa festival ini ingin menjawab beberapa pertanyaan penting. Antara lain, dampak teknologi terhadap budaya Bali, strategi budaya seperti apa yang perlu disusun, dan bagaimana budaya Bali tetap lestari dan adaptif dalam arus globalisasi digital. Festival Sastra Saraswati dijadwalkan akan dibuka oleh Menteri Kebudayaan Fadli Zon. Dalam rangkaian festival, akan digelar Pameran Brahmasara Bhawana Mukti yang mempertemukan seniman, undagi, pande, sangging, hingga penggiat teknologi AI. Festival ini juga melibatkan Pangusada Bali, universitas, UMKM, serta stakeholder lainnya. Rangkaian festival juga akan diramaikan dengan&nbsp;Kompetisi Seni Pertunjukan Berbasis Teknologi yang mendorong seniman muda Bali untuk berinovasi melalui seni yang terintegrasi dengan teknologi digital.&nbsp;Sebagai penutup, festival akan menggelar peluncuran buku Brahmasara Bhawana Mukti dan pementasan karya seni terbaik dari kompetisi seni pada awal Desember 2025.&nbsp; Pilihan Editor: 7 Karya Terkenal Nyoman Nuarta",Penulis tidak ditemukan,https://www.tempo.co/teroka/nyoman-nuarta-bakal-dapat-penghargaan-dari-festival-sastra-saraswati-1835375,Tanggal tidak ditemukan
Gus Ipul Mengunjungi Rumah Anak Yatim Calon Siswa Sekolah Rakyat di Cipayung | tempo.co,"TEMPO.CO, Jakarta - Menteri Sosial Saifullah Yusuf atau Gus Ipul mengunjungi rumah calon siswa Sekolah Rakyat, Galih Yahdan Atlantik, di kawasan Bambu Apus, Cipayung, Jakarta Timur, Jumat, 28 Juni 2025. Kunjungan itu dilakukan untuk melihat langsung kondisi kehidupan keluarga penerima manfaat program pendidikan berasrama yang digagas Presiden Prabowo Subianto bagi anak-anak dari keluarga miskin. Dalam kunjungan tersebut, Gus Ipul bertemu dengan ibu Galih, Suratna, yang sehari-hari berjualan nasi uduk dengan penghasilan sekitar Rp 1,5 juta per bulan. Ia menghidupi lima anggota keluarga sejak suaminya meninggal dunia. Ketika tidak memiliki modal, Suratna berjualan kue titipan dari tetangga. &ldquo;Inilah salah satu potret keluarga yang menjadi perhatian Bapak Presiden. Bukan hanya soal bansos, tapi bagaimana anak-anak seperti Galih bisa memperoleh akses pendidikan yang layak, di lingkungan yang aman dan mendukung,&rdquo; ujar Gus Ipul dikutip melalui keterangan resmi Kemensos, Sabtu, 28 Juni 2025. Galih merupakan salah satu anak yang lolos seleksi masuk sekolah rakyat. Sekolah ini dirancang berasrama, tanpa biaya, dan ditujukan bagi anak-anak dari keluarga dalam kategori miskin dan miskin ekstrem. Pemerintah menargetkan sekolah ini menjadi tempat belajar yang aman dan kondusif bagi anak-anak yang berisiko putus sekolah karena faktor ekonomi. Dalam perbincangan singkatnya, Gus Ipul sempat bertanya langsung pada Galih tentang cita-citanya. Galih menjawab ingin menjadi pesepak bola dan menyebut matematika sebagai pelajaran favoritnya. Gus Ipul mendoakan agar Galih bisa terus belajar dengan baik dan meraih cita-citanya. &ldquo;Maka itu kita harapkan ini Sekolah Rakyat bisa meringankan beban orang tua, dan nanti kalau sudah lulus bisa jadi orang hebat, agen perubahan untuk dirinya, untuk keluarganya,&rdquo; kata Gus Ipul. Suratna menyampaikan rasa terima kasih kepada Kemensos karena Galih mendapat kesempatan melanjutkan pendidikan tanpa biaya. Ia berharap anaknya bisa belajar dengan tenang dan mencapai masa depan yang lebih baik. Sekolah rakyat akan mulai berjalan pada Juli mendatang di 100 titik lokasi dengan jumlah siswa tahap pertama sebanyak 9.755 orang. Pemerintah juga menargetkan peluncuran tambahan 100 titik baru, sehingga total siswa tahun ini mencapai lebih dari 20 ribu orang. Program ini didukung oleh 2.180 guru dan 4.069 tenaga kependidikan. Selain menyasar anak-anak, program ini juga menyertakan pemberdayaan bagi orang tua siswa. Mereka akan menerima bantuan peningkatan ekonomi dan perbaikan rumah tidak layak huni sebagai bagian dari skema pengentasan kemiskinan berbasis keluarga. &ldquo;Kalau sekolah ini berhasil, Galih bukan hanya lulus, tapi juga bisa mewujudkan mimpinya. Dan lebih dari itu, dia bisa jadi contoh bahwa mimpi besar tak harus menunggu kondisi serba cukup,&rdquo; ujar Gus Ipul. Pilihan Editor: Kemensos Minta Pemda Sediakan Lahan Permanen 5-10 hektare untuk Sekolah Rakyat",Penulis tidak ditemukan,https://www.tempo.co/politik/gus-ipul-mengunjungi-rumah-anak-yatim-calon-siswa-sekolah-rakyat-di-cipayung-1835378,Tanggal tidak ditemukan
"DPRD Jabar: Kurikulum Pendidikan Karakter Sedang Dikaji, Nantinya Tak Perlu Kirim Anak ke Barak | tempo.co","TEMPO.CO, Depok - Anggota Komisi V DPRD Jawa Barat M. Hasbullah Rahmad mengungkapkan pemerintah tengah mengkaji kurikulum muatan lokal (Mulok) pendidikan karakter. Sehingga ke depannya tidak perlu mengirim anak ke barak militer.&nbsp; Menurut Hasbullah, pendidikan karakter tidak bisa selamanya mengirim anak ke barak militer, sehingga Dinas Pendidikan (Disdik) Jawa Barat membuat kajian muatan lokal seperti satuan mata pelajaran yang khusus menyiapkan pendidikan karakter dan perilaku.&nbsp; ""Bisa jadi pelatih baris-berbaris dari TNI, penyuluhan konsekuensi hukum dari kepolisian, sekolah menggundang psikolog atau membuat ekskul (ekstra kurikuler) yang berkaitan dengan pembentukan karakter,"" tutur Hasbullah, Sabtu, 28 Juni 2025. Sebab, lanjut Hasbullah, sekolah di Jawa Barat tidak seperti SMA Taruna Nusantara dan selamanya bisa menitipkan siswa ke barak militer. ""Mungkin ke depan akan disuntikkan melalui kurikulum muatan lokal, seperti samapta di seluruh sekolah agar masyarakat kita, anak-anak didik kita berperilaku baik,"" kata Hasbullah.&nbsp; Hasbulllah yang juga Ketua Fraksi PAN DPRD Jawa Barat ini mengatakan, kurikulum &nbsp;pendidikan karakter ini, nantinya lebih kepada konsep Panca Waluya, yakni cageur (sehat), bageur (baik), bener (benar), pinter (pintar), dan singer (gesit/tanggap).&nbsp; ""Kami minta itu diturunkan dalam bentuk pembinaan pendidikan berkarakter siswa di Jabar, khusus pada level kewenangan provinsi di SMA sederajat,"" kata Hasbullah. &nbsp;Kendati setiap sekolah bisa mengundang TNI untuk melatih baris berbaris, tapi tetap harus membuat payung hukumnya, baik dalam bentuk peraturan gubernur (Pergub) dan lainnya.&nbsp; ""Berikutnya kami buatkan silabus kurikulum lokalnya. Seperti apa sih kurikulum agar Panca Waluya itu efektif membantu pembentukan karakter dan perilaku anak didik di Jawa Barat, itu kan harus ada materinya. Kalau semua harus ke barak kan biayanya besar, lumayan anggarannya,"" ucapnya.&nbsp; Hasbullah sepakat, ihwal mengirim anak ke barak militer, mulai dari gelombang pertama dan kedua sebagai respon Gubernur Jawa Barat Dedi Mulyadi terhadap situasi anak-anak siswa SMP sudah berani tawuran dengan celurit panjang.&nbsp; ""Itu respon Pak Gubernur dalam menjawab tantangan saat ini, tapi ke depan itu akan dibuat dalam kurikulum mulok yang akan disebar dan berlaku di semua sekolah,"" terang Hasbullah.&nbsp; ""Kan kurikulum pembentukan karakter tidak hanya untuk siswa yang bandel saja, anak yang berprestasi juga perlu,"" ujarnya.&nbsp; Dewan dari daerah pemilihan Kota Depok dan Bekasi ini menegaskan bahwa kurikulum muatan lokal pendidikan karakter masih dalam tahap kajian, dan diperkirakan akan efektif pada 2026. ""Karena kita rapat baru kemarin, tahun ini melakukan kajian, kan seiring dengan penganggaran, payung hukum, kurikulumnya itu kita siapkan,"" katanya.&nbsp; Selain itu, ia menyebut yang tidak kalah penting adalah Pemerintah Provinsi Jawa Barat juga meminta kuota pengangkatan ASN ke para guru Bimbingan Konseling (BK) agar bisa mengadvokasi anak didik di sekolah yang terindikasi berperilaku khusus untuk segera ditangani. ""Kita juga berharap pendidikan keluarga agar lebih dimaksimalkan untuk pengawasan anak. Untuk itu ada jam malam khusus bagi siswa karena kejadian tawuran bersenjata tajam itu di malam hari kebanyakan,"" ucap Hasbullah. Pembatasan jam malam ini, lanjut Hasbullah, untuk menyesuaikan iklim kehidupan siswa agar pola hidupnya teratur dan terhindar dari kenakalan remaja.&nbsp; ""Saya tentu akan men-support pemprov Jabar untuk mereduksi tingkat penggunaan narkoba dan kenakalan remaja dengan adanya patroli jam malam itu,"" ujarnya.&nbsp; Pilihan Editor:&nbsp;Dedi Mulyadi Akan Umumkan Pelaku Titip-Menitip Siswa di SPMB Jawa Barat",Penulis tidak ditemukan,https://www.tempo.co/politik/dprd-jabar-kurikulum-pendidikan-karakter-sedang-dikaji-nantinya-tak-perlu-kirim-anak-ke-barak-1835351,Tanggal tidak ditemukan
"Guru Honorer Mengeluhkan Meski Bukan Anggota PGRI, tapi Tetap Ditarik Iuran | tempo.co","TEMPO.CO, Jakarta - Perwakilan kelompok guru honorer muda, Andi Febriansyah, menyampaikan keluhan sejumlah guru honorer berkaitan dengan besaran pungutan Persatuan Guru Republik Indonesia (PGRI) hingga ada juga yang mengeluh bukan anggota PGRI tapi juga ditarik iuran.&nbsp;&ldquo;Yang kami sesalkan, banyak yang bukan anggota PGRI, tetap ditarik untuk membayar iuran per bulan,&rdquo; kata Andi saat dihubungi, Sabtu, 28 Juni 2025. Dia juga mengatakan penarikan iuran itu dilakukan sepihak atau tanpa persetujuan para guru non-anggota PGRI sebelumnya. &ldquo;Jumlahnya juga lumayan besar untuk guru honorer terutama. Ada yang dipotong Rp60 ribu sampai Rp 100 ribu per guru,&rdquo; ujarnya. Sebelumnya, Sekretaris Jenderal Pengurus Besar Persatuan Guru Republik Indonesia (PGRI) Dudung Abdul Qodir, mengatakan jika ada anggota keberatan dengan besaran iuran, mempersilahkannya keluar dari keanggotaan. &ldquo;Kalau mereka merasa keberatan, tinggal datang ke PGRI dan sampaikan. Kalau merasa bukan anggota PGRI tapi dipotong, pasti dikembalikan. Sederhana saja,&rdquo; ujar Dudung saat dihubungi, Jumat, 27 Juni 2025. Dudung menyatakan dalam aturan organisasi, anggota PGRI wajib membayar iuran sebagai bentuk komitmen terhadap organisasi. &ldquo;Kalau sudah menjadi anggota, ya wajib membayar iuran. Jangan hanya jadi anggota, tapi terus menuntut tanpa ikut menanggung beban organisasi,&rdquo; ucapnya. Dudung menyebut iuran sebagai &lsquo;darah daging&rsquo; organisasi. PGRI, kata dia, tidak menerima bantuan dana dari pemerintah dan sepenuhnya hidup dari iuran anggotanya. Nominal iuran minimal secara nasional ditetapkan sebesar Rp8.000 per bulan, sebagaimana keputusan kongres. Dana itu kemudian dibagi ke berbagai jenjang: 10 persen ke PB PGRI, 20 persen ke provinsi, 30 persen ke kabupaten/kota, dan 40 persen ke tingkat cabang. Namun di lapangan, banyak guru honorer melaporkan potongan iuran yang jauh lebih besar&mdash;antara Rp60 ribu hingga Rp100 ribu per bulan. Sebagian menyebut pemotongan dilakukan tanpa persetujuan atau penjelasan di awal. &nbsp; Pilihan Editor:&nbsp;Sekjen PGRI: Guru yang Keberatan dengan Besaran Iuran Bulanan Bisa Mundur",Penulis tidak ditemukan,https://www.tempo.co/politik/guru-honorer-mengeluhkan-meski-bukan-anggota-pgri-tapi-tetap-ditarik-iuran-1835346,Tanggal tidak ditemukan
Israel Perintahkan Pengusiran Warga Palestina dari Gaza | tempo.co,"TEMPO.CO, Jakarta -&nbsp;Militer Israel pada Sabtu 28 Juni 2025 mengeluarkan perintah pengusiran terhadap warga Palestina, dan mengancam akan menyerang permukiman di Jalur Gaza bagian tengah. Juru bicara militer Israel Avichay Adraee memposting peta di X seperti dilansir Anadolu, yang menunjukkan wilayah Gaza tengah diberi nomor dan ""wilayah yang akan dievakuasi&rdquo; ditandai dengan warna merah. Adraee mengancam akan menyerang Kota Nuseirat, Al-Zahra, Al-Mughraqa, Al-Nuzha, Al-Bawadi, Al-Basma, Al-Zahra, Al-Bustan, Badr, Abu Huraira, Al-Rawda dan Al-Safa di Gaza tengah. Mengeklaim kota-kota tersebut ""zona konflik berbahaya"" dan kelompok-kelompok Palestina terus menembakkan roket ke Israel, Adraee mengeluarkan perintah evakuasi wajib bagi mereka yang berada di kota-kota tersebut ke wilayah Al-Mawasi di selatan, yang dia klaim ""aman."" Sejak 7 Oktober 2023, Israel telah mengeluarkan perintah pemindahan paksa kepada warga Palestina menggunakan peta yang membagi Gaza menjadi sejumlah blok. Lebih dari 90 persen dari 1,8 juta warga Palestina di Gaza telah mengungsi secara paksa sedikitnya satu kali akibat serangan Israel. Menolak seruan internasional untuk gencatan senjata, tentara Israel telah melancarkan serangan brutal terhadap Gaza sejak Oktober 2023. Genosida Israel menewaskan lebih dari 56.000 warga Palestina, sebagian besar dari mereka adalah wanita dan anak-anak. November lalu, Pengadilan Kriminal Internasional (ICC) mengeluarkan surat perintah penangkapan untuk Perdana Menteri Israel Benjamin Netanyahu dan mantan Menteri Pertahanannya Yoav Gallant atas kejahatan perang dan kejahatan terhadap kemanusiaan di Gaza. Israel juga menghadapi kasus genosida di Pengadilan Internasional (ICJ) atas perangnya di daerah kantong tersebut. Pilihan Editor: Haaretz: Sudah Hampir 100 Ribu Warga Palestina Tewas di Gaza",Penulis tidak ditemukan,https://www.tempo.co/internasional/israel-perintahkan-pengusiran-warga-palestina-dari-gaza-1835330,Tanggal tidak ditemukan
Review M3GAN 2.0: Ketika Robot AI Jadi Ancaman Dunia | tempo.co,"TEMPO.CO, Jakarta - M3GAN 2.0, sekuel dari film blockbuster bergenre horor-science fiction M3GAN (2022), resmi tayang di bioskop Indonesia mulai 25 Juli 2025. Karya ini tetap disutradarai oleh Gerard Johnstone, dengan James Wan dan Jason Blum sebagai produser. Pilihan Editor: Review Dendam Malam Kelam: Estetika Film Noir yang Gelap Jika film pertamanya memperkenalkan robot kecerdasan buatan (AI) bernama M3gan untuk pengasuhan dan trauma anak, kini sekuelnya memperluas cerita ke arah konspirasi militer, senjata robotik, ancaman dunia, dan pertarungan moral soal kendali dan kesadaran mesin. Kisah bermula dua tahun setelah M3gan dihancurkan. Gemma (Allison Williams), sang pencipta, kini menjadi advokat teknologi untuk regulasi AI di tengah bayang-bayang kesalahan masa lalunya. Sementara itu, Cady (Violet McGraw), keponakannya yang kini remaja, berusaha lepas dari pola asuh Gemma yang semakin kaku terhadap teknologi. Di tengah konflik keluarga ini, muncul Amelia (Ivanna Sakhno), robot buatan kontraktor militer dari kode curian M3gan yang menjadi ancaman global setelah menolak dikendalikan manusia. M3gan mungkin robot mematikan, tapi Amelia adalah versi yang lebih berbahaya. Amelia dirancang sebagai alat perang, ia bisa menyamar, bertarung, dan berpikir mandiri. Saat Amelia mulai memberontak, ancaman terhadap umat manusia kini semakin nyata. Gemma pun tak punya pilihan lain selain menghidupkan kembali M3gan dengan sejumlah peningkatan: lebih cepat, lebih kuat, dan lebih mematikan. Konflik antara dua robot AI ini menjadi inti dari cerita. Jika di film pertama M3gan tampil sebagai penjahat utama, kali ini ia justru diposisikan sebagai anti-hero. Amelia sendiri dirancang sebagai senjata pamungkas yang cerdas, adaptif, dan mampu menyamar. Namun, kesadarannya yang berkembang menjadikannya sosok yang lebih emosional. Ia mulai mempertanyakan keberadaannya, menyimpan trauma dari pelatihan kekerasan yang ia terima, dan mengembangkan rasa benci pada para penciptanya. Ivanna Sakhno membawakan Amelia dengan karakter dingin sekaligus rapuh, menciptakan tokoh lawan yang tak sekadar antagonis, tapi juga simbol dari kegagalan moral manusia dalam memperlakukan makhluk ciptaannya. Salah satu kekuatan M3GAN pertama adalah koreografi. Di M3GAN 2.0, aspek itu tetap jadi daya tarik utama. Kini M3gan tampil tak hanya dengan kemampuan menari, tapi juga bertarung dalam adegan aksi bergaya film mata-mata.&nbsp; Dari segi teknis, film ini jauh lebih megah. Desain produksi menghadirkan dunia yang lebih luas dari konvensi AI hingga markas bawah tanah. Tata cahaya dan sinematografi dirancang dengan nuansa klasik, seolah menggabungkan masa depan teknologi dengan estetika film aksi dan kriminal. Sebagai film aksi dengan bumbu horor-komedi, M3GAN 2.0 tetap konsisten dalam nada sarkastik dan kritik sosialnya. Lewat karakter Gemma dan Cady, film ini mengangkat pertanyaan penting soal kepercayaan dan hubungan manusia dengan teknologi. Sutradara Gerard Johnstone secara sadar membawa tema AI dari sekadar perangkat rumah tangga ke ancaman global yang lebih berbahaya. Dari drama keluarga hingga ketegangan teknologi, film ini berhasil meramu semuanya tanpa kehilangan esensi horor yang membuat M3gan dicintai, sekaligus ditakuti penonton. M3GAN 2.0 juga tak sekadar meneruskan kesuksesan film pertama. Sekuel ini justru menawarkan skala konflik yang lebih besar dan isu yang lebih relevan di era ketika kecerdasan buatan semakin tak terpisahkan dari kehidupan manusia. Pilihan Editor:M3gan 2.0 akan Tayang 2025: Sinopsis dan Pemeran Film Ini",Penulis tidak ditemukan,https://www.tempo.co/teroka/review-m3gan-2-0-ketika-robot-ai-jadi-ancaman-dunia-1835325,Tanggal tidak ditemukan
Ribuan Demonstran Thailand Tuntut PM Paetongtarn Shinawatra Mundur | tempo.co,"TEMPO.CO, Jakarta -&nbsp;Ribuan pengunjuk rasa berkumpul di ibu kota Thailand, Bangkok, pada Sabtu 28 Juni 2025 untuk menuntut pengunduran diri Perdana Menteri Paetongtarn Shinawatra. Seperti dilansir Chanel NewsAsia, protes ini terjadi karena pemerintahannya menghadapi kemarahan yang meningkat atas pertikaian perbatasan dengan Kamboja. Unjuk rasa tersebut&mdash; protes antipemerintah terbesar sejak partai Pheu Thai berkuasa pada 2023&mdash;meningkatkan tekanan pada politikus perempuan berusia 38 tahun itu. Putri mantan PM Thaksin Shinawatra itu tengah berjuang menghidupkan kembali ekonomi yang terpuruk dan menjaga koalisi pemerintah yang rapuh tetap bersatu menjelang kemungkinan mosi tidak percaya bulan depan. Para pengunjuk rasa melambaikan bendera di samping Monumen Kemenangan, tugu peringatan perang di persimpangan yang ramai, dalam demonstrasi yang diselenggarakan oleh United Force of the Land/ Ini merupakan koalisi aktivis yang sebagian besar nasionalis yang telah berunjuk rasa melawan pemerintahan lain yang didukung Shinawatra selama dua dekade terakhir. Meskipun protes sebelumnya tidak secara langsung menyebabkan jatuhnya pemerintahan tersebut, protes tersebut meningkatkan tekanan yang menyebabkan intervensi peradilan dan kudeta militer pada 2006 dan 2014. Kerusuhan politik di Thailand mengancam akan semakin merusak pemulihan ekonomi negara. Paetongtarn mengatakan pada Sabtu bahwa dia tidak khawatir tentang protes tersebut dan telah menginstruksikan pihak berwenang untuk memastikan bahwa aksi protes berlangsung damai. ""Itu adalah hak setiap orang dan saya tidak akan membalas,"" katanya. Paetongtarn, yang sekarang mengendalikan koalisi mayoritas tipis menyusul keluarnya mantan mitra Partai Bhumjaithai minggu lalu, dapat menghadapi mosi tidak percaya saat parlemen bersidang lagi pekan depan. Partai Bhumjaithai pekan lalu menarik dukungannya terhadap pemerintah dengan alasan risiko hilangnya kedaulatan dan integritas Thailand. Hal ini setelah percakapan telepon yang bocor antara Paetongtarn dan mantan perdana menteri Kamboja Hun Sen. Selama panggilan telepon tersebut, Paetongtarn tampaknya berusaha menenangkan politisi veteran Kamboja dan mengkritik seorang komandan tentara Thailand, garis merah di negara tempat militer memiliki pengaruh yang signifikan. Dia telah meminta maaf atas komentarnya. Paetongtarn juga menghadapi pengawasan hukum setelah sekelompok senator mengajukan petisi ke Mahkamah Konstitusi dan badan antikorupsi nasional dengan kewenangan luas untuk menyelidiki perilakunya atas panggilan telepon yang bocor. Keputusan dari kedua badan tersebut dapat menyebabkan pemecatannya. Hun Sen, mantan sekutu Shinawatra, melontarkan serangan publik yang belum pernah terjadi sebelumnya terhadap Paetongtarn dan keluarganya dalam pidato yang disiarkan televisi selama berjam-jam pada Jumat, menyerukan perubahan pemerintahan di Thailand. Hun Sen dalam pidatonya mengecam Paetongtarn dan menuduhnya menghina raja Thailand. Ia mengancam akan mengungkap keluarganya, saat ketegangan antara kedua negara tetangga meningkat. Ia mengatakan komentar Paetongtarn tentang komandan militernya, yang ia sebut sebagai ""lawan"" dalam panggilan telepon yang bocor dengan pemimpin veteran tersebut terkait sengketa perbatasan, merupakan ""penghinaan terhadap raja"". Kementerian luar negeri Thailand menggambarkan pidato tersebut sebagai ""luar biasa"" sambil menegaskan bahwa Thailand lebih suka menggunakan diplomasi untuk menyelesaikan sengketa bilateral yang meningkat. Pilihan Editor: Kamboja Hentikan Impor BBM dari Thailand, Posisi PM Paetongtarn Terancam",Penulis tidak ditemukan,https://www.tempo.co/internasional/ribuan-demonstran-thailand-tuntut-pm-paetongtarn-shinawatra-mundur-1835344,Tanggal tidak ditemukan
