Title,FullText,Author,Url,Date
Bank Emas BSI Ramai Pengunjung karena Harga Emas Turun | tempo.co,"TEMPO.CO, Jakarta - Penurunan harga emas dalam beberapa waktu terakhir justru membawa berkah bagi tenant emas di gelaran BSI International Expo 2025. Di tengah ramainya pengunjung yang memanfaatkan libur panjang, booth bank emas milik BSI tampak dipadati oleh warga yang ingin mulai berinvestasi emas. Banyak dari mereka datang karena penasaran dengan promo, sebagian lain bahkan sudah ditawari di kantor cabang namun baru berani memutuskan setelah melihat langsung. &ldquo;Ini lagi ramai banget,&rdquo; ujar Annisa Larasati, product owner dari bank emas, saat ditemui di JIExpo, Sabtu 28 Juni 2025. Ia mengatakan, harga emas yang sedang turun memang dimanfaatkan oleh masyarakat untuk membeli, baik secara tunai maupun mencicil. Bank emas menawarkan dua produk utama di expo ini: BSI Emas melalui BYOND dan Cicil Emas. &ldquo;Kalau BSI emas melalui BYOND itu modelannya beli. Misalnya nasabah punya uang untuk beli 5 gram, langsung beli 5 gram. Saldo emas langsung masuk ke aplikasi BYOND,&rdquo; jelas Annisa. Untuk skema cicilan, nasabah bisa mencicil emas hingga 100 gram dengan tenor 1&ndash;5 tahun dan menggunakan sistem syariah dengan akad murabahah. BSI mencoba menarik minat pengunjung lewat berbagai promo menarik di BSI International expo ini. Untuk pembelian minimal 1 gram, nasabah mendapatkan souvenir dan voucher. Pembelian 10 gram akan mendapat tambahan emas 0,1 gram Hartadinata, dan jika membeli hingga 100 gram, pengunjung membawa pulang voucher MAP Rp200 ribu serta bonus emas 0,5 gram Hartadinata. Bahkan, ada flash sale harian hanya dalam waktu 15 menit di jam-jam tertentu saat BSI International Expo ini. &ldquo;Kalau saat beli di jam tertentu, minimal 5 gram, itu akan mendapatkan voucher MAP Rp500 ribu. Karena memang itu cuma dikasih waktu 15 menit,&rdquo; katanya. Flash sale itu berlangsung setiap hari dengan waktu yang berbeda. Tak hanya itu, bagi yang ingin mempersiapkan ibadah haji, BSI juga menyediakan promo cicil emas yang mencakup DP 0%, hadiah tabungan haji, souvenir, hingga tambahan hadiah seperti oven toaster untuk pembelian di atas 50 gram. Penurunan harga emas memang memicu antusiasme. Annisa mengakui, situasi geopolitik dunia, termasuk perang yang sempat melibatkan Amerika Serikat beberapa bulan lalu, membuat harga emas sempat melonjak. &ldquo;Waktu di bulan April itu harga emas sempat naik, hampir Rp2 juta per gram,&rdquo; paparnya. Namun ia menekankan bahwa secara historis, emas tetap menjadi instrumen investasi jangka panjang yang menguntungkan. &ldquo;Kalau secara harga emas 5 tahun ke belakang harga emas selalu naik,&rdquo; ujar Annisa. Dengan konsep berbasis syariah, fitur cicilan fleksibel, dan promo yang menggoda, BSI International Expo tak hanya menjadi tempat belanja atau edukasi keuangan, tapi juga momen tepat untuk memulai langkah kecil investasi emas&mdash;di saat harga sedang bersahabat. Pilihan Editor: Untung-Rugi Ekspor Listrik ke Singapura",Penulis tidak ditemukan,https://www.tempo.co/ekonomi/bank-emas-bsi-ramai-pengunjung-karena-harga-emas-turun-1835345,Tanggal tidak ditemukan
Pengesahan Anggota Baru PSHT di Surabaya Dijaga 2 Ribu Aparat Gabungan | tempo.co,"TEMPO.CO, Jakarta - Sebanyak 2.014 personel gabungan TNI dan Polri dikerahkan untuk mengamankan pengesahan warga baru perguruan pencak silat Persaudaraan Setia Hati Terate (PSHT) di Surabaya, Jumat, 27 Juni 2025. Pengesahan sekitar 1.250 warga PSHT itu dilakukan di Universitas dr Soetomo, Surabaya. Kepala Kepolisian Resor Kota Besar Surabaya Komisaris Besar Lutfi Sulistiawan mengatakan pengamanan dilakukan agar tidak ada aktivitas yang mengganggu masyarakat. &ldquo;Ini kegiatan yang harus kami amankan dan kami buat nyaman,&rdquo; kata Lutfi dalam keterangannya, Sabtu, 28 Juni 2025. Lutfi mengatakan seluruh petugas yang bersinggungan dengan massa agar mengedepankan tindakan persuasive dan tidak memancing gesekan. Polisi juga melakukan penyekatan di 10 titik jalan dan enam titik pengaluran arus lalu lintas. Langkah penyekatan ini dimaksudkan sebagai upaya preventif guna menghindari terjadinya kerumunan massa penggembira yang bergerombol atau melakukan konvoi menjelang atau sesudah pengesahan. &ldquo;Jika ada yang bergerombol dan konvoi akan kita himbau untuk kembali,&rdquo; kata Lutfi.&nbsp; 2.014 personel gabungan, terdiri dari unsur TNI-Polri, Satpol PP, Dinas Perhubungan, serta personel Pengamanan Teratai (Pamter). Adapun warga PSHT yang disahkan di Surabaya berasal dari puluhan ranting dan ratusan rayon. Pilihan Editor:&nbsp;Polri Pamerkan Pasukan Robot Humanoid Hingga Robot Anjing di Gladi Hari Bhayangkara &nbsp; &nbsp; &nbsp;",Penulis tidak ditemukan,https://www.tempo.co/hukum/pengesahan-anggota-baru-psht-di-surabaya-dijaga-2-ribu-aparat-gabungan-1835318,Tanggal tidak ditemukan
"Hindari Kecurangan, Kenali Standar Mutu Beras | tempo.co","TEMPO.CO, Jakarta - Menteri Pertanian Amran Sulaiman menduga ada kecurangan perdagangan beras. Berdasarkan hasil uji laboratorium terhadap 157 merek beras premium, hanya 26 merek yang memenuhi standar mutu yang berlaku. Artinya, lebih dari 80 persen beras premium yang beredar di pasaran dinyatakan tidak sesuai ketentuan. ""Premium yang sesuai hanya 26. Jadi bisa bayangkan, hampir 90 persen tidak memenuhi standar,"" kata Amran dalam konferensi pers yang disiarkan melalui kanal YouTube Kementerian Pertanian, Kamis, 26 Juni 2025. Uji laboratorium tersebut dilakukan di 13 fasilitas milik Badan Urusan Logistik (Bulog) dengan mengacu pada Peraturan Menteri Pertanian Nomor 31/Permentan/PP.130/8/2017 tentang Kelas Mutu Beras, serta Peraturan Badan Pangan Nasional Nomor 2 Tahun 2023. Pada kategori beras medium, juga ditemukan kecurangan dari 76 merek yang diperiksa 66 di antaranya dinyatakan menyalahi ketentuan. Potensi kerugian konsumen akibat praktik kecurangan beras ini mencapai Rp 99,35 triliun. Standar Mutu Beras Standar mutu beras sudah diatur dalam&nbsp;Peraturan Menteri Pertanian Nomor 31/Permentan/PP.130/8/2017 tentang Kelas Mutu Beras. Peraturan ini membedakan mutu beras menjadi beberapa kategori termasuk premium dan medium. Aturan standar mutu beras meliputi komponen mutu, yaitu derajat sosoh atau tingkat kebersihan, kadar air, beras kepala, butir patah, total butir beras lainnya, dan butir gabah. Berdasarkan klasifikasi mutu beras yang ditetapkan pemerintah, beras kategori premium dan medium sama-sama harus memiliki derajat sosoh atau tingkat kebersihan minimal 95 persen. Begitu pula dengan kadar air maksimal yang ditetapkan sebesar 14 persen untuk kedua kategori tersebut. Namun, perbedaannya terletak pada beberapa komponen lainnya. Untuk beras premium, persentase beras kepala atau butir utuh minimal harus mencapai 85 persen, sedangkan untuk beras medium hanya 75 persen. Batas maksimal butir patah untuk beras premium adalah 15 persen, sementara pada beras medium toleransi lebih besar hingga 25 persen. Selain itu, total butir beras lainnya seperti butir menir, merah, kuning, rusak, atau kapur, tidak diperbolehkan ada dalam beras premium. Sedangkan untuk beras medium, batas maksimalnya adalah lima persen. Beras premium juga harus bebas sepenuhnya dari gabah dan benda asing, sedangkan beras medium masih diperbolehkan terdapat satu butir gabah per 100 gram dan benda asing maksimal 0,05 persen. Pilihan Editor: Celah Korupsi Penerimaan Murid Baru",Penulis tidak ditemukan,https://www.tempo.co/sains/hindari-kecurangan-kenali-standar-mutu-beras-1835365,Tanggal tidak ditemukan
Sampai Mana Penyidikan Kasus Korupsi Dana Hibah APBD Jawa Timur | tempo.co,"TEMPO.CO, Jakarta - Penyidikan kasus dugaan korupsi dana hibah untuk kelompok masyarakat (Pokmas) dalam Anggaran Pendapatan dan Belanja Daerah (APBD) Jawa Timur periode 2019&ndash;2022 terus berlanjut. Terkini, Komisi Pemberantasan Korupsi (KPK) akan memanggil kembali Gubernur Jawa Timur Khofifah Indar Parawansa yang sempat mangkir. Lantas sampai mana penyidikan dana hibah Pokmas dalam APBD Jawa Timur 2019-2020 ini? Bermula dari operasi tangkap tangan alias OTT oleh Komisi Pemberantasan Korupsi (KPK) terhadap Wakil Ketua DPRD Jawa Timur Sahat Tua P Simandjuntak pada penghujung 2022, sejumlah nama akhirnya ikut terseret. Bahkan, dalam perjalanannya kasusnya, Kepala Daerah Jawa Timur disebut tahu persis pengurusan dana hibah tersebut. Selaku kepala daerah, Khofifah memang sempat dipanggil oleh KPK pada 20 Juni 2025 lalu guna dimintai keterangan. Namun, Juru Bicara KPK Budi Prasetyo mengatakan Khofifah tidak bisa hadir dan meminta untuk dijadwalkan pemanggilan kembali. KPK menyatakan sudah menerima surat permintaan tersebut sejak Rabu, 18 Juni 2025. &ldquo;Ada keperluan lainnya,&rdquo; kata Budi kepada wartawan, namun tidak merinci alasan apa yang membuat Khofifah tak bisa hadir dalam pemeriksaan tersebut. Kini, Ketua KPK Setyo Budiyanto menyatakan lembaganya tetap akan memanggil Gubernur Jawa Timur itu untuk diperiksa. Meski demikian, Setyo menolak memaparkan secara detail jadwal pemeriksaan terhadap Khofifah. Ia mengatakan permasalahan waktu pemanggilan merupakan kewenangan penyidik yang akan memutuskan. &ldquo;Karena sebenarnya penjadwalannya sudah jelas. Minggu lalu saya terinformasi bahwa yang bersangkutan menghadiri anaknya itu sudah di luar negeri,&rdquo; kata Setyo di Pusat Antikorupsi KPK, Jakarta Selatan pada Kamis, 26 Juni 2025. Adapun pernyataan ihwal Kepala Daerah Jawa Timur mengetahui persis pengurusan dana hibah tersebut disampaikan oleh mantan Ketua DPRD Jawa Timur Kusnadi daat diperiksa KPK pada 19 Juni 2025. Sosok yang juga ditetapkan sebagai tersangka dalam kasus ini tersebut menjelaskan bahwa proses pengajuan dana hibah selalu dibicarakan antara DPRD dan Gubernur Jawa Timur. &ldquo;Ya pasti tahu, orang dia yang mengeluarkan (dana hibah) masa dia enggak tahu,&rdquo; kata Kusnadi tanpa menyebut nama usai diperiksa KPK pada Kamis. Khofifah memang pernah menanggapi masalah dana hibah ini saat menjadi tamu dalam acara talk show Mata Najwa milik Najwa Shihab pada September 2024, di tengah upayanya untuk meraih kembali kursi Gubernur Jawa Timur periode kedua. Dikutip dari Narasi.tv, ia mengatakan mekanisme dana hibah diatur dengan ketat, termasuk penandatanganan beberapa surat oleh penerima hibah. &ldquo;Hibah itu di seluruh provinsi, kabupaten, dan kota ada. Semua dana APBD yang keluar itu atas SK Gubernur. Semua APBD cair itu kalau ada SK Gubernur. Penerima dana hibah harus menandatangani setidaknya tiga surat: Naskah Perjanjian Hibah Daerah, Surat Tanggung Jawab Mutlak, dan Fakta Integritas,&rdquo; katanya. Adapun dalam kasus ini, pada Juli 2024 lalu, KPK telah menetapkan sedikitnya 21 tersangka. Dari jumlah tersebut, empat di antaranya sebagai penerima suap, dengan tiga penyelenggara negara dan satu staf, sedangkan 17 lainnya sebagai pemberi suap, termasuk 15 pihak swasta dan dua penyelenggara negara. Sejumlah nama tersangka penerima suap telah diumumkan dan diterbitkan surat perintah penyidikan (sprindik)-nya. Termasuk Kusnadi, mereka yakni eks Wakil Ketua DPRD Jawa Timur Achmad Iskandar, eks Wakil Ketua DPRD Jawa Timur Anwar Sadad, eks Anggota DPRD Jawa Timur Mahmud, serta eks staf Sekretariat Dewan Bagus Wahyudyono. Pada 23 Juni 2025, KPK menjadwalkan pemeriksaan Anwar di Kantor BPKP Jawa Timur untuk mendalami keterlibatannya. Sebelumnya, KPK setelah menetapkan Anwar sebagai tersangka juga menyita sejumlah asetnya, termasuk tiga unit tanah dan bangunan di Surabaya serta satu unit apartemen di Malang. Total nilai asetnya mencapai Rp 8,1 miliar. &ldquo;Info penyidik, disita dari tersangka AS,&rdquo; ujar Tessa Mahardhika Sugiarto, juru bicara KPK, saat dikonfirmasi Tempo pada Januari 2025. Teranyar, KPK juga telah memasang plang tanda penyitaan di sejumlah aset milik tersangka kasus korupsi dana hibah tersebut. Adapun aset-aset yang dimaksud meliputi satu bidang tanah dan satu bangunan di Kabupaten Pasuruan, satu unit apartemen di Kota Malang, serta satu rumah yang berlokasi di Kabupaten Mojokerto. &ldquo;Penyidik juga melalukan pemasangan plang tanda penyitaan terhadap aset-aset yang diduga milik tersangka,&rdquo; kata dia dalam keterangan tertulis pada Kamis, 26 Juni 2025. Duduk perkara kasus dugaan korupsi dana hibah Pokmas dalam APBD Jawa Timur 2019-2020 Berdasarkan catatan Tempo, kasus ini bermula saat KPK menetapkan Sahat dan tiga orang lainnya sebagai tersangka kasus suap pengurusan dana hibah Provinsi Jawa Timur tahun anggaran 2022. OTT itu dilakukan pada Rabu, 14 Desember 2022, pukul 20.30. Awalnya, KPK menerima laporan akan adanya penyerahan sejumlah uang dari Ilham Wahyudi kepada Rusdi di sebuah mal di kawasan Surabaya, Jawa Timur. Uang itu disebut terkait pengurusan alokasi dana hibah dari APBD Provinsi Jawa Timur tahun anggaran 2023. Tim KPK lalu menangkap Rusdi dan Sahat yang tengah berada di gedung DPRD Jawa Timur sementara Abdul Hamid dan Ilham Wahyudi ditangkap di kediamannya masing-masing di Kabupaten Sampang. Dalam kasus ini, Sahat ditetapkan menjadi tersangka penerima suap bersama stafnya, Rusdi. Sementara dua orang lainnya yang merupakan tersangka pemberi suap. KPK menduga Sahat menerima suap Rp 1 miliar dari pengurusan dana hibah tahun 2022. Uang itu baru sebagian dari komitmen fee yang diperoleh Sahat sebanyak Rp 2 miliar. Wakil Ketua KPK kala itu, Johanis Tanak, menduga praktik lancung ini sudah terjadi sejak dua tahun sebelumnya. Pada 2021 dan 2022 saja, menurut Johanis, Provinsi Jawa Timur mengucurkan dana hibah sebesar Rp 7,8 triliun kepada badan, lembaga, dan organisasi masyarakat yang ada di sana. Pokmas yang dikoordinir Abdul Hamid disebut mendapatkan dana hibah sebesar Rp 40 miliar setiap tahun. &ldquo;STPS menawarkan diri membantu dan memperlancar pengusulan pemberian dana hibah melalui kesepakatan pemberian sejumlah uang sebagai uang muka atau ijon. AH yang menjabat sebagai kepala desa, bersedia menerima tawaran tersebut,&rdquo; kata Johanis. Sahat telah divonis oleh majelis hakim Pengadilan Negeri Tindak Pidana Korupsi (Tipikor) Surabaya. Ia dihukum 9 tahun penjara serta denda Rp 1 miliar subsider penjara 6 bulan pada 26 September 2023 lalu. Petinggi Partai Golkar Jawa Timur ini juga harus membayar uang pengganti kerugian negara sebesar Rp 39,5 miliar. Pilihan Editor: Nama Mereka Disebut dalam Kasus Korupsi Dana Hibah APBD Jawa Timur",Penulis tidak ditemukan,https://www.tempo.co/hukum/sampai-mana-penyidikan-kasus-korupsi-dana-hibah-apbd-jawa-timur-1835313,Tanggal tidak ditemukan
Turis Inggris Diimbau Patuhi Aturan saat Liburan ke Abufeira | tempo.co,"TEMPO.CO, Jakarta - Abufeira memperkenalkan peraturan baru untuk mencegah perilaku tidak pantas di tempat umum. Kota di Portugal selatan ini dikenal dengan tempat wisata pantai-pantai yang menakjubkan. Selama musim panas pemerintah setempat meningkatkan pengawasan terhadap perilaku para turis yang tidak pantas.&nbsp; Denda yang diterapkan tergantung jenis pelanggaran perilaku. Hukuman terberat bagi mereka yang telanjang atau terlibat dalam tindakan seksual di depan umum, sebesar 426 hingga 1.800 poundsterling atau sekitar Rp 9,4 juta hingga Rp 33,8 juta. Sedangkan pelanggaran lainnya seperti telanjang sebagian di luar area pantai yang ditentukan, buang air kecil atau besar di tempat umum, dan membuat kebisingan yang berlebihan juga dapat dihukum dengan denda mulai dari 255 hingga 1.277 poundsterling atau sekitar Rp 5,6 juta hingga Rp 28,2 juta. Pelanggaran lain yang tercantum dalam kode tersebut termasuk meludah, penyalahgunaan perabotan umum, dan meninggalkan troli belanja.&nbsp; Dewan Kota Albufeira berupaya memulihkan ketertiban dan kebersihan di zona wisata dengan lalu lintas tinggi. Peraturan terbaru ini disetujui pada bulan Mei.&nbsp;Wali Kota Albufeira Jos&eacute; Carlos Rolo mengatakan peraturan tersebut adalah langkah penting lainnya untuk memerangi citra negatif pariwisata di kotamadya tersebut. Dan mempromosikan keharmonisan antara sektor ini dan penduduk setempat,"" ujarnya saat itu seperti dikutip dari Travel Weekly. Dengan menindak perilaku yang tidak pantas, Portugal memperkuat komitmennya terhadap pariwisata yang bertanggung jawab dan memastikan pengalaman yang lebih terhormat bagi penduduk lokal dan pengunjung internasional. Peraturan baru tersebut sebagai tanggapan terhadap serangkaian insiden. Termasuk video viral tahun lalu yang memperlihatkan delapan pria Inggris menari telanjang di sebuah bar di siang bolong di jalur pesta utama Albufeira, Rua da Oura. Rekaman tersebut memicu kemarahan yang meluas, yang mendorong diadakannya pertemuan darurat antara pemerintah daerah dan pemilik bisnis. Kantor Luar Negeri Inggris mengeluarkan peringatan perjalanan pada hari Kamis, 26 Juni. Isinya memperingatkan warga negara Inggris tentang peraturan baru tersebut. ""Kotamadya Albufeira telah memperkenalkan kode etik yang melarang perilaku yang tidak pantas di tempat umum. Lihatlah peraturan yang berlaku saat ini. Jika Anda melanggar peraturan, Anda dapat didenda di tempat sebesar antara 150 dan 1.800 euro,"" pernyataan lembaga tersebut dikutip dari Daily Mail.&nbsp; Selain peraturan perilaku, Kantor Luar Negeri telah menegaskan kembali peringatan berkelanjutan tentang meningkatnya risiko kebakaran hutan di Portugal, khususnya selama musim kemarau yang berlangsung dari April hingga Oktober. Wisatawan diperingatkan bahwa kebakaran hutan dapat terjadi dengan cepat dan tak terduga di berbagai wilayah, tidak hanya di daerah berhutan atau pedesaan, dikutip dari Travel and Tour World. Pilihan editor: Pajak Turis di Algarve Kini Berlaku Sepanjang Tahun, Ada Pengecualian Khusus",Penulis tidak ditemukan,https://www.tempo.co/hiburan/turis-inggris-diimbau-patuhi-aturan-saat-liburan-ke-abufeira-1835387,Tanggal tidak ditemukan
Badan Gizi Nasional Gandeng BPJS Ketenagakerjaan | tempo.co,"TEMPO.CO, Jakarta - Badan Gizi Nasional (BGN) bekerja sama dengan BPJS Ketenagakerjaan memberikan perlindungan jaminan sosial bagi pekerja di Satuan Pelayanan Pemenuhan Gizi (SPPG) program Makan Bergizi Gratis atau MBG. Penandatanganan kerja sama ini dilaksanakan oleh Deputi Penyediaan dan Penyaluran BGN dengan Deputi Korporasi dan Institusi BPJS Ketenagakerjaan di Bandung, Jawa Barat, pada Sabtu, 28 Juni 2025.&nbsp; Deputi Penyediaan dan Penyaluran BGN, Brigjen (Purn) Suardi Samiran, mengatakan kolaborasi lintas sektor semacam ini perlu didorong semakin gencar, demi mendukung Program MBG. &ldquo;Hari ini, kami memulai kerja sama dengan BPJS Ketenagakerjaan. Upaya ini kami lakukan untuk meningkatkan kesejahteraan pekerja yang bertugas di SPPG,"" katanya dalam keterangan tertulis pada Sabtu.&nbsp; Samiran menjelaskan kerja sama ini mencakup penyelenggaraan jaminan sosial ketenagakerjaan, dukungan optimalisasi kepesertaan aktif jaminan sosial ketenagakerjaan, dan optimatisasi pelayanan program jaminan sosial ketenagakerjaan. Selain itu, juga meliputi sinergi data dan informasi dalam rangka optimalisasi program jaminan sosial ketenagakerjaan bagi pekerja di SPPG.&nbsp; Menurut dia, secara teknis, kerja sama ini juga memungkinkan pemberian fasilitas pelayanan atas risiko kecelakaan kerja dan/atau kematian yang dialami pekerja SPPG yang telah menjadi peserta aktif program Jaminan Sosial Ketenagakerjaan. Hal ini sesuai dengan petunjuk pelaksanaan penyelenggaraan program yang telah disepakati oleh BGN dan BPJS Ketenagakerjaan. Samiran berharap jaminan sosial ini membuat seluruh petugas SPPG makin termotivasi untuk memberikan yang terbaik dalam melayani masyarakat. Dia juga berharap agar program MBG makin disokong melalui kolaborasi lintas sektor. &ldquo;Semoga ke depannya semakin banyak kolaborasi lintas sektor yang turut menyukseskan program MBG, baik dari sisi dukungan terhadap program MBG secara langsung, maupun dukungan kepada petugas di lapangan,&rdquo; kata Samiran. Pengesahan perjanjian kerja sama tersebut dilaksanaan bersamaan dengan bimbingan teknis penjamah makanan kepada 411 relawan dari 9 SPPG di Kota Bandung. Pada kesempatan yang sama, Samiran menyerahkan Kartu Tanda Kepesertaan BPJS Ketenagakerjaan kepada perwakilan relawan sebagai simbolis dimulainya kerja sama. Sebelumnya, pada April lalu, BPJS Ketenagakerjaan dan BGN telah meneken nota kesepahaman yang memberikan jaminan perlindungan bagi para relawan di SPPG Program MBG. Direktur Utama BPJS Ketenagakerjaan saat itu, Anggoro Eko Cahyo, menyebut premi yang dibayarkan untuk setiap pekerja di SPPG adalah Rp 16.800 per bulan. ""Kami menandatangani MoU untuk perlindungan tenaga relawan di SPPG. Banyak pekerja yang terlibat di SPPG dan semua pekerja itu wajib dilindungi oleh negara,"" kata Anggoro di Plaza BPJS Ketenagakerjaan, Jakarta Selatan, Senin, 21 April 2025.&nbsp; Dia menyatakan, setiap pekerja yang terlibat di SPPG akan dilindungi dengan BPJS Ketenagakerjaan. Bahkan, kata dia, pekerja di bawah para supplier juga akan didorong agar dilindungi.&nbsp; Anggoro menyebut, setidaknya ada sekitar 1,2 juta pekerja di SPPG yang bakal dilindungi melalui BPJS Ketenagakerjaan. ""Kami siap melindungi berapapun pekerja yang terlibat di sana, karena seluruh cabang kami juga tersebar di Indonesia,"" katanya. Pilihan Editor: Untung-Rugi Ekspor Listrik ke Singapura",Penulis tidak ditemukan,https://www.tempo.co/ekonomi/badan-gizi-nasional-gandeng-bpjs-ketenagakerjaan-1835352,Tanggal tidak ditemukan
Milos Kerkez Ungkap Kebahagiaannya Bergabung ke Liverpool | tempo.co,"Milos Kerkez resmi gabung ke Liverpool dengan nilai transfer seharga 40 juta pound sterling (RP 891 miliar) dari Bournemouth, Kamis, 26 Juni 2025. Bek Timnas Hungaria itu menyampaikan rasa bangganya berseragam The Reds. Milos Kerkez direkrut Liverpool usai menjalani dua musim yang impresif bersama Bournemouth. Dia menyumbang 2 gol dan 8 assist dari 74 penampilan bersama The Cherries. Tidak hanya itu, Kerkez juga masuk dalam nominasi Pemain Muda Terbaik PFA 2024/2025. Kerkez mengungkapkan kebahagiaannya bergabung ke Liverpool. Bek berusia 21 tahun tersebut jadi pemain anyar keempat yang datang ke Anfield di tahun 2025 setelah Jeremie Frimpong, Florian Wirtz, dan Armin Pecsi. Video: Instagram/@liverpoolfc, @miloskerkezofficial Editor: Dwi Oktaviane Backsound: Soave - Vendredi [Audio Library Release] &middot; Free Copyright-safe Music",Penulis tidak ditemukan,https://www.tempo.co/video/arsip/milos-kerkez-ungkap-kebahagiaannya-bergabung-ke-liverpool-1835367,Tanggal tidak ditemukan
