Title,FullText,Author,Url,Date
Perludem Ingatkan Urgensi Revisi UU Pemilu Usai Putusan MK soal Pemisahan Pemilihan | tempo.co,"TEMPO.CO, Jakarta -&nbsp;Perkumpulan untuk Pemilu dan Demokrasi (Perludem) menegaskan pentingnya revisi Undang-Undang tentang Pemilihan Umum atau UU Pemilu guna mengimplementasikan Putusan Mahkamah Konstitusi (MK) Nomor 135/PUU-XXII/2024. Peneliti senior dari Perludem Heroik Mutaqin Pratama menyatakan putusan MK itu merupakan aspek fundamental yang turunannya harus dibarengi dengan perbaikan tata kelola pemilu. Perbaikan itu juga mencakup desain sistem kepemiluan RI ke depan. &ldquo;Jika kita ingin kemudian pemilu di 2029 ini sesuai dengan keputusan Mahkamah Konstitusi, tidak perlu menunggu tahun depan, perlu segera sekarang revisi Undang-Undang Pemilu,&rdquo; ujar Heroik dalam seminar yang digelar secara daring, Sabtu, 28 Juni 2025. Ia pun menyayangkan bahwa rancangan UU Pemilu yang sudah masuk daftar Program Legislasi Nasional Prioritas 2025 tak juga dibahas. RUU Pemilu masuk Prolegnas 2025 atas usulan Badan Legislasi atau Baleg DPR, yang artinya pembahasan mengenai perubahan undang-undang itu mestinya dilakukan tahun ini. Heroik mengatakan, bila revisi UU Pemilu tidak juga diselesaikan hingga tahun depan, maka penataan skema rekrutmen penyelenggara pemilu bakal berantakan di 2027 mendatang.&nbsp; &ldquo;Karena kalau hasil dari simulasi kami dengan desain keserentakkan nasional lokal ini, di 2027 nanti rekrutmen penyelenggara pemilu nasional KPU (Komisi Pemilihan Umum) dan Bawaslu (Badan Pengawas Pemilihan Umum) RI terlebih dahulu selesai,&rdquo; ujar Heroik. &ldquo;Lalu setelahnya di tahun yang sama KPU dan Bawaslu provinsi di level kabupaten/kota harus dilakukan seleksi juga.&rdquo; Namun dengan skema yang merupakan bagian dari proses transisi itu, penyelenggara pemilu baik di tingkat provinsi dan kabupaten/kota yang baru dipilih pada tahun 2023 atau tahun 2024 mesti mengalami pemotongan masa jabatan. &ldquo;Memang mau tidak mau harus ada pemotongan masa jabatan di sana, sehingga kemudian nanti tidak akan ada himpitan tahapan,&rdquo; kata dia. Maka dari itu, dalam skema transisi yang diajukan Perludem, batas waktu rekrutmen penyelenggara pemilu harus selesai pada 2027. Sementara masa jabatan mereka berakhir pada 2023, atau pasca-pemilu lokal pada 2031. &ldquo;Sehingga memang perlu sesegera mungkin dilakukan revisi Undang-Undang Pemilu ke depan, dengan menggabungkan paket Undang-Undang Pemilu dengan Undang-Undang Pilkada,&rdquo; kata Heroik. Pada Kamis, 26 Juni 2025, MK menyatakan penyelenggaraan pemilu di tingkat nasional harus dilakukan terpisah dengan penyelenggaraan pemilu tingkat daerah atau kota (pemilu lokal). MK memutuskan pemilu lokal diselenggarakan paling singkat 2 tahun atau paling lama 2,5 tahun setelah pemilu nasional.&nbsp; Pemilu nasional adalah pemilu anggota DPR, DPD, dan presiden dan wakil presiden, sementara pemilu lokal terdiri atas pemilu anggota DPRD provinsi/kabupaten/kota serta pemilihan kepala dan wakil kepala daerah. Dengan putusan itu, pemilu serentak yang selama ini dikenal sebagai &ldquo;pemilu 5 kotak&rdquo; tidak lagi berlaku untuk pemilu 2029. Artinya, pemilihan kepala daerah tak dilakukan pada tahun yang sama, namun bakal dihelat pada 2031. Sementara itu, DPR memproyeksikan bahwa revisi UU Pemilu tidak akan dibahas dalam masa sidang ke-IV tahun 2024-2025. ""Mungkin untuk RUU Pemilu belum kami bahas pada sidang ini karena kami masih juga secara informal berbicara antarfraksi,"" ujar Wakil Ketua DPR Sufmi Dasco Ahmad di kompleks parlemen, Jakarta, pada Kamis, 26 Juni 2025. Pilihan Editor: Kata MK soal Pemilu yang Berdekatan: Parpol Mudah Terjebak Pragmatisme",Penulis tidak ditemukan,https://www.tempo.co/politik/perludem-ingatkan-urgensi-revisi-uu-pemilu-usai-putusan-mk-soal-pemisahan-pemilihan-1835366,Tanggal tidak ditemukan
YLKI Minta Mafia Beras Dihukum | tempo.co,"TEMPO.CO, Jakarta&nbsp; - Yayasan Lembaga Konsumen Indonesia (YLKI) meminta pemerintah untuk menindak tegas para mafia beras yang terbukti bertindak curang, seperti ketidaksesuaian ketentuan mutu, berat, dan harga eceran tertinggi (HET), serta tidak teregistrasi Pangan Segar Asal Tumbuhan (PSAT). Sebagaimana diketahui sebelumnya, Menteri Pertanian Andi Amran Sulaiman mengungkapkan praktik curang oleh 212 merek beras yang berpotensi merugikan konsumen hingga Rp 99,35 triliun per tahun.&nbsp; Ketua YLKI Niti Emiliana mengatakan, temuan ini menunjukkan pelanggaran terhadap Peraturan Menteri Pertanian Nomor 31 Tahun 2017 maupun Peraturan Badan Pangan Nasional Nomor 5 Tahun 2024 tentang Perubahan Atas Peraturan Badan Pangan Nasional Nomor 7 Tahun 2023 Tentang Harga Eceran Tertinggi Beras. ""YLKI sangat menyesalkan adanya temuan tersebut, karena ini menunjukan hak-hak konsumen diabaikan secara terang benderang,"" ujarnya dalam keterangan tertulis yang diterima Tempo, Sabtu, 28 Juni 2025. YLKI minta pemerintah untuk mengawasi ketat peredaran beras di pasaran agar kualitas maupun kuantitasnya sesuai. Pemerintah juga diminta tidak segan-segan memberikan sanksi kepada pelaku usaha yang tidak mematuhi standar.&nbsp; Dia menegaskan tidak ada posisi tawar bagi oknum penjual beras yang tidak sesuai standar dan dilakukan secara berulang mendulang keuntungan yang tinggi. ""Terhadap pelaku seperti ini, pemerintah seharusnya tidak berpikir dua kali untuk menjatuhkan sanksi yang tegas,"" kata Niti. YLKI juga meminta pemerintah menindak tegas pelaku usaha beras yang terbukti merugikan konsumen hingga triliunan per tahun. Jika beras yang dijual tidak sesuai dengan standar, maka pelaku usaha terancam lima tahun kurungan penjara dan denda Rp 2 miliar, berdasarkan Pasal 8 Undang-Undang (UU) Nomor 8 Tahun 1999 tentang Perlindungan Konsumen.&nbsp; Niti menyatakan, perbuatan curang para oknum penjual beras ini akan menurunkan kepercayaan konsumen terhadap kualitas beras di pasaran. Oleh karena itu, dia meminta pemerintah menjelaskan pada masyarakat terkait dengan kualitas dan kuantitas komoditi beras yang dijual di pasaran Menurut YLKI, sudah waktunya pemerintah merevisi UU Perlindungan Konsumen atau melengkapinya dengan sanksi yang ketat terhadap komoditi penting bagi kehidupan bangsa, termasuk di antaranya bahan pangan. Dia mengingatkan pemerintah harus menjamin perlindungan bagi konsumen dari penggelembungan harga yang melebihi HET, kualitas dan kuantitas yang tidak sesuai standar, hingga proses distribusi macet yang mengakibatkan kelangkaan barang di pasar. Niti mengatakan, masyarakat yang merasa dirugikan oleh praktik curang ini dapat mengadu dan meminta ganti rugi sempadan. YLKI juga meminta pemerintah membuka posko pengaduan konsumen terkait dengan produk beras yang tidak sesuai standar. ""YLKI juga membuka ruang pengaduan bagi konsumen mengenai permasalahan beras di pasaran, hal ini akan menjadi bahan evaluasi yang akan diserahkan kepada pemangku kepentingan,"" ujar Niti.&nbsp; Sebelumnya, Mentan Amran mengungkapkan 212 merek beras yang diperiksa di sepuluh provinsi tidak sesuai dengan ketentuan mutu, berat, dan HET. Ia telah melaporkan 212 merek beras itu secara resmi ke Kepala Kepolisian Republik Indonesia (Kapolri) dan Jaksa Agung agar ditindaklanjuti. Berdasarkan perhitungan Kementan, potensi kerugian konsumen beras premium mencapai Rp 34,21 triliun per tahun. Sementara itu, konsumen beras medium berpotensi merugi hingga Rp 65,14 triliun per tahun. ""Dari 13 laboratorium di sepuluh provinsi, kami temukan 85,56 persen beras premium tidak sesuai mutu, 59,78 persen dijual di atas HET, dan 21 persen beratnya tidak sesuai. Ini sangat merugikan masyarakat,&rdquo; kata Amran dalam keterangan tertulis, dikutip Sabtu, 28 Juni 2025. Pilihan Editor: Untung-Rugi Ekspor Listrik ke Singapura",Penulis tidak ditemukan,https://www.tempo.co/ekonomi/ylki-minta-mafia-beras-dihukum-1835336,Tanggal tidak ditemukan
Squid Game Musim Ketiga: Hal-hal Baru dan yang Belum Tuntas | tempo.co,"TEMPO.CO, Jakarta - Serial Squid Game musim ketiga akhirnya tayang pada Jumat, 27 Juni 2025. Serial Korea Selatan yang paling banyak ditonton di platform Netflix ini menjadi&nbsp;babak pamungkas dalam saga permainan bertahan hidup.&nbsp; Dilansir dari Antara,&nbsp;28 Juni 2025, serial garapan Hwang Dong-hyuk ini kembali dengan enam episode yang padat dan menggugah emosi. Netflix secara eksklusif merilis semua episodenya pada pukul 14.00 WIB. Musim ketiga ini melanjutkan kisah Seong Gi-hun (diperankan Lee Jung-jae) yang kembali ke arena Squid Game dengan tekad menghancurkannya dari dalam. Namun, justru ia harus menghadapi konflik batin antara pilihan untuk menyelamatkan seseorang yang tak berdosa atau menyudahi lingkaran kekejaman permainan. Pemenang Mengejutkan: Bayi Jadi Pewaris Hadiah Pemenang Squid Game kali ini bukanlah karakter utama atau pesaing terkuat, melainkan Pemain 222, yakni bayi dari Jun-hee (Jo Yu-ri), satu-satunya yang bertahan hidup dari akhir permainan mematikan ini. Permainan terakhir yang mereka hadapi adalah platform game, tantangan brutal yang mengharuskan pemain mendorong peserta lain agar bisa lolos ke putaran berikutnya. Pada titik klimaks, Gi-hun dan lawannya, Myung-gi (Im Si-wan), terlibat duel yang menegangkan. Myung-gi berniat mengorbankan Gi-hun agar dirinya dan bayinya masuk ke babak akhir dan membawa pulang hadiah 45,6 miliar won. Namun rencana itu digagalkan Gi-hun yang memilih melawan dan menjatuhkan Myung-gi ke kematiannya. Sayangnya, karena keduanya lupa memulai permainan terakhir secara resmi, seseorang masih harus mati agar pemenang bisa ditentukan. Dalam momen penuh haru, Gi-hun mengorbankan dirinya demi menyelamatkan bayi itu. &ldquo;Kita bukan kuda. Kita manusia,&rdquo; ujar Gi-hun sebelum jatuh, meninggalkan pesan perlawanan terhadap sistem kejam yang memanusiakan penderitaan sebagai tontonan. Nasib Detektif dan Misteri yang Masih Menggantung Detektif Hwang Jun-ho (Wi Ha-joon) akhirnya berhasil menyusup ke pulau tempat permainan berlangsung. Dengan bantuan pemain yang melarikan diri, Jun-ho mengkonfrontasi saudaranya sendiri, In-ho (Lee Byung-hun), yang memimpin permainan.&nbsp; Namun, tak ada penjelasan berarti dari In-ho. Ia berhasil lolos dari pulau tersebut sambil menyelamatkan Player 222 sebelum pulau diledakkan. Enam bulan setelah permainan, ia menerima bayi tersebut di apartemennya, bersama ATM card berisi hadiah besar. Jun-ho kini memikul tanggung jawab baru menjadi ayah dari pemenang Squid Game. No-eul dan Akhir Pahit Pencarian Keluarga No-eul (Park Gyu-young), seorang ibu asal Korea Utara, berhasil menyelamatkan Gyeong-seok (Lee Jin-wook) dan anaknya. Namun kabar duka datang: suami dan anak kandungnya telah meninggal.&nbsp; Meski begitu, harapan palsu kembali muncul saat ia menerima kabar keluarganya terlihat di Cina. Episode terakhir menampilkan No-eul naik pesawat dengan ragu, mencerminkan tekad seorang ibu yang tak kunjung padam, meski kemungkinan besar ia tengah ditipu. Akhir Terbuka: Squid Game Menuju Amerika Musim ketiga ditutup dengan adegan mencengangkan di Los Angeles. Sang Front Man, In-ho, terlihat menyaksikan seorang wanita asing bermain ddakji&mdash;permainan yang menjadi alat rekruitmen dalam serial ini.&nbsp; Penonton dikejutkan oleh identitas wanita itu: aktris pemenang Oscar, Cate Blanchett, yang kini menjadi perekrut baru untuk permainan mematikan ini. Hal ini mengindikasikan lokasi Squid Game bisa saja berpindah ke Amerika Serikat. Meski Hwang Dong-hyuk sebelumnya menyebut musim ketiga sebagai penutup, munculnya karakter baru dan ekspansi latar menandakan potensi spin-off atau adaptasi global. Dengan potensi cerita yang berpindah ke Amerika Serikat dan kemunculan karakter baru seperti yang diperankan Cate Blanchett, dunia Squid Game sepertinya belum sepenuhnya berakhir.&nbsp; Pilihan Editor: Tambang Nikel Raja Ampat Memicu Konflik Suku Kawe",Penulis tidak ditemukan,https://www.tempo.co/teroka/squid-game-musim-ketiga-hal-hal-baru-dan-yang-belum-tuntas-1835370,Tanggal tidak ditemukan
Kata MK soal Pemilu yang Berdekatan: Parpol Mudah Terjebak Pragmatisme | tempo.co,"MAHKAMAH Konstitusi atau MK mengabulkan uji materi terhadap Undang-Undang Nomor 7 Tahun 2017 tentang Pemilu dan UU Nomor 10 Tahun 2016 tentang Pilkada. Uji materi itu diajukan oleh Perkumpulan untuk Pemilu dan Demokrasi (Perludem). MK memutuskan penyelenggaraan pemilu di tingkat nasional harus dilakukan terpisah dengan penyelenggaraan pemilu tingkat daerah atau kota (pemilu lokal). Mahkamah memutuskan pemilu lokal diselenggarakan paling singkat 2 tahun atau paling lama 2,5 tahun setelah pemilu nasional. Pemilu nasional adalah pemilu anggota DPR, DPD, dan presiden dan wakil presiden, sementara pemilu lokal terdiri atas pemilu anggota DPRD provinsi/kabupaten/kota serta pemilihan kepala dan wakil kepala daerah. Dengan putusan MK itu, pemilu serentak yang selama ini dikenal sebagai &ldquo;Pemilu 5 kotak&rdquo; tidak lagi berlaku untuk Pemilu 2029. &ldquo;Penentuan keserentakan tersebut untuk mewujudkan pemilu berkualitas serta memperhitungkan kemudahan dan kesederhanaan bagi pemilih dalam melaksanakan hak memilih sebagai wujud pelaksanaan kedaulatan rakyat,&rdquo; ujar Ketua MK Suhartoyo saat membacakan Putusan Nomor 135/PUU-XXII/2024 di Ruang Sidang Pleno MK, Jakarta, Kamis, 26 Juni 2025. Dalam salah satu pertimbangan hukumnya, Mahkamah menyatakan tahapan pemilu anggota DPR, anggota DPD, presiden/wakil presiden, dan anggota DPRD yang berada dalam rentang waktu kurang dari 1 tahun dengan pilkada berimplikasi pada stabilitas partai politik (parpol). Khususnya berkaitan dengan kemampuan partai mempersiapkan kader yang akan maju dalam kontestasi pemilu. Akibatnya, Hakim Konstitusi Arief Hidayat mengatakan parpol mudah terjebak dalam pragmatisme dibanding keinginan menjaga idealisme dan ideologi partai. Mahkamah juga menilai parpol tidak memiliki waktu yang cukup untuk merekrut calon anggota legislatif untuk tiga level sekaligus. Apalagi, bagi partai politik yang juga harus mempersiapkan kadernya untuk berkontestasi dalam pemilihan umum presiden-wakil presiden. &ldquo;Hal itu menyebabkan perekrutan untuk pencalonan jabatan-jabatan politik dalam pemilihan umum membuka lebar peluang yang didasarkan pada sifat transaksional,"" ujar Arief. Dari sisi pemilih, MK mempertimbangkan waktu penyelenggaraan pemilu nasional yang berdekatan dengan waktu pilkada berpotensi membuat pemilih jenuh dengan agenda pemilu, sehingga secara tidak sadar berpengaruh pada kualitas pilihan. Mahkamah juga mempertimbangkan pemilu nasional yang berdekatan dengan pemilu daerah menyebabkan minimnya waktu bagi masyarakat menilai kinerja pemerintahan dalam hasil pemilu nasional. Selain itu, dalam rentang waktu yang sempit itu, hakim menilai pelaksanaan pemilu yang serentak menyebabkan masalah pembangunan daerah cenderung tenggelam di tengah isu nasional. Padahal, menurut MK, masalah pembangunan di setiap provinsi dan kabupaten/kota harus tetap menjadi fokus dan tidak boleh dibiarkan tenggelam. &ldquo;Di tengah isu dan masalah pembangunan yang ditawarkan oleh para kandidat yang tengah bersaing untuk mendapatkan posisi politik di tingkat pusat harus tetap utama,&rdquo; kata Wakil Ketua MK Saldi Isra. Ketua Badan Riset dan Inovasi Strategis Partai Demokrat Ahmad Khoirul Umam menilai putusan MK ihwal pemisahan pemilu nasional dan daerah berpotensi memicu perpanjangan siklus ketegangan politik. Dia mengatakan penyelenggaraan pemilu yang tidak lagi serentak akan membuat suasana kompetisi berlangsung lebih panjang dan berpotensi mengganggu stabilitas sosial, politik, dan pemerintahan. &ldquo;Ketidaksinkronan pelantikan pejabat juga menimbulkan masalah koordinasi dalam perumusan dan pelaksanaan kebijakan lintas level,&rdquo; kata Umam dalam keterangan tertulisnya pada Sabtu, 28 Juni 2025. Dia melanjutkan putusan ini juga memunculkan fragmentasi siklus politik nasional dan daerah. Sebab, selama ini calon anggota legislatif di tingkat nasional dan daerah kerap bekerja sama dalam konteks menggarap basis konstituen di masing-masing daerah pemilihan. Dengan adanya pemisahan, kata dia, maka para caleg di tingkat nasional akan bekerja lebih keras menjangkau basis pemilih di daerah karena tidak lagi memiliki kerja sama dengan caleg di daerah yang notabene memiliki dukungan mengakar mesin partai. &ldquo;Ini bisa menciptakan politik biaya tinggi,&rdquo; ujar Umam. Dia menuturkan putusan MK juga berpotensi memperdalam garis pemisah koordinatif antara pusat dan daerah. Sebab, corak federalisme akan menguat di daerah karena terdorong dinamika politik lokal. &ldquo;Sehingga perlu ada kebijakan transisional yang menjamin kohesivitas sistem pemerintahan nasional secara keseluruhan,"" ucap Umam. Meski demikian, dia mengatakan partainya menghormati putusan Mahkamah. Alasannya, mengurangi kompleksitas pemilu serentak yang dapat berimplikasi positif dalam menjadikan sistem kaderisasi partai lebih terstruktur, hingga pendekatan kepada basis pemilih berjalan lebih adaptif. Adapun Ketua Majelis Pertimbangan Pusat Partai Keadilan Sejahtera (PKS) Mulyanto mendorong Komisi II DPR agar segera membahas revisi UU Pemilu. Alasannya, putusan MK yang memisahkan penyelenggaraan pemilu nasional dan daerah akan menyebabkan terjadinya perpanjangan masa jabatan, khususnya bagi anggota DPRD. &ldquo;Karena itu, penting untuk dibahas segera revisi UU Pemilu untuk mengadopsi putusan ini dengan ideal,&rdquo; kata dia melalui pesan pendek, Sabtu. Dia melanjutkan, selain UU Pemilu, UU Pilkada juga menjadi perhatian penting yang harus segera dibahas oleh DPR guna membuat perpanjangan masa jabatan DPRD tidak berlangsung lebih lama. Sementara itu, Ketua Komisi II DPR Rifqinizamy Karsayuda mengatakan komisinya masih menunggu arahan dan keputusan pimpinan DPR untuk menindaklanjuti putusan MK itu. Politikus Partai NasDem itu mengatakan, sebagai opsi mengisi kekosongan jabatan di daerah imbas putusan ini, kepala daerah yang masa jabatannya berakhir di 2029 bisa diganti oleh penjabat sementara atau Pjs. ""Tetapi, untuk DPRD kan tidak bisa pakai Pjs,&rdquo; kata dia melalui pesan suara, Sabtu. Satu-satunya opsi untuk DPRD, kata dia, adalah dengan memperpanjang masa jabatannya hingga terlaksana pemilu daerah di 2031. Karenanya, menurut dia, amat diperlukan pembahasan segera revisi UU Pemilu. &ldquo;Hal seperti ini yang menjadi concern kami dalam pembahasan revisi UU Pemilu. Soal waktu, kami menunggu arahan pimpinan DPR dulu,&rdquo; ujarnya. Pilihan editor: Alasan Kemendagri Kaji Penggabungan Retret Kepala Daerah dan Sekda",Penulis tidak ditemukan,https://www.tempo.co/politik/kata-mk-soal-pemilu-yang-berdekatan-parpol-mudah-terjebak-pragmatisme-1835359,Tanggal tidak ditemukan
Prabowo Panggil Bahlil ke Hambalang | tempo.co,"TEMPO.CO, Jakarta -&nbsp;Presiden Prabowo Subianto memanggil Menteri Energi dan Sumber Daya Mineral (ESDM) Bahlil Lahadalia ke kediaman pribadinya di Hambalang, Sentul, Bogor, Jawa Barat pada Sabtu, 28 Juni 2025. Informasi disampaikan Bahlil saat memberikan sambutan dalam acara HUT ke-47 Angkatan Muda Pembaharuan Indonesia (AMPI) di Kantor DPP Partai Golkar, Jakarta Barat, Sabtu, 28 Juni 2025. Bahlil mengatakan, tidak bisa lama-lama memberikan sambutan. Ketua Umum Partai Golkar itu mengaku dipanggil 'bos'. ""Saya dipanggil bos (Presiden Prabowo). Jadi enggak bisa lama-lama,"" kata Bahlil dipantau melalui story Instagram milik Ketua Umum DPP AMPI Jerry Sambuaga, @Jerry Sambuaga, Sabtu, 28 Juni 2025. Sementara itu, dalam sambutannya, Ketua AMPI Jerry Sambuaga mengatakan, tidak bisa lama-lama memberikan sambutan karena Bahlil sudah ada kegiatan. Bahlil disebut dipanggil Prabowo ke Hamblang.&nbsp; ""Pak Ketum habis ini akan ada acara dengan Presiden di Hambalang, saya mungkin langsung saja kepada teman-teman yang Cipayung ini di belakang, "" kata Jerry dipantau akun Instagram miliknya.&nbsp; Tempo sudah mencoba mengkonfirmasi kegiatan itu kepada Sekretaris Kabinet (Seskab) Teddy Indra Wijaya. Namun, Teddy belum merespons.&nbsp; Prabowo sebelumnya sempat berkelakar kepada Bahlil Lahadalia dalam peresmian pengoperasian dan pembangunan energi terbarukan di 15 Provinsi yang dipusatkan di PLTP Blawan Ijen Unit 1, Bondowoso, Jawa Timur, Kamis, 26, Juni 2025. Kepala negara mengatakan Bahlil sebagai warga Papua beruntung bisa menjadi menteri.&nbsp; ""Nasib kau baik jadi menteri,"" kata dia dipantau via YouTube Sekretariat Presiden, Kamis, 26 Juni 2026.&nbsp; Bahlil Lahadalia sebelumnya dalam laporannya menyampaikan bahwa proyek-proyek itu mencakup total kapasitas 379,7 megawatt dengan nilai investasi sekitar Rp25 triliun. Dia juga menjelaskan bahwa proyek tersebut dapat mendorong pertumbuhan industri lokal dengan tingkat kandungan dalam negeri (TKDN) mencapai 40 persen serta menyerap lebih dari 9.500 tenaga kerja secara nasional, termasuk 1.404 tenaga kerja di Ijen. Pilihan Editor: Prabowo Puji Menteri Bahlil: Bekerja Sangat Baik",Penulis tidak ditemukan,https://www.tempo.co/politik/prabowo-panggil-bahlil-ke-hambalang-1835319,Tanggal tidak ditemukan
Persiapan Stadion Si Jalak Harupat Jelang Piala Presiden 2025 | tempo.co,,Penulis tidak ditemukan,https://www.tempo.co/foto/arsip/persiapan-stadion-si-jalak-harupat-jelang-piala-presiden-2025-1835360,Tanggal tidak ditemukan
Penyedia Layanan Jastip di Pameran Mommy N Me | tempo.co,,Penulis tidak ditemukan,https://www.tempo.co/foto/arsip/penyedia-layanan-jastip-di-pameran-mommy-n-me-1835354,Tanggal tidak ditemukan
KPK Tetapkan Lima Tersangka Korupsi Proyek Jalan di Sumatera Utara | tempo.co,,Penulis tidak ditemukan,https://www.tempo.co/foto/arsip/kpk-tetapkan-lima-tersangka-korupsi-proyek-jalan-di-sumatera-utara-1835348,Tanggal tidak ditemukan
