Title,FullText,Author,Url,Date
"KPK Terima Informasi Gratifikasi di Kementerian PU, Pegawai Dimintai Uang oleh ASN untuk Kepentingan Pribadi","JAKARTA, KOMPAS.com -Komisi Pemberantasan Korupsi (KPK) mendapat informasidugaan gratifikasidiKementerian Pekerjaan Umum(PU). Juru Bicara KPKBudi Prasetyomengatakan, ada dugaan gratifikasi dengan modus permintaan uang oleh salah satu penyelenggara negara kepada jajarannya untuk kepentingan pribadi. Budi mengatakan, informasi tersebut adalah hasil investigasi yang dilakukan oleh Inspektorat Jenderal Kementerian PU. Baca juga:KPK Kembalikan Rp 53 Miliar ke Kas Negara dari Hasil Lelang Barang Rampasan Koruptor ""KPK mendapatkan informasi adanya dugaan praktik gratifikasi di Kementerian PU, dengan modus permintaan uang oleh salah seorang penyelenggara negara atau pegawai negeri, kepada pegawai di jajarannya, yang akan digunakan untuk kepentingan pribadi,"" kata Budi dalam keterangannya, Kamis (29/5/2025). Budi mengatakan, KPK melalui Direktorat Gratifikasi dan Pelayanan Publik Kedeputian Pencegahan dan Monitoring, pada kesempatan pertama, akan berkoordinasi dengan Inspektorat Jenderal ataupun Inspektur Investigasi Kementerian PU. KPK akan melakukan analisis atas temuan investigasi tersebut. ""KPK apresiasi langkah cepat Inspektorat dalam memproses dugaan pelanggaran ini,"" ujarnya. Baca juga:Kasus Korupsi Izin TKA, KPK Buka Peluang Koordinasi dengan Imigrasi Lebih lanjut, Budi mengatakan, KPK terus mengingatkan kepada para penyelenggara negara dan aparatur sipil negara (ASN) untuk tidak menerima/memberi gratifikasi. ""Bahkan sebelumnya, pada Selasa (27/5), KPK juga telah mengadakan monitoring dan evaluasi (monev) terkait pencegahan dan pengendalian gratifikasi bagi seluruh kementerian, lembaga, BUMN, dan BUMD,"" ucap dia.",Penulis tidak ditemukan,https://nasional.kompas.com/read/2025/05/29/19543751/kpk-terima-informasi-gratifikasi-di-kementerian-pu-pegawai-dimintai-uang,"Kompas.com- 29/05/2025, 19:54 WIB"
Menag Janji Bantu Penerbitan Visa Haji Furoda Tahun Ini,"JAKARTA, KOMPAS.com- Menteri Agama (Menag) RINasaruddin Umarberjanji akan mengupayakan agarvisa haji furodacalon jemaah haji Indonesia dapat terbit tahun ini. Nasaruddin mengatakan,Kementerian Agama(Kemenag) akan membantu untuk berkomunikasi dengan Pemerintah Arab Saudi. ""Sudah, sudah (komunikasi) terus. Siang malam kami komunikasi,"" ungkap Nasaruddin saat ditemui di Kantor Kementerian Agama, Jakarta Pusat, Kamis (29/5/2025). Terkait keputusan penerbitan visa furoda ini, kata Nasaruddin, bukan kewenangan Kementerian Agama (Kemenag), tetapi ranah dari otoritas Pemerintah Arab Saudi. Baca juga:Perbedaan Haji Furoda dan Haji Plus: Biaya, Fasilitas, dan Masa Tunggu ""Iya, kami lagi menunggu Saudi. Itu kan di luar kewenangan kami, tapi kami akan bantu Insya Allah,"" kata Nasaruddin. Sebelumnya, visa haji furoda atau perorangan tidak terbit tahun ini. Alternatifnya, jemaah disarankan untuk beralih mendaftar haji khusus. ""PIHK (Penyelenggara Ibadah Haji Khusus) sebaiknya menyarankan kepada jemaah untuk beralih mendaftar haji khusus,"" dikutip dari surat edaran resmi Asosiasi Muslim Penyelenggara Haji dan Umrah Republik Indonesia (AMPHURI), yang Kompas.com konfirmasi melalui Ketua Umum AMPHURI, Firman M. Nur, pada Kamis (29/5/2025). Pihak AMPHURI juga sudah berkoordinasi dengan Dirjen Penyelenggaraan Haji dan Umrah Kementerian Agama, serta Kantor Urusan Haji (KUH) di Jeddah. ""Diperoleh jawaban lisan dan tertulis bahwa 'visa issuance has been ended this season'(penerbitan visa telah berakhir musim ini),"" katanya. Baca juga:Visa Haji Furoda Tidak Terbit Tahun Ini, Jemaah Bisa Daftar Haji Khusus Sebagai informasi, ada dua jenis visa yang digunakan untuk berangkat ibadah haji. Pertama, visa haji yang diberikan oleh Pemerintah Arab Saudi ke Pemerintah Indonesia, yang pada 2025 kuotanya sebanyak 221.000. Kedua, ada visa haji non-kuota, yang mana bisa diperoleh melalui beberapa jalur, salah satunya yaitu jalur furoda atau perorangan. Mengingat visa haji furoda bersifat non-kuota, maka tidak ada jumlah pasti kuota yang diberikan setiap tahunnya. Selain itu, keberangkatan jemaah juga baru dapat dipastikan setelah visa dan tiket pesawat terbit.",Penulis tidak ditemukan,https://nasional.kompas.com/read/2025/05/29/16163541/menag-janji-bantu-penerbitan-visa-haji-furoda-tahun-ini,"Kompas.com- 29/05/2025, 16:16 WIB"
Anggota DPR: Perpanjangan Usia Pensiun ASN Pasti Ada Dampak Negatif,"JAKARTA, KOMPAS.com- AnggotaKomisi IIDPR Indrajaya menilai, perpanjangan usia pensiun aparatur sipil negara (ASN) tentunya akan menimbulkan dampak negatif. Oleh sebab itu, perlu adanya kajian komprehensif dalam menyikapi usulan Korps Pegawai Republik Indonesia (Korpri). ""Perpanjangan usia pensiun sudah pasti ada dampak negatif, terutama gangguan pada sistem meritokrasi untuk memperoleh SDM yang unggul dari sisi kemampuan fisik, kreativitas, dan produktivitas,"" ujar Indrajaya lewat keterangan tertulisnya, Kamis (29/5/2025). Baca juga:Pimpinan DPR: Usulan Penambahan Usia Pensiun ASN Perlu Pertimbangkan Efektivitas Kerja Jikausia pensiun ASNmenjadi maksimal 70 tahun, tentu hal tersebut akan mengganggu produktivitas pelayanan ke masyarakat. Apalagi angka 70 tahun sudah masuk ke dalam kategori lanjut usia (lansia). ""Bertambahnya usia manusia juga pasti akan menurunkan kemampuan fisik dan mental yang pasti menurunkan produktivitas dan kualitas pekerjaan,"" ujar Indrajaya. Di samping itu, bertambahnya usia pensiun ASN akan mengurangi kesempatan bagi anak-anak muda untuk bekerja di pemerintahan. ""Tentu akan sangat tidak adil bila perpanjangan usia ini akan mengurangi kuota penerimaan ASN atau pejabat negara dalam tiap tahun,"" ujar politikus Partai Kebangkitan Bangsa (PKB) itu. Baca juga:Usulan Usia Pensiun ASN Diperpanjang Tak Masuk Revisi UU ASN Sebelumnya, Ketua Umum Korpri Zudan Arif Fakrulloh mengusulkan agar penambahan batas usia pensiun itu berbeda-beda disesuaikan dengan pangkat masing-masing ASN. Salah satunya untuk Jabatan Fungsional Utama yang diusulkan batas usia pensiunnya menjadi 70 tahun. Selanjutnya, Jabatan Pimpinan Tinggi (JPT) Pratama atau setingkat eselon II batas usia pensiunnya menjadi 62 tahun. Kemudian, eselon III dan IV menjadi 60 tahun. ""Korpri mengusulkan agar Pejabat Pimpinan Tinggi atau JPT Utama mencapai usia 65 tahun, JPT Madya atau eselon I mencapai BUP (batas usia pensiun) 63 tahun,"" kata Zudan, dalam keterangan pers, Kamis (22/5/2025). Baca juga:Istana Respons Usulan Usia Pensiun ASN Diperpanjang hingga 70 Tahun Ia menjelaskan, perpanjangan batas usia pensiun bertujuan untuk mendorong keahlian dan karier pegawai ASN yang berada pada jabatan struktural maupun fungsional. ""Pengusulan kenaikan BUP ini bertujuan agar mendorong keahlian dan karier pegawai ASN,"" ujar Zudan.",Penulis tidak ditemukan,https://nasional.kompas.com/read/2025/05/29/14552121/anggota-dpr-perpanjangan-usia-pensiun-asn-pasti-ada-dampak-negatif,"Kompas.com- 29/05/2025, 14:55 WIB"
Gubernur Koster: Saya Minta Produksi Air Minum Kemasan di Bawah 1 Liter Disetop,"DENPASAR, KOMPAS.com-Gubernur BaliIWayan Kostermemanggil para produsenair minum dalam kemasan(AMDK) pada Kamis (29/5/2025). Dalam rapat yang berlangsung di Gedung Kertasabha, Jayasabha, Denpasar, itu Koster meminta para produsen agar berhenti memproduksi dan menjual AMDK berukuran di bawah satu liter. “Saya minta produksinya dihentikan. Hanya bisa habiskan produk yang sudah diproduksi sampai Desember 2025. Semuanya, jadi Januari 2026 tidak boleh ada lagi,” tegas Koster. Baca juga:Larangan Kemasan Plastik, Keluhan Pedagang di Bali: Kalau Tidak Diplastiki, Pakai Apa Bungkus Dagangan Saya? Dia menegaskan, tindakan ini untuk menekan penggunaan sampah plastik sekali pakai. Pengolahan sampah dan pembatasan sampah plastik ini disebutnya sudah masuk prioritas Kementerian Lingkungan Hidup. Koster meminta produsen mematuhi Surat Edaran (SE) Gubernur Bali Nomor 9 Tahun 2025 tentang Gerakan Bali Bersih Sampah. Dia menegaskan, produksi AMDK di bawah satu liter harus dihentikan dengan pertimbangan utama untuk menjaga kelestarian lingkungan dan ekosistem di Pulau Dewata. Baca juga:Turis Asing Setuju Tak Ada Air Minum dalam Kemasan Kecil di Bali, Less Plastic! Kapasitas tempat pembuangan akhir (TPA) di Bali kini nyaris penuh dan didominasi oleh sampah plastik sekali pakai, khususnya kemasan air mineral. Program ini dipastikannya akan terus berjalan, terlebih karena sudah mendapat dukungan penuh pemerintah pusat. Koster mengaku Kementerian Lingkungan Hidup berencana memindahkan Hari Lingkungan Hidup ke Bali. Baca juga:Pemprov Bali Larang Air Kemasan Plastik di Bawah 1 Liter, Pedagang Mengaku Kesulitan Dengan begitu, Bali akan jadi percontohan nasional karena kebijakan-kebijakan pro lingkungan yang telah berjalan. “Tanggung jawab saya menyiapkan generasi penerus, juga menyiapkan ekosistemnya, peradabannya, untuk dilanjutkan sepanjang hayat. Bali ini banyak dilirik wisatawan karena ekosistem dan budaya bagus,"" kata dia ""Kalau rusak, tidak ada yang datang, tidak akan bisa orang berinvestasi. Wisatawan tidak datang, ekonomi tidak akan tumbuh,"" tambahnya.",Penulis tidak ditemukan,https://denpasar.kompas.com/read/2025/05/30/053658578/gubernur-koster-saya-minta-produksi-air-minum-kemasan-di-bawah-1-liter,"Kompas.com- 30/05/2025, 05:36 WIB"
"MK Putuskan Biaya SD-SMP Gratis, Pengamat: Jangan Sampai Pendidikan yang Penting Ada Bangku, Papan Tulis, Kapur...","SEMARANG, KOMPAS.com- Kalangan akademisi di Indonesia menyambut positif putusanMahkamah Konstitusi(MK) yang mewajibkan pemerintah untuk menggratiskan pendidikan dasar dan menengah selama sembilan tahun di sekolah swasta. Pengamat Pendidikan Universitas Islam Sultan Agung (Unissula) Semarang, Turahmat, menilai kebijakan ini menunjukkan komitmen negara dalam pemenuhan hak anak untuk mendapatkan akses layanan pendidikan yang layak. ""Putusan itu sangat melegakan karena artinya pemerintah memberikan perhatian yang lebih terhadap dunia pendidikan kita,"" ujar Turahmat melalui sambungan telepon, Kamis (29/5/2025). Baca juga:Respons Putusan MK soal Sekolah Gratis, Warga NTT: Kabar Baik bagi Kami yang Susah Meski demikian, Turahmat menegaskan bahwa kewajiban pemerintah untuk membiayai pendidikan disekolah swastatidak hanya sebatas membuka akses, tetapi juga harus menjamin mutu pendidikan yang layak. ""Di Jawa ada dogma ono rego, ono rupo (ada harga, ada kualitas). Nah, itu tidak boleh berlaku di pendidikan. Sekolah negeri maupun swasta harus berada pada kualitas yang sama,"" tuturnya. Ia juga menyoroti tren penurunan kualitas layanan pendidikan di sekolah negeri. Menurut Turahmat, tidak sedikit sekolah negeri yang kalah bersaing dengan sekolah swasta, baik dari segi kualitas pengajaran maupun sarana prasarana. Oleh karena itu, ia mendorong agar kebijakan penggratisan biaya pendidikan tidak menjadi alasan bagi pemerintah untuk mengurangi anggaran atau perhatian terhadap mutu pendidikan. ""Jangan sampai ini hanya soal gratis. Yang penting ada bangku, papan tulis, kapur tinggal oret-oret. Itu bahaya kalau sampai begitu,"" imbaunya. Lebih lanjut, Turahmat menekankan pentingnya standar pendidikan yang mengikuti perkembangan teknologi dan kecerdasan buatan. Ia menegaskan bahwa pendidikan harus dilengkapi dengan infrastruktur digital yang memadai. ""Kalau sekarang musimnya orang pakai AI, ya semuanya ke sana. Pakai IT, ya semuanya ke sana.Pendidikan gratistidak boleh menurunkan mutu pendidikan di Republik ini,"" lanjutnya. Turahmat berharap putusan MK dapat dijalankan secara menyeluruh. Baca juga:MK Putuskan Biaya SD-SMP Swasta Gratis, Pemprov Jateng: Pemerintah Harus Penuhi Selain membebaskan biaya pendidikan, negara juga harus menjamin kualitas pengajaran dan fasilitas pendukungnya. ""Kalau pemerintah sudah menggratiskan, maka kualitasnya juga harus paripurna. Itu syarat mutlak agar pendidikan benar-benar mencerdaskan bangsa,"" tandasnya.",Penulis tidak ditemukan,https://regional.kompas.com/read/2025/05/29/191712078/mk-putuskan-biaya-sd-smp-gratis-pengamat-jangan-sampai-pendidikan-yang,"Kompas.com- 29/05/2025, 19:17 WIB"
"Baku Tembak Thailand-Kamboja, Panglima Militer Kedua Kubu Bertemu","KHMER, KOMPAS.com- Panglima militer Thailand dan Kamboja dijadwalkan bertemu pada Kamis (29/5/2025), menyusul insiden baku tembak di wilayah perbatasan yang menewaskan seorangtentara Kamboja. Pertemuan ini bertujuan meredakan ketegangan yang kembali mencuat di kawasan sensitif tersebut. Perdana Menteri Thailand Paetongtarn Shinawatra menekankan pentingnya menahan diri dan mencari jalan damai. Baca juga:Kronologi Baku Tembak Thailand-Kamboja, 10 Menit Langsung Gencatan Senjata “Kedua pihak harus tetap tenang dan berdiskusi untuk melihat apa yang dapat kita sepakati,” ujarnya kepada wartawan, dikutip dari kantor beritaAFP. Senada dengan itu, Perdana Menteri Kamboja Hun Manet menyampaikan harapan bahwa pertemuan kedua komandan militer akan menghasilkan hasil positif. Hal tersebut ia ungkapkan melalui unggahan di akun Facebook miliknya. Menteri Pertahanan Thailand, Phumtham Wechayachai, mengatakan bahwa pembicaraan dijadwalkan berlangsung pada Kamis sore. Ia menyebut insiden yang terjadi sebelumnya sebagai kesalahpahaman oleh kedua pihak. Seorang tentara Kamboja dilaporkan tewas dalam insiden baku tembak dengan pasukan Thailand di perbatasan pada Rabu (28/5/2025). Juru bicara Angkatan Darat Kerajaan Kamboja, Mao Phalla, mengatakan bahwa bentrokan terjadi di wilayah Preah Vihear, sebelah utara negara itu. “Tentara kami tewas di parit. Orang Thailand datang untuk menyerang kami,” kata Mao Phalla. Sementara itu, pihak militer Thailand mengeklaim insiden bermula dari tembakan yang dilepaskan pasukan Kamboja. Thailand kemudian membalas, memicu baku tembak selama sekitar sepuluh menit, sebelum pihak Kamboja disebut mengusulkan gencatan senjata. Insiden semacam ini tergolong langka di sepanjang garis perbatasan yang sensitif antara kedua negara. Padahal, beberapa hari sebelumnya, pemimpin kedua negara baru saja menghadiri KTT ASEAN dan menyatakan komitmen untuk memperkuat kerja sama regional. Baca juga:China dan Kamboja Mulai Gelar Latihan Militer Terbesar Thailand dan Kamboja sejak lama berselisih mengenai batas wilayah sepanjang lebih dari 800 kilometer yang sebagian besar ditentukan semasa pendudukan Perancis di kawasan Indochina.",Penulis tidak ditemukan,https://www.kompas.com/global/read/2025/05/29/155950370/baku-tembak-thailand-kamboja-panglima-militer-kedua-kubu-bertemu,"Kompas.com- 29/05/2025, 15:59 WIB"
